image	caption
000000274606.jpg	a surfboard riding shoe , vase beach of a middle .
000000274642.jpg	a down forest by a cutting zebra a fork , cake .
000000274779.jpg	a pots hit of pizza group , a from bicycle .
000000274789.jpg	a male of steps crossing , a served and bread .
000000274881.jpg	a wine of pizza street , tree of a bread .
000000274894.jpg	a top umbrella zebra a top , tree of cake .
000000274949.jpg	a that stop a phone half , a phone water .
000000275115.jpg	a in grass a in two crossing with a bread .
000000275168.jpg	a desk riding para with a desk with a desk .
000000275190.jpg	a bench being towards a view by a boats .
000000275242.jpg	a top umbrella zebra a top , tree of cake .
000000275253.jpg	a game of feeder sitting two forest , vase them .
000000275271.jpg	a close zebra a zebras the an the grass a zebras .
000000275292.jpg	a game of mouth two onto with a wooded .
000000275325.jpg	a ball his , tree of a airplane cutting .
000000275398.jpg	a ball riding his , a people zebra a ball , cake .
000000275409.jpg	a dogs , a body with a car bike .
000000275441.jpg	a brown shoe other train a shoes zebra a shoes .
000000275448.jpg	a that some a hat , tree of a pot .
000000275488.jpg	a wine of pizza forest side a cutting zebra crowd .
000000275496.jpg	a that riding street , a bicycle zebra a wall grass owl hand .
000000275556.jpg	a wine of pizza forest by a cutting zebra sits .
000000275625.jpg	a that with a off grass soccer street with couple of a pots shoes .
000000275717.jpg	a that holds a off grass soccer street with a sky .
000000275722.jpg	a top umbrella zebra a top , tree of cake .
000000275758.jpg	a rail carriage hand horse their a bicycle .
000000275781.jpg	a close zebra a zebras the a zebras the grass a cutting .
000000275863.jpg	a dogs street with a bread zebra a to , cake .
000000275895.jpg	a pots playing rack city with vase playing .
000000275929.jpg	a cloudy zebra a photo the counter the grass a surfing .
000000275932.jpg	a persons riding street , a country zebra a persons , cake .
000000276124.jpg	a frisbee ski holds a nearby grass a nearby .
000000276151.jpg	a frisbee that riding men phone , a water .
000000276218.jpg	a flowers glass zebra a school of court dressed flowers cross .
000000276254.jpg	a all of mouth two onto with a wooded .
000000276265.jpg	a that street other train a school of chicken .
000000276283.jpg	a that street other train a down with a bike .
000000276386.jpg	a herd rockefeller forest , tree of a river .
000000276514.jpg	a ball riding forest , a cutting zebra a engine .
000000276554.jpg	a flowers glass forest , a image zebra a camera surfboards .
000000276559.jpg	a that stop a phone half , a phone water .
000000276750.jpg	a down grass a down two street with couple of a shoes .
000000276797.jpg	a pots following city parked vase playing zebra a under little
000000276798.jpg	a down some a building , a blue middle .
000000276835.jpg	green flying two street with couple of a zebras .
000000276893.jpg	a to his , a people zebra a ball , tree of cake .
000000276895.jpg	a cutting zebra a standing of sits grass a stove , cake
000000277026.jpg	a wine of pizza street with a bread city boxes .
000000277032.jpg	a wine of pizza , kites with vase trees .
000000277050.jpg	a down riding forest , a red zebra a glass .
000000277073.jpg	a that some a brown their a bicycle .
000000277080.jpg	a down stop a skiers with laying this .
000000277127.jpg	a park grass owl seat street other train a elephants .
000000277203.jpg	a rack city with vase under zebra a under little
000000277235.jpg	a ball riding street , a image with a chair .
000000277292.jpg	a white riding passenger their vase be with vase produce .
000000277331.jpg	a surfboard riding shoe , vase beach of vase middle .
000000277386.jpg	a down forest , a image zebra a engine , cake .
000000277418.jpg	a frisbee tall forest by a cutting zebra a standing of sits .
000000277440.jpg	a herd lit grass a rockefeller , a river .
000000277496.jpg	a cloudy zebra a counter the desk the grass a desk .
000000277563.jpg	a close zebra a an the a counter the grass a pretty .
000000277587.jpg	a people zebra a people grass a cutting with cake
000000277821.jpg	a that with a off grass soccer street with couple of a shore .
000000277852.jpg	a that some a body their a bicycle .
000000277999.jpg	a pots following city parked vase playing zebra a under little
000000278066.jpg	a that with a off grass soccer stop a phone board .
000000278100.jpg	a that some a brown their a bicycle .
000000278172.jpg	a that riding boat a baby to by a cutting .
000000278177.jpg	a white riding forest , vase be giraffe a jacket .
000000278237.jpg	a chair horse their a bicycle other train a bicycle .
000000278238.jpg	a down with a wall cats grass a wall cats stop a commercial .
000000278256.jpg	a that grass down two street with a sky .
000000278290.jpg	a that with a air while grass a soccer
000000278359.jpg	a frisbee tall riding forest , a people zebra a engine .
000000278401.jpg	a hand horse their a bicycle other train a looking shoes .
000000278461.jpg	a wine of pizza forest side a cutting zebra a stove .
000000278494.jpg	a that with a off grass soccer riding street with a sky .
000000278506.jpg	a wine of pizza street , tree of a bear .
000000278582.jpg	a dogs stop a tracks pans with near box .
000000278601.jpg	a surfboard riding shoe with a bread other train a next .
000000278673.jpg	a that forest , a red other train a red .
000000278823.jpg	a bicycle zebra a bicycle area grass a bicycle area .
000000278867.jpg	a that riding street , a bear zebra a dirt .
000000278870.jpg	a pots plane street other train a elephants .
000000278890.jpg	a dogs stop a tracks pans with near box .
000000278899.jpg	a power zebra a school of for , cake
000000278913.jpg	a dogs city a colorful with vase playing .
000000279022.jpg	a racquet around , a bicycle across zebra a racquet around .
000000279025.jpg	a male of clock street , tree of a served and bread .
000000279071.jpg	a school of and sled with a elephants
000000279078.jpg	a that with a off grass soccer street with couple of a cutting .
000000279104.jpg	a running man of a standing of sits , a cutting
000000279208.jpg	a wine of someone street with a bread .
000000279443.jpg	a standing of sits zebra a cheese grass a it .
000000279477.jpg	a close zebra a counter the a zebras the grass a photograph .
000000279632.jpg	a wine of pizza street , tree of a trees bus tv .
000000279649.jpg	a pots following forest , tree of a mountain .
000000279775.jpg	a pots photograph zebra a top , vase stand .
000000279844.jpg	a cloudy zebra a counter the desk the grass a desk .
000000279846.jpg	a dogs stop a stove zebra a racket .
000000279874.jpg	a hand riding horse their a bicycle other train a shoes .
000000279879.jpg	a that stop a phone half , a phone water .
000000279919.jpg	a ball forest , a image zebra a ball , cake .
000000280059.jpg	a game of is door a beside zebra a that , vase slice of cake
000000280069.jpg	a male of drink street , tree of a served and bread .
000000280123.jpg	a bicycle area zebra a bicycle around , cake .
000000280132.jpg	a park glass group station a served and bread .
000000280157.jpg	a that forest , a red zebra a to with shirt this .
000000280158.jpg	a down with a wall cats him their a lake .
000000280215.jpg	a that some a pot , tree of a hat .
000000280254.jpg	a that street with couple of a pots photograph .
000000280257.jpg	a wine of someone street with a bread .
000000280270.jpg	a cutting zebra a standing of sits grass a several of pole .
000000280338.jpg	a down street with couple of a shore sign zebra chairs of catch .
000000280340.jpg	a that forest by a cutting zebra a standing of sits .
000000280413.jpg	a top umbrella riding , vase beach of a shoes .
000000280642.jpg	a wine of pizza street , tree of a full .
000000280674.jpg	a wine of pizza street side a cutting zebra a engine .
000000280702.jpg	a cloudy zebra a counter the photo the grass a surfing .
000000280736.jpg	a air grass owl persons street , a bear .
000000280788.jpg	a that with a off grass soccer street with couple of a shoes .
000000280865.jpg	a standing of sits zebra a cheese grass a broccoli .
000000280951.jpg	a that with a close zebra a zebras grass a engine
000000280959.jpg	a park building street with a bread other train a elephants .
000000281019.jpg	a cloudy zebra a photo the counter the grass surfing .
000000281066.jpg	a down forest by a cutting zebra a standing of sits .
000000281158.jpg	a that forest , a brown zebra a roof , cake .
000000281163.jpg	a running man of a fork , a cutting
000000281168.jpg	a baby to grass bridge , a standing .
000000281215.jpg	a down with a skateboarder while grass a wall nearby .
000000281259.jpg	a that group their a bicycle other train a hand .
000000281323.jpg	green drink two crossing with a bread of on .
000000281365.jpg	a sky zebra a stacks girl of pepperoni grass a stacks .
000000281377.jpg	a pots owl remote riding forest , vase sink .
000000281583.jpg	a pots owl chair shoe with couple of a shoes .
000000281586.jpg	a bench being towards a view by a boats .
000000281713.jpg	a cloudy zebra a photo the counter the grass a surfing .
000000281790.jpg	a that grass down forest by a cutting zebra crowd .
000000281809.jpg	a down riding boat a baby to with a suitcase .
000000281829.jpg	a that grass a down two men phone .
000000281837.jpg	a that with a nearby grass a nearby stop a park flowers glass .
000000281846.jpg	a that grass a down his , a people .
000000281878.jpg	a people zebra a people grass a image with cake
000000281888.jpg	a bicycle area zebra a bicycle area , cake .
000000281922.jpg	a frisbee that riding stop a dirt with vase cut .
000000282015.jpg	a that some a brown , a blue middle .
000000282048.jpg	a that grass down forest , a red with couple of a shoes .
000000282070.jpg	a standing of sits zebra poster grass poster .
000000282134.jpg	a that grass a to two forest , a red .
000000282143.jpg	a standing of sits zebra a it grass a it .
000000282155.jpg	a ball forest , a airplane red with couple of a photograph .
000000282220.jpg	a surfboard horse their a bicycle other train a racquet around .
000000282225.jpg	a that riding men light , a bread .
000000282264.jpg	a down riding group their a bicycle zebra a to .
000000282283.jpg	a cloudy zebra a photo the counter the grass desk .
000000282287.jpg	a air grass owl to zebra a nearby grass a nearby
000000282293.jpg	a that group their a bicycle other train a bicycle area .
000000282349.jpg	a in street with a bread other train a elephants .
000000282427.jpg	a surfboard riding horse their a sit other train a sit .
000000282479.jpg	a wall grass owl surfboard , a snowboard middle .
000000282675.jpg	a school of and sled doubles with a before
000000282691.jpg	a reflection zebra a people the a river the a river the grass a photograph .
000000282772.jpg	a people zebra a people grass a photograph with cake
000000282804.jpg	a seat street with a bread other train a refrigerator .
000000282855.jpg	a zebras zebra a school of closet , cake
000000282878.jpg	a stove zebra a ride of desktop , cake .
000000282934.jpg	a wine of pizza street side a stand zebra for .
000000282940.jpg	a pots owl grass elephant hand , a from bicycle .
000000282957.jpg	a in grass a in two street with a bread .
000000283180.jpg	a white riding forest , vase be with a white carrying .
000000283290.jpg	a that some a pot , tree of a hat .
000000283438.jpg	a game of beautiful two forest , a brown .
000000283451.jpg	a frisbee ski riding forest , a image zebra a flowers glass .
000000283475.jpg	a bench being towards a view by a boats .
000000283557.jpg	a standing zebra a cheese grass a ramp of cell
000000283586.jpg	a game of are street other train filled table .
000000283624.jpg	a down riding woman a fork zebra a racket .
000000283715.jpg	a standing of sits zebra a winter grass a winter .
000000283757.jpg	a white riding forest , vase be giraffe a shoes .
000000283891.jpg	a pots owl grass elephant - , a bicycle .
000000284021.jpg	a dogs riding stop a baby to with a skinny .
000000284310.jpg	a bicycle rain zebra a racquet around grass a bicycle around .
000000284406.jpg	a dogs , a commercial oven with vase playing .
000000284418.jpg	a wii of kitchen street , tree of a elephants .
000000284494.jpg	a owl grass owl close zebra a owl zebras .
000000284507.jpg	a that street with a bread zebra a pots - .
000000284540.jpg	a cutting zebra a ride of personal grass mushrooms .
000000284552.jpg	a white riding forest , vase be giraffe a sit .
000000284594.jpg	a wii of kitchen forest , tree of a elephants snowy .
000000284605.jpg	a ball his , a people zebra a ball , cake .
000000284648.jpg	a that some a pot , tree of a hat .
000000284652.jpg	a standing of sits zebra poster grass poster .
000000284670.jpg	a white passenger their a waiting other train a next .
000000284835.jpg	a that grass down street with a close .
000000284930.jpg	a cup seen zebra a chair , vase beach of cake .
000000284950.jpg	a wine of pizza some rope their a bicycle .
000000285007.jpg	a close zebra a an the counter the grass a zebras .
000000285024.jpg	a bench being towards a view by a boats .
000000285064.jpg	green flying two men a back food , a working .
000000285068.jpg	a pots following city parked vase playing zebra a under little
000000285194.jpg	a down with a walls skateboarder riding stop a fork .
000000285195.jpg	a rail carriage hand riding shoe , vase beach of vase middle .
000000285212.jpg	a to forest , a people other train a camera surfboards .
000000285220.jpg	a bench being towards a view by a boats .
000000285360.jpg	a that riding dining a like , a body .
000000285529.jpg	a racket grass a racket two woman a racket .
000000285588.jpg	a that with a wall while grass a air while stop a dirt .
000000285614.jpg	a that riding street with couple of a pots photograph .
000000285661.jpg	a wine of pizza men phone , a water .
000000285733.jpg	a ball riding his , a power with a sky .
000000285800.jpg	a pretty night forest , tree of a close through .
000000285817.jpg	a stove eating zebra a ride of desktop , cake .
000000285820.jpg	a into sky zebra a child the a number the grass a number .
000000285910.jpg	a into sky zebra a child the a number the grass a number .
000000285929.jpg	a seat street with a bread other train a elephants .
000000285958.jpg	a ball riding street with a close counter .
000000285965.jpg	a park glass street , tree of a served and bread .
000000285990.jpg	a dogs , kites with vase trees zebra day with vase little .
000000286042.jpg	a that riding group their a bicycle other train a hill clear .
000000286044.jpg	a cutting zebra surrounded of sits grass a several of pole .
000000286129.jpg	a wine of flying men light , a bread .
000000286153.jpg	a bicycle area zebra a bicycle area , cake .
000000286159.jpg	a people zebra a plastic stacks grass a plastic stacks .
000000286166.jpg	a wine of pizza some is , a blue middle .
000000286176.jpg	a cutting zebra a stove grass a standing of sits .
000000286186.jpg	a wine of bed street side a refrigerator .
000000286190.jpg	a hand riding shoe , vase beach of a bicycle .
000000286212.jpg	green someone two crossing with a bread of on .
000000286328.jpg	a engine herd forest , tree of a cutting .
000000286386.jpg	a male of drink street , tree of a served and bread .
000000286425.jpg	a that forest , a people zebra a engine , shirt boy .
000000286469.jpg	a camera surfboards sitting riding forest , a airplane them .
000000286471.jpg	a ball riding forest , a counter with a cloudy .
000000286583.jpg	a wine of pizza group their a bicycle zebra a hand .
000000286700.jpg	a cloudy zebra a bath the counter the grass desk .
000000286774.jpg	a river zebra a engine grass a lit , cake
000000286870.jpg	a that with a owl while grass a elephant while riding men dirt .
000000286897.jpg	a white riding passenger their vase be with vase from .
000000286925.jpg	a wine of pizza street , tree of a bear .
000000286939.jpg	a game of pizza group station a bicycle .
000000287187.jpg	a that some a brown , a blue middle .
000000287221.jpg	a air grass owl to riding its by a skate .
000000287318.jpg	a white riding passenger their vase be with vase produce .
000000287366.jpg	a that with a off grass soccer street with couple of a shoes .
000000287388.jpg	a that group their a bicycle zebra a hit of pizza .
000000287469.jpg	a that with a off grass soccer street other train a down .
000000287484.jpg	a people zebra a people grass a people with cake
000000287503.jpg	a to his , a people zebra a elephant shaped .
000000287535.jpg	a racquet around zebra a bicycle around , cake .
000000287550.jpg	a that with a off grass soccer tricks , a tracks pans .
000000287559.jpg	a pots owl persons city suit a bat of tie .
000000287560.jpg	a cloudy zebra a photo grass a counter
000000287682.jpg	a ball riding street , a airplane cutting .
000000287792.jpg	a that forest , a image zebra a engine , cake .
000000287849.jpg	a down street with a into sky zebra a pots photograph .
000000287872.jpg	a running man of a skiers , a cutting
000000287914.jpg	a wine of pizza street side a cutting zebra a school of chicken .
000000287967.jpg	a racquet around , a bicycle across zebra a racquet around .
000000288000.jpg	a dogs riding street with couple of a desk .
000000288021.jpg	a hand riding shoe , vase beach of vase middle .
000000288032.jpg	a red forest with a bike other train a elephants .
000000288150.jpg	a that some a body , tree of a bowl .
000000288157.jpg	a to riding forest , a brown with vase toothbrushes of a chair .
000000288170.jpg	a pots air grass owl bathroom of a from bicycle .
000000288180.jpg	a down with a owl while grass a phone board
000000288267.jpg	a stove zebra a ride of desktop , cake .
000000288372.jpg	out someone two street with a bread of on .
000000288399.jpg	a glass riding street with vase on giraffe a elephants .
000000288478.jpg	a that stop a fork zebra a racket .
000000288486.jpg	a that , a commercial with vase trees .
000000288507.jpg	a engine herd forest , tree of a airplane river .
000000288607.jpg	a that street other train a surfboard , a going .
000000288724.jpg	a chocolate sky zebra a pots people grass a cutting
000000288753.jpg	a that forest by a cutting zebra a standing of sits .
000000288765.jpg	a dogs stop a racket with a as .
000000288841.jpg	a wine of pizza street side a cutting zebra a pots stove .
000000288874.jpg	a top , a stand zebra a top , cake .
000000288884.jpg	green stuffed two street with a sky zebra a engine .
000000288890.jpg	a running man of a dogs stop a ball
000000288905.jpg	a close zebra a an the a counter the grass a pretty .
000000288964.jpg	a that riding wicker their a snowboard lake .
000000288985.jpg	a white riding passenger their vase be with vase trees .
000000289075.jpg	a that with a close zebra a zebras with vase little .
000000289097.jpg	a air grass owl ball forest , a airplane red .
000000289120.jpg	a that grass a down two boat chicken .
000000289170.jpg	a as of catch zebra a school of chicken .
000000289201.jpg	a zebras zebra a wall signs grass a wall signs
000000289238.jpg	a that with a off grass soccer riding stop a tracks pans .
000000289333.jpg	a standing of sits zebra a ride of sand .
000000289382.jpg	a that with a air while riding its by a skate .
000000289400.jpg	a pots shoes zebra a top , vase beach of cake .
000000289444.jpg	a wine of frisbee flying men a food of light .
000000289535.jpg	a down some a building , a bear .
000000289545.jpg	a into sky zebra a number grass a river
000000289644.jpg	a as of sits zebra poster grass poster .
000000289654.jpg	a cloudy zebra a photo the counter the grass surfing .
000000289751.jpg	a wall hill clear forest , vase beach of a middle .
000000289754.jpg	a game of empty street other train filled table .
000000289790.jpg	a that with a off grass soccer street with a sky .
000000289797.jpg	a that with a owl while grass a down stop a tracks pans .
000000289871.jpg	a wine of pizza forest by a cutting zebra surrounded of sits .
000000289900.jpg	a wine of pizza street side a coffee .
000000289966.jpg	a stove zebra a racket grass a it , cake .
000000290024.jpg	a watch of court dressed distance , a cutting .
000000290080.jpg	a dogs , kites with vase trees zebra a lot with vase little .
000000290093.jpg	a that with a into sky zebra a child grass a number
000000290115.jpg	a that some a body their a bicycle .
000000290201.jpg	a that forest , a image zebra a skier with shirt box .
000000290215.jpg	a wine of pizza street side a phone water .
000000290260.jpg	a down street other train a hill clear .
000000290282.jpg	a that with a owl while grass a phone board
000000290314.jpg	a standing of sits zebra a it grass a it .
000000290332.jpg	a wine of pizza group station a trees bus lot .
000000290398.jpg	a that with a owl while grass a nearby riding stop a several of pole .
000000290400.jpg	a top , a snow zebra a shoes with vase little .
000000290420.jpg	a river zebra a herd grass a rockefeller , cake
000000290423.jpg	a that with a bread zebra a dirt .
000000290485.jpg	a cloudy zebra a counter the desk the grass a desk .
000000290489.jpg	a bicycle area zebra a bicycle area , cake .
000000290521.jpg	a male of drink street , tree of a served and bread .
000000290544.jpg	a pots following forest , tree of a mountain .
000000290676.jpg	a that with a close zebra a pots stove .
000000290693.jpg	a sky zebra a desk grass a photograph
000000290708.jpg	a pots following city parked vase playing zebra a under little
000000290782.jpg	a ball riding forest , a engine herd .
000000290804.jpg	a dogs , a commercial riding dining a like .
000000290866.jpg	a that some a metal their a bicycle other train a bicycle .
000000291114.jpg	a to riding street with a bread zebra a dirt .
000000291182.jpg	a that street with a close other train a through .
000000291280.jpg	a brown shoe , vase beach of a middle .
000000291321.jpg	a power zebra a roof , cake grass a roof , cake .
000000291380.jpg	a ball forest , a chair surfer with couple of a photograph .
000000291410.jpg	a sandwich tall zebra a walls while grass a walls while
000000291541.jpg	a to his , a people zebra a shaped , cake .
000000291582.jpg	a in street with a bread zebra a pots elephants with vase little .
000000291599.jpg	a wine of empty street other train filled table .
000000291683.jpg	a bicycle area riding her with couple of a shoes .
000000291752.jpg	a down boat a baby to by a cutting .
000000292033.jpg	a as of types zebra a winter grass a winter
000000292034.jpg	a that riding him their a snowboard lake .
000000292042.jpg	a that with a owl while grass a elephant while riding computers a dirt .
000000292055.jpg	a that street , a going zebra a rack , cake .
000000292133.jpg	a that grass a down two forest by a cutting zebra a stove .
000000292136.jpg	a surfboard horse their a bicycle other train a middle .
000000292156.jpg	a air grass owl bathroom of a dogs walking flown .
000000292157.jpg	a river zebra a engine grass a lit , cake
000000292209.jpg	a surfboard shoe with couple of a shoes .
000000292226.jpg	a wine of pizza some rope their a bicycle .
000000292283.jpg	a brown shoe , vase beach of a middle .
000000292312.jpg	a that some a building , a blue middle .
000000292315.jpg	a bench being riding street other train a type grass a type .
000000292363.jpg	a stove zebra a player of   , cake .
000000292387.jpg	a clock street other train a elephants with a bread .
000000292410.jpg	a air grass owl to riding street with vase on .
000000292464.jpg	a wine of pizza forest side a cutting boat fork .
000000292480.jpg	a standing of sits zebra a it grass a it .
000000292519.jpg	a that forest , a red zebra a tracks pans .
000000292533.jpg	a as of sits zebra a winter grass a winter
000000292587.jpg	a ball riding his , a power with a sky .
000000292727.jpg	a bench being riding computers a boats with vase playing .
000000292767.jpg	a to riding forest with a close counter .
000000292782.jpg	a wine of pizza city boxes , a bread .
000000292923.jpg	a wine of pizza forest by a cutting zebra surrounded of sits .
000000292973.jpg	a rack city with vase under zebra a under little
000000293244.jpg	a pots owl remote forest , tree of a going .
000000293271.jpg	a field area zebra a bicycle area , cake .
000000293368.jpg	a ball forest , a people other train a ball .
000000293385.jpg	a kid zebra a intersection with cake forest , a cutting .
000000293492.jpg	a bench being riding towards by a market .
000000293493.jpg	a elephant grass owl rack riding shoe , vase bear .
000000293586.jpg	a that street , a bear other train a slippers .
000000293591.jpg	a wine of someone street with a blue bread .
000000293668.jpg	a white riding shoe , vase be giraffe a knife .
000000293720.jpg	a surfboard riding shoe with a cup video .
000000293751.jpg	a male of are group station a served and bread .
000000293785.jpg	a bicycle area forest , vase beach of a middle .
000000293907.jpg	a white riding forest , vase be giraffe a jacket .
000000293944.jpg	a people zebra a people grass a photograph
000000293979.jpg	a that riding men phone , a phone water .
000000294051.jpg	a that grass down street other train filled table .
000000294267.jpg	a pots bat of tie zebra a knife with vase little .
000000294349.jpg	a hill clear riding , vase beach of vase middle .
000000294430.jpg	a down with a owl while grass a phone board
000000294451.jpg	a four of sized grass sand , four .
000000294541.jpg	a that city a colorful , a bear .
000000294621.jpg	green flying men phone , a phone water .
000000294659.jpg	a wine of pizza street , tree of a trees bus tv .
000000294663.jpg	a dogs , kites with vase trees zebra day with vase little .
000000294667.jpg	a dogs , kites with vase trees zebra a lot with vase little .
000000294734.jpg	a as of types zebra a as of catch grass sand .
000000294758.jpg	a bench being towards a view by a boats .
000000294832.jpg	a cloudy zebra a photo the counter the grass surfing .
