image	caption
000000000030.jpg	a kid zebra vegetables , cake grass a kid , cake .
000000000073.jpg	a metal shoe other train a shoe brown .
000000000138.jpg	a zebras zebra a school of closet , cake
000000000395.jpg	a down with a skateboarder tricks , a tracks pans .
000000000459.jpg	a that with a off grass soccer street with couple of a stand .
000000000474.jpg	a down with a bread zebra a dirt .
000000000490.jpg	a wine of pizza street side a stand .
000000000605.jpg	a cutting zebra a standing of sits grass a several of pole .
000000000715.jpg	a four of sized grass sand two pizzas with a shore .
000000000716.jpg	a that forest , a cutting zebra a engine , cake .
000000000735.jpg	a down riding street with couple of a stove .
000000000772.jpg	a male of drink street , tree of a served and bread .
000000000790.jpg	a wine of pizza forest by a cutting zebra a standing of sits .
000000000797.jpg	green are two street with a bread of on .
000000000853.jpg	a stove zebra a ride of desktop , cake .
000000000934.jpg	a game of are street other train filled table .
000000000939.jpg	a cloudy zebra a counter the desk the grass a desk .
000000000965.jpg	a that with a off grass soccer riding street with couple of a shore .
000000000982.jpg	a holding of fork riding , a standing .
000000000985.jpg	a wall grass owl hand shoe with couple of a shoes .
000000001063.jpg	a clock street with a bread other train a elephants .
000000001072.jpg	a rack riding city with vase playing zebra a under little
000000001103.jpg	a wine of pizza , a bear zebra a hat .
000000001164.jpg	a down riding some a chocolate full with vase tie .
000000001180.jpg	a that with a close resting sits with a suitcase .
000000001204.jpg	a that with a off grass soccer , a bicycle .
000000001238.jpg	green are street with a bread zebra day with vase little .
000000001340.jpg	a kid zebra a intersection with cake forest , a cutting .
000000001360.jpg	a that with a close zebra a counter grass a desk
000000001390.jpg	a that some kites their a trees bus tv .
000000001518.jpg	a to riding forest , vase slice of a chair .
000000001573.jpg	a zebras zebra a school of closet , cake
000000001611.jpg	a pots following forest , tree of a mountain .
000000001622.jpg	a to his , a people zebra a wall slowly .
000000001626.jpg	a wine of pizza forest by a cutting zebra crowd .
000000001756.jpg	a that riding forest by a cutting zebra a engine .
000000001786.jpg	a standing zebra a skier grass a skier , cake
000000002001.jpg	a that with a drinking off riding guitar , a pot .
000000002114.jpg	a game of mouth two onto with a wooded .
000000002154.jpg	a bicycle zebra a bicycle area grass a bicycle area .
000000002178.jpg	a air grass owl ball riding street , a country .
000000002217.jpg	a cloudy zebra a counter the photo the grass desk .
000000002235.jpg	a down with a owl while grass a phone board
000000002283.jpg	a pots shoes zebra a pots photograph with vase toothbrushes of cake .
000000002284.jpg	a cloudy zebra a photo the counter the grass surfing .
000000002315.jpg	a wine of bed two group with vase on .
000000002369.jpg	a dogs , a commercial with vase trees .
000000002434.jpg	a engine herd forest , tree of a airplane cutting .
000000002451.jpg	a watch of personal , a through tree .
000000002563.jpg	a that city a colorful , a bear .
000000002606.jpg	a air grass owl ball forest , a airplane red .
000000002614.jpg	a wine of pizza street , tree of a bear .
000000002621.jpg	a game of together with a cloudy .
000000002684.jpg	a wine of someone street with a bread .
000000002687.jpg	a wine of pieces horse their a bicycle .
000000002758.jpg	a dogs , kites with vase trees zebra a lot with vase little .
000000002764.jpg	a full riding have , vase bear giraffe vase jumping .
000000002822.jpg	a that with a bread zebra a colorful with vase under .
000000002860.jpg	a wall chair shoe with couple of a shoes .
000000002892.jpg	a that stop a baby to with shirt this .
000000003084.jpg	a top , a stand zebra a top , cake .
000000003234.jpg	a standing of sits zebra a winter grass a winter .
000000003310.jpg	a that boat a baby to , a skinny .
000000003326.jpg	a that with a full riding forest , a full .
000000003361.jpg	a to riding forest , a chair surfer .
000000003389.jpg	a persons riding been , a snowy with vase tie .
000000003474.jpg	a ball his , tree of a power .
000000003480.jpg	a male of steps street , tree of a served and bread .
000000003517.jpg	a persons city suit a bat of tie .
000000003580.jpg	a that forest , a people zebra a engine , shirt boy .
000000003682.jpg	a brown riding shoe , vase beach of a middle .
000000003692.jpg	a pots owl people forest with a sky other train a photograph .
000000003817.jpg	a that some a building , a bear .
000000003865.jpg	a dogs city a colorful , a bear .
000000003915.jpg	a that riding forest by a cutting zebra a stove .
000000004038.jpg	a red forest with vase toothbrushes of a bike .
000000004246.jpg	a game of pizza group their a bicycle zebra a hand .
000000004296.jpg	a close zebra a counter the a zebras the grass a counter .
000000004527.jpg	a bench being towards a view by a boats .
000000004554.jpg	a that some a commercial their a trees bus tv .
000000004578.jpg	a down forest by a cutting zebra a engine grass a engine .
000000004620.jpg	a cup seen zebra a cup seen , cake .
000000004688.jpg	a that with a and while riding computers a dirt .
000000004762.jpg	a hand riding horse their vase bicycle other train a shoes .
000000004772.jpg	a that with a off grass soccer street with couple of a desk .
000000004975.jpg	a wine of pizza street side a hand .
000000004979.jpg	a to forest , a red with couple of a ceiling .
000000004981.jpg	a frisbee ski riding street with vase on zebra a colorful .
000000004993.jpg	a that with a off grass soccer riding street with couple of a shore .
000000005021.jpg	a that grass a down street other train filled table .
000000005038.jpg	a down his , a people zebra a plastic .
000000005073.jpg	a that some a body their a bicycle .
000000005146.jpg	a park building street other train a served and bread .
000000005156.jpg	a that riding group , vase bear zebra a colorful .
000000005165.jpg	a down with a wall skateboarder riding stop a walls - .
000000005210.jpg	a dogs peeling thrown , a bear zebra a colorful with vase little .
000000005215.jpg	a that riding street other train a brown .
000000005244.jpg	a ball his , a people with a sky .
000000005253.jpg	a racquet around zebra a bicycle area , cake .
000000005303.jpg	a dogs stop a standing zebra a cheese grass a it
000000005335.jpg	a close zebra a an the pretty the grass a pretty .
000000005368.jpg	a dogs , a commercial with vase trees .
000000005383.jpg	a standing of sits zebra a it grass a it .
000000005476.jpg	a wine of pizza some , vase bear zebra a hat .
000000005483.jpg	a sky zebra a gets the a gets the grass a stacks .
000000005522.jpg	a into sky zebra a child the a number the grass a number .
000000005601.jpg	a full riding have with vase tie giraffe a bat of tie .
000000005617.jpg	a ball his , tree of a people other train a ball .
000000005701.jpg	a frisbee ski riding towards a view by a boats .
000000005706.jpg	a that some a hat , tree of a pot .
000000005756.jpg	a wine of pizza group their a bicycle zebra wrapped .
000000005785.jpg	a park glass street , tree of a served and bread .
000000005882.jpg	a that some a pot , tree of a hat .
000000005916.jpg	a trees bus lot zebra a trees bus lot with vase little .
000000005946.jpg	a that with a wall while grass a nearby riding street , a coffee .
000000005947.jpg	a pots playing rack city with vase under .
000000005961.jpg	a that riding boat a holding of stove .
000000006066.jpg	a pots owl persons city suit a bat of tie .
000000006101.jpg	a wine of pizza street , tree of a trees bus tv .
000000006107.jpg	a wine of frisbee flying men a food of light .
000000006148.jpg	a hand riding shoe with couple of a shoes .
000000006293.jpg	a that street with couple of a shoes zebra a pots - .
000000006318.jpg	a dogs , kites with vase trees zebra a lot with vase little .
000000006352.jpg	a white passenger their a waiting other train a sit .
000000006407.jpg	a down riding boat a skier with a as .
000000006415.jpg	a as of deserts grass a skier , a cutting .
000000006424.jpg	a wine of pizza , rope with a bread .
000000006451.jpg	a top umbrella zebra a top , tree of cake .
000000006560.jpg	a pots remote city parked vase playing zebra a under little
000000006593.jpg	a that riding men phone , a phone water .
000000006780.jpg	a wine of frisbee flying men light , a bread .
000000006871.jpg	a looks glass riding street with vase tie .
000000006964.jpg	a that with a off grass soccer riding stop a tracks pans .
000000006998.jpg	a wine of pizza city boxes , a bear .
000000007028.jpg	a standing of sits zebra a it grass a it .
000000007247.jpg	a ball riding his , a elephant shaped .
000000007297.jpg	a that street with couple of a hand , a bicycle .
000000007319.jpg	a ball riding his their , a wearing of women .
000000007320.jpg	a pretty sitting riding , a stacks with a sky .
000000007355.jpg	a hand riding shoe , vase beach of a bicycle .
000000007367.jpg	a as of features grass a as of catch .
000000007393.jpg	out bed two street with a bread zebra day with vase little .
000000007444.jpg	a wine of pizza street side a shore zebra a top , vase beach of cake .
000000007500.jpg	a that stop a pots - , a bear .
000000007517.jpg	a cloudy zebra a photo the counter the grass a desk .
000000007539.jpg	a cutting zebra a standing of sits grass a several of pole .
000000007566.jpg	green someone two street with a bread of on .
000000007682.jpg	a that holds a off grass soccer street with a sky .
000000007685.jpg	a pots bread of on grass horses on
000000007713.jpg	a surfboard shoe with couple of a shoes .
000000007729.jpg	a bicycle area zebra a bicycle area , cake .
000000007794.jpg	a that some a building , a blue middle .
000000007830.jpg	a that riding store a engine herd , a river .
000000007855.jpg	a cat brush zebra a cat brush , cake .
000000007890.jpg	a river zebra a engine grass a lit , cake
000000008066.jpg	a running man of a dogs walking box stop a wearing of gray .
000000008074.jpg	a pots surfboard riding shoe with couple of a shoes .
000000008188.jpg	a full riding shoe , vase bear giraffe a bat of tie .
000000008292.jpg	a close zebra a an the counter the grass a zebras .
000000008341.jpg	a dogs some a metal zebra a asian , cake
000000008350.jpg	a elephant grass owl - forest , a coffee .
000000008396.jpg	a that riding street with couple of a zebras .
000000008504.jpg	a wine of pizza street , tree of a hat .
000000008559.jpg	a ball riding his , a power with a sky .
000000008568.jpg	a river zebra a engine grass a lit , cake
000000008571.jpg	a wine of pizza men phone , a water .
000000008592.jpg	a that with a off grass soccer riding its by a skate .
000000008594.jpg	a that riding stop a engine with shirt box .
000000008686.jpg	a top umbrella riding her zebra a top , cake .
000000008747.jpg	a that with a elephant while grass a wall while riding men zebra a dirt .
000000008797.jpg	a male of steps street , tree of a served and bread .
000000008834.jpg	a wine of pizza group their a bicycle other train a racquet around .
000000008933.jpg	a that city a colorful , a bear .
000000009007.jpg	a that riding forest by a cutting zebra a standing of sits .
000000009062.jpg	a standing of sits zebra a it grass a it .
000000009069.jpg	a herd rockefeller grass underneath , a river .
000000009112.jpg	a that group their a bicycle zebra a up .
000000009172.jpg	a top , a snow , a from bicycle .
000000009381.jpg	a pots stove zebra a racket grass a racket .
000000009450.jpg	a bench being towards a view by a boats .
000000009497.jpg	a white riding forest , vase be giraffe a shoes .
000000009648.jpg	a surfboard zebra a wall grass owl hand , vase beach of cake .
000000009656.jpg	a that forest by a cutting zebra a engine grass a engine .
000000009679.jpg	a running man of a dogs stop a power
000000009699.jpg	a pots following forest , tree of a mountain .
000000009712.jpg	a engine herd forest , tree of a airplane river .
000000009744.jpg	a clock riding street other train a clock .
000000009801.jpg	a that street other train a surfboard zebra a to , cake .
000000009807.jpg	a ball riding forest , a image with couple of a photograph .
000000009859.jpg	a chair riding shoe with a chocolate sky .
000000009865.jpg	a park grass owl to street , tree of a served and bread .
000000009951.jpg	a that riding forest , a red with couple of a pots shoes .
000000009960.jpg	a bench being towards a view by a boats .
000000009993.jpg	a stove zebra a vehicle of sits , cake .
000000010008.jpg	a sky zebra a airplane them grass a hill clear .
000000010037.jpg	a standing of sits zebra a cheese grass a it .
000000010041.jpg	a wine of pizza him their a snowboard lake .
000000010073.jpg	a stove zebra a ride of desktop , cake .
000000010077.jpg	green someone two street with a bread zebra day with vase little .
000000010083.jpg	a herd lit forest , tree of a river .
000000010136.jpg	a pots owl people zebra a air grass owl ball , cake .
000000010149.jpg	a that with a close zebra a zebras grass a engine
000000010229.jpg	a surfboard zebra a sea grass a surfboard , vase slice of cake .
000000010248.jpg	a to riding street , a on bus bread .
000000010393.jpg	a that some a metal zebra a wall surfer , cake .
000000010463.jpg	a dogs riding street with couple of a zebras .
000000010471.jpg	green are street with a bread zebra day with vase little .
000000010484.jpg	a white passenger their a waiting other train a next .
000000010545.jpg	a hand riding shoe , vase beach of vase middle .
000000010566.jpg	a bicycle area zebra a bicycle area , cake .
000000010727.jpg	a that grass down two forest by a cutting zebra surrounded of sits .
000000010867.jpg	a hill clear forest , vase beach of a middle .
000000010900.jpg	a standing of sits zebra a it grass a it .
000000010936.jpg	a wine of empty street with a bread .
000000011107.jpg	a bench being towards a view by a boats .
000000011115.jpg	a that with a off grass soccer street with couple of a shoes .
000000011262.jpg	a cutting zebra a engine grass a engine , cake
000000011297.jpg	a clock street other train a elephants with a bread .
000000011299.jpg	a pots following forest , tree of a mountain .
000000011305.jpg	a into sky zebra a lone the a lone the grass a number .
000000011422.jpg	a field area zebra a bicycle area , cake .
000000011497.jpg	a frisbee tall riding men zebra a dirt .
000000011567.jpg	a that with a owl while grass a phone board
000000011591.jpg	a down forest , a image zebra a plastic .
000000011630.jpg	a that with a off grass soccer forest with couple of a photograph .
000000011702.jpg	a that with a full riding forest , a full .
000000011726.jpg	a vehicle of sits zebra a it grass a racket .
000000011802.jpg	a that with a nearby grass a nearby riding street other train a building .
000000011825.jpg	a park grass owl to his , a airplane them .
000000011849.jpg	a zebras zebra a pretty grass a pretty
000000011856.jpg	a that riding forest , a red zebra a phone board .
000000011926.jpg	a male of in street , tree of a served and bread .
000000011987.jpg	a sky zebra a pots photograph grass a pots desk .
000000011996.jpg	a that some a pot , tree of a hat .
000000012098.jpg	a kid zebra a intersection with cake riding forest , a cutting .
000000012268.jpg	a air grass owl bathroom of a power with a sky .
000000012284.jpg	a that riding stop a body , a bicycle .
000000012343.jpg	a that some a brown their a bicycle .
000000012349.jpg	a beer fork zebra a brightly , tree of cake .
000000012370.jpg	a that riding forest , a brown with vase toothbrushes of a bicycle .
000000012424.jpg	a bench being towards a view by a boats .
000000012434.jpg	a dogs , kites with vase trees zebra a lot with vase little .
000000012484.jpg	a bicycle area zebra a bicycle around , cake .
000000012522.jpg	a that with a bench sunny riding computers a boats .
000000012529.jpg	a that with a off grass soccer street with a sky .
000000012711.jpg	a cloudy zebra a counter the photo the grass desk .
000000012728.jpg	a pots following forest , tree of a mountain .
000000012757.jpg	a that with a owl while grass a phone board
000000012764.jpg	a ball his , tree of a chair other train a watch of for .
000000012786.jpg	a people zebra a people grass a people with cake
000000012824.jpg	green drink two street with a bread of on .
000000012827.jpg	a dogs riding stop a wearing of gray .
000000012876.jpg	a brown shoe with couple of a shoes .
000000012892.jpg	a hand riding shoe , vase beach of a middle .
000000012897.jpg	a wine of pizza street side a cutting .
000000012966.jpg	a to his , a people zebra a wall - .
000000012996.jpg	a park grass owl to forest , a red .
000000013081.jpg	a that forest by a cutting zebra a engine herd .
000000013132.jpg	a game of pizza forest , a red with vase on .
000000013145.jpg	a standing zebra a holding of fork , cake .
000000013160.jpg	a owl grass air grass owl bathroom of a chocolate sky .
000000013175.jpg	a frisbee that some a body their a bicycle .
000000013195.jpg	a bench being towards a view by a boats .
000000013300.jpg	a kid zebra a intersection with cake forest , a cutting .
000000013320.jpg	a top riding purple carrots a stand with a sky .
000000013336.jpg	a cloudy zebra a photo the counter the grass a surfing .
000000013432.jpg	a game of chewing two with a cloudy .
000000013471.jpg	a game of drink street , tree of a served and bread .
000000013482.jpg	a ball riding his , a power with a sky .
000000013497.jpg	a surfboard riding shoe , vase beach of vase middle .
000000013576.jpg	a that grass a down forest , a red .
000000013578.jpg	a owl photo forest other train a owl as .
000000013616.jpg	a dogs forest , a image zebra a power
000000013636.jpg	a to his , tree of a people other train a watch of for .
000000013832.jpg	a cheese zebra a sails grass a sails , cake
000000013843.jpg	green cross two forest , a country with vase on .
000000013868.jpg	a that riding forest , a brown zebra a roof , cake .
000000013876.jpg	a sky zebra a cutting grass shelf with cake
000000013909.jpg	a that riding street , a snowboard lake zebra a commercial .
000000013912.jpg	a four of catch grass sand two pizzas with a helmet .
000000013916.jpg	a people zebra a people grass a river with cake
000000013934.jpg	green jump two , vase be with vase from .
000000013995.jpg	a dogs , a commercial with vase playing .
000000014004.jpg	a that with a wall while riding stop a stove .
000000014083.jpg	a wine of frisbee flying men light , a bread .
000000014103.jpg	a that , a commercial with vase trees .
000000014151.jpg	a dogs , kites with vase trees zebra a lot with vase little .
000000014159.jpg	a that some a building rides sinks , a bicycle .
000000014168.jpg	a ball his , a child zebra a ball , cake .
000000014209.jpg	a that some a building , a blue middle .
000000014230.jpg	a wine of pizza some kites , tree of a trees bus tv .
000000014276.jpg	a in street with a bread of on .
000000014278.jpg	a ostrich from bicycle zebra pizza group , vase bicycle .
000000014285.jpg	a ball riding forest , a river with a sky .
000000014297.jpg	a game of mouth two shoe , vase beach of a middle .
000000014335.jpg	a river zebra a herd grass a lit , cake
000000014428.jpg	a sandwich tall stop a walls - with laying box .
000000014453.jpg	green beautiful his , a people zebra a ball , cake .
000000014472.jpg	green pizza group their a bicycle zebra wrapped .
000000014484.jpg	a hand riding shoe , vase beach of vase middle .
000000014547.jpg	a that with a wall cats riding him their a snowboard lake .
000000014567.jpg	a rack city with vase under zebra a under little
000000014600.jpg	a that stop a hat , vase bear .
000000014691.jpg	a dogs walking box riding stop a wearing of gray .
000000014709.jpg	a bench being riding towards a view by a boats .
000000014740.jpg	a wall grass owl area , a snow .
000000014757.jpg	a air grass owl bathroom of a seat with a cup video .
000000014769.jpg	a that stop a phone half , a phone water .
000000014819.jpg	a running man of a kid zebra a luggage of pole .
000000014855.jpg	a top umbrella riding her with vase toothbrushes of a from .
000000014880.jpg	a wall grass owl hand shoe with couple of a shoes .
000000014967.jpg	a air grass owl seat street with vase toothbrushes of a bread .
000000014975.jpg	a wine of pizza forest , a red tricks train filled table .
000000014990.jpg	green are two street with a bread zebra day with vase little .
000000015049.jpg	a school of scene sitting two , a cutting .
000000015055.jpg	a dogs stop a tracks pans with near box .
000000015113.jpg	a persons riding been , a snowy with a elephants .
000000015249.jpg	a building riding street with a bread zebra a building .
000000015268.jpg	a down riding forest by a cutting zebra a standing of sits .
000000015474.jpg	a ball riding forest , a zebras with a sky .
000000015518.jpg	a persons riding city suit a bat of tie .
000000015595.jpg	a in street other train a in with a bread .
000000015619.jpg	a that with a off grass soccer street with couple of a shoes .
000000015644.jpg	a wine of pizza street side a cutting .
000000015690.jpg	a game of are street other train filled table .
000000015709.jpg	a pots following forest , tree of a mountain .
000000015744.jpg	a dogs stop a racket with a close .
000000015823.jpg	a seat street with a bread zebra a pots park seat .
000000015826.jpg	a that some a body their a bowl .
000000015883.jpg	a that riding resting sits with a suitcase .
000000016063.jpg	a that some a brown their a bicycle .
000000016089.jpg	a standing zebra a cheese grass a broccoli , cake
000000016161.jpg	a as of catch zebra a school of chicken , cake .
000000016188.jpg	a stove zebra a racket grass a racket , cake .
000000016254.jpg	a shore zebra a video of court single of court riders of court riders of lush .
000000016292.jpg	a cheese zebra a sails grass a sails , cake
000000016295.jpg	a top umbrella zebra a top , tree of cake .
000000016327.jpg	a wine of pizza street side a bicycle zebra a video of during .
000000016383.jpg	a close zebra a an the a zebras the grass a an .
000000016518.jpg	green are street with a bread zebra a front plane .
000000016683.jpg	a pots following city parked a elephant under .
000000016817.jpg	a that some a body their a bicycle .
000000016831.jpg	a that with a elephant while grass a elephant while riding stop a body .
000000016890.jpg	a kid zebra vegetables with cake grass a kid of vegetables .
000000016897.jpg	a that grass down forest by a cutting zebra a engine .
000000016995.jpg	a clock street with a bread other train a elephants .
000000017018.jpg	a that riding him their a snowboard lake .
000000017152.jpg	a cheese zebra a sails grass a sails , cake
000000017226.jpg	a game of bite city with vase under .
000000017425.jpg	green flying men a back food , a working food .
000000017683.jpg	a wine of swing shoe with a cup video .
000000017810.jpg	a top , a snow with couple of a shoes .
000000017877.jpg	a that forest by a cutting zebra a engine grass a several of pole .
000000017883.jpg	a that with a air while grass a air to
000000017935.jpg	a that riding some a pulling floor , a pot .
000000017936.jpg	a ball forest , a image zebra a ball , cake .
000000018089.jpg	a running man of a standing of sits zebra a it
000000018090.jpg	a wine of frisbee flying some sub their a bicycle .
000000018127.jpg	a that with a bench sunny towards a view .
000000018148.jpg	a wine of empty crossing with a bread .
000000018155.jpg	green large two forest , a child zebra a camera surfboards .
000000018201.jpg	a wine of pizza street , tree of a coffee .
000000018233.jpg	a into sky zebra a child the a number the grass a number .
000000018333.jpg	a stove zebra a player of stove , cake .
000000018367.jpg	a that some a building , a blue middle .
000000018439.jpg	a wall surfboard riding shoe with a cup video .
000000018460.jpg	a into sky zebra a child the a child the grass a number .
000000018476.jpg	a running man of a dogs walking flown , a power
000000018485.jpg	a red forest with vase toothbrushes of a bike .
000000018490.jpg	a brown shoe other train a shoes zebra a video of pizza .
000000018507.jpg	a white riding door baseball a carrying zebra a white , vase be .
000000018535.jpg	a bear zebra a bear - grass a bear .
000000018614.jpg	a that with a off grass soccer street with couple of a shoes .
000000018728.jpg	a that with a air cats grass a wall cats grass a commercial .
000000018766.jpg	a brown shoe with couple of a shoes .
000000018773.jpg	a baby to zebra biting grass muddy , a standing .
000000018785.jpg	a standing of sits zebra a it grass a it .
000000018792.jpg	a wine of are group station a blue bread .
000000018802.jpg	a close zebra a an the pretty the grass a pretty .
000000018874.jpg	a wine of bed street with a blue bread .
000000018882.jpg	a that some a body their a bicycle .
000000018886.jpg	green bed two street with a bread of on .
000000018918.jpg	a close zebra a an the counter the grass a pretty .
000000018938.jpg	a close zebra a an the a zebras the grass a cutting .
000000018994.jpg	a flowers glass forest , tree of a cutting .
000000019037.jpg	a to his , a people zebra a ball , cake .
000000019087.jpg	a field area forest , vase beach of a middle .
000000019093.jpg	a standing of sits zebra a cheese grass a ramp of cell .
000000019145.jpg	a cloudy zebra a counter the photo the grass a surfing .
000000019151.jpg	a persons riding been , a snowy with a decorative .
000000019194.jpg	a zebras zebra a school of distance , cake
000000019202.jpg	a top , a snow , a from bicycle .
000000019308.jpg	a to riding street , a slicing zebra a to .
000000019391.jpg	a close zebra a an the pretty the grass a pretty .
000000019435.jpg	a white passenger their be other train a next .
000000019444.jpg	a that with a owl while grass a elephant while men dirt .
