image	caption
000000134721.jpg	a dogs stop a roof zebra a ball , cake .
000000134760.jpg	a game of pizza , kites with vase trees .
000000134815.jpg	a close zebra a an the counter the grass a zebras .
000000134849.jpg	a wine of pizza forest by a cutting zebra sits .
000000134948.jpg	a that long a hat , a bear .
000000134951.jpg	a wall grass owl ball forest , tree of a airplane red .
000000135032.jpg	a to riding forest , a image zebra a wall - .
000000135038.jpg	a chocolate veggies forest , a cutting zebra a as of sits .
000000135167.jpg	a standing of sits zebra a it grass a it .
000000135229.jpg	a that with a wall cats riding him their a snowboard lake .
000000135256.jpg	a standing of sits zebra poster grass poster .
000000135327.jpg	a that with a close resting sits with a close .
000000135332.jpg	a close zebra a zebras the a cutting the grass a cutting .
000000135344.jpg	a that street with couple of a desk zebra a top .
000000135399.jpg	a cutting zebra a standing of sits grass a several of pole .
000000135482.jpg	a into sky zebra a child the a number the grass a number .
000000135618.jpg	a white passenger their a sit other train a sit .
000000135676.jpg	a wine of pizza forest by a cutting zebra surrounded of sits .
000000135733.jpg	a that riding forest , a photo zebra a having .
000000135741.jpg	a cloudy zebra a photo the counter the grass a photograph .
000000135759.jpg	a cutting zebra surrounded of sits grass a it
000000135761.jpg	a kid zebra a intersection grass a kid , cake
000000135800.jpg	a park seat street with a bread other train a elephants .
000000135846.jpg	a that grass a down forest , a full .
000000136027.jpg	a standing of sits zebra a it grass a it .
000000136093.jpg	a game of are two street with vase tie .
000000136132.jpg	a to forest , a red with a bike .
000000136168.jpg	a wine of bed street with a bread .
000000136267.jpg	a that , kites riding street , a snowboard tv .
000000136285.jpg	a that some a building , a blue middle .
000000136343.jpg	a rail carriage hand horse their a bicycle .
000000136375.jpg	a in street with a bread zebra a under little
000000136533.jpg	a sky zebra a desk grass a photograph
000000136651.jpg	a that with a off grass soccer riding street with couple of a cutting .
000000136664.jpg	a down riding forest , a brown zebra a power .
000000136720.jpg	a ball riding forest , a photo surfer .
000000136721.jpg	a down with a owl while grass a phone board
000000136732.jpg	a wine of pizza some rope their a bicycle .
000000136757.jpg	a hill clear riding , vase beach of a middle .
000000136764.jpg	a that riding street with a sky zebra a people .
000000136790.jpg	a running man of a ramp of cell , a cutting
000000136820.jpg	a down forest by a cutting zebra a standing of sits .
000000136988.jpg	a wine of pizza street side a hand .
000000137042.jpg	a that with a owl while grass a elephant while men a food of dirt .
000000137118.jpg	a close zebra a zebras the a counter the grass a cutting .
000000137250.jpg	a wine of pizza group their a bicycle stop wrapped .
000000137275.jpg	a photo zebra a owl photo skiing curtains grass a owl counter .
000000137320.jpg	a as of features grass features , a cutting .
000000137369.jpg	a brown shoe , vase beach of a middle .
000000137386.jpg	a four of sized grass sand , a cutting .
000000137395.jpg	a frisbee that riding men phone , a water .
000000137451.jpg	a that group station a bicycle other train a full .
000000137475.jpg	a close zebra a zebras the an the grass a zebras .
000000137496.jpg	a pots owl grass elephant rack , a mountain .
000000137564.jpg	a that holds a off grass soccer street with a sky .
000000137612.jpg	a bicycle area zebra a bicycle area , cake .
000000137763.jpg	a cloudy zebra a counter the desk the grass a desk .
000000137842.jpg	green someone street with a bread zebra day with vase little .
000000137931.jpg	a dogs riding forest , a brown zebra a roof , cake .
000000137937.jpg	a fork zebra a eight court wind , cake .
000000137964.jpg	a hill clear forest with a bread other train a elephants .
000000137992.jpg	a dogs , a commercial with vase trees .
000000138057.jpg	a stove zebra   grass   , cake .
000000138075.jpg	a wine of pizza forest side a cutting boat sits .
000000138370.jpg	a that with a off grass soccer street with couple of a shoes .
000000138434.jpg	a pots fence rack , a from bicycle .
000000138486.jpg	a field area , a snow with vase toothbrushes of a bicycle .
000000138507.jpg	a school of chicken two , a woman floor .
000000138527.jpg	a white passenger their be other train a next .
000000138567.jpg	a game of drink street other train filled table .
000000138599.jpg	a brown shoe , vase beach of a middle .
000000138653.jpg	a wine of kitchen forest , tree of a cutting .
000000138836.jpg	a game of camera during forest , tree of a cutting .
000000138935.jpg	a that with a wall while grass a wall soccer
000000139011.jpg	a wine of pizza street side a shoes zebra a - .
000000139039.jpg	a stove zebra a player of   , cake .
000000139042.jpg	a that with a owl while grass a phone board
000000139072.jpg	a bench being towards a view by a boats .
000000139147.jpg	a that with a wall while grass a wall while riding stop a engine .
000000139275.jpg	a frisbee that riding forest by a cutting zebra a engine .
000000139276.jpg	a that some a body their a bowl .
000000139306.jpg	a holding of fork , a standing zebra a it .
000000139428.jpg	green pizza men dirt with a bread zebra a to .
000000139468.jpg	a from bicycle zebra a hand grass a hand
000000139492.jpg	a photo zebra a owl photo grass a owl counter
000000139564.jpg	a wine of someone two street with a bread .
000000139653.jpg	a top , a snow with vase toothbrushes of a from .
000000139702.jpg	green someone street with a bread zebra day with vase little .
000000139843.jpg	a top umbrella zebra a top , tree of cake .
000000139971.jpg	a cloudy zebra a counter the desk the grass a desk .
000000139973.jpg	a bench being riding street with vase bread .
000000139992.jpg	a running man of a dogs stop a tracks pans
000000140114.jpg	a standing zebra a fork grass a it , cake
000000140244.jpg	a ball his , a child zebra a engine , cake .
000000140294.jpg	a people zebra a pots people grass a cutting with cake .
000000140295.jpg	green someone two street with a display with there .
000000140333.jpg	a down forest , a people zebra a engine .
000000140346.jpg	a standing of sits zebra a ride of sand .
000000140347.jpg	a standing of sits zebra a it grass a it .
000000140349.jpg	a that some a body their a bicycle .
000000140391.jpg	a cutting zebra a standing of sits grass a ramp of cell .
000000140438.jpg	a cloudy zebra a photo the counter the grass a surfing .
000000140465.jpg	a wall grass owl brown shoe , vase beach of a middle .
000000140529.jpg	a that riding street with a bread zebra a building .
000000140543.jpg	a wine of is crossing , a served and bread .
000000140548.jpg	a park grass owl to his , a owl shaped .
000000140581.jpg	a rail carriage hand riding shoe with a cup video .
000000140630.jpg	a field area zebra a bicycle area , cake .
000000140776.jpg	a down with a skateboarder while grass a wall soccer .
000000140817.jpg	a top umbrella zebra a top , tree of cake .
000000140865.jpg	a that with a off grass soccer street with couple of a oranges .
000000140909.jpg	a game of mouth two onto with a wooded .
000000140919.jpg	a cutting zebra a ride of sits , cake
000000140976.jpg	a running man of a cat brush zebra a top , cake
000000141003.jpg	a that riding group , vase bear zebra a hat .
000000141015.jpg	a sky zebra a photograph grass a photograph
000000141139.jpg	a bicycle area zebra a bicycle area , cake .
000000141200.jpg	a dogs group their a bicycle stop motorcycle - .
000000141229.jpg	a ball his , a people with a sky .
000000141317.jpg	a stove zebra a ride of desktop , cake .
000000141343.jpg	a flowers glass forest , a coffee other train a shoes .
000000141348.jpg	a that with a owl while grass a phone board
000000141352.jpg	a brown shoe , vase beach of a middle .
000000141426.jpg	a wine of pizza street side a pots surfboard .
000000141492.jpg	a down with a owl while grass a phone board
000000141517.jpg	a male of in street , tree of a served and bread .
000000141678.jpg	a dogs , kites with vase trees zebra day with vase little .
000000141756.jpg	a pots sheep eating zebra a pots reflecting of vegetables .
000000141850.jpg	a hand horse their a middle other train a middle .
000000141860.jpg	a wine of pizza street side a close through .
000000141931.jpg	a rack city with vase under zebra a under little
000000142047.jpg	a school of chicken doubles , a elephants
000000142080.jpg	a wine of pizza street other train a coffee .
000000142127.jpg	a running man of a standing of sits zebra a it
000000142198.jpg	a male of drink crossing , a served and bread .
000000142225.jpg	a frisbee that riding men phone , a water .
000000142400.jpg	a standing of sits zebra a it grass a it .
000000142510.jpg	a top umbrella zebra a top , tree of cake .
000000142547.jpg	a that city a colorful , a bear .
000000142599.jpg	a that with a owl while grass a phone board
000000142712.jpg	a rack riding city suit a snowboard lot .
000000142771.jpg	a that street other train a that , a coffee .
000000142794.jpg	a brown shoe , vase beach of a bicycle .
000000142804.jpg	a dogs group their a bicycle zebra a to , cake .
000000142826.jpg	a white riding forest , vase be giraffe a next .
000000143101.jpg	a that some a pot , tree of a hat .
000000143158.jpg	a wine of frisbee flying men a food of dirt .
000000143164.jpg	a that with a and while computers a dirt .
000000143192.jpg	a that riding street , a bear zebra a dirt .
000000143221.jpg	a game of empty street other train filled table .
000000143236.jpg	a standing of sits zebra a several of pole grass a several of pole .
000000143416.jpg	a owl counter with a close zebra a owl zebras .
000000143420.jpg	a stove zebra a ride of desktop , cake .
000000143499.jpg	a wine of pizza men dirt with a bread .
000000143516.jpg	a standing of sits zebra a cheese grass a who .
000000143532.jpg	a to his , a people with a sky .
000000143538.jpg	a air grass owl ball riding his , a power .
000000143594.jpg	a air grass owl bathroom of a to , a full
000000143783.jpg	a to his , a people zebra a camera surfboards .
000000143824.jpg	a ball forest , a cutting other train a photograph .
000000143845.jpg	a building street other train a pots watch of arrangement .
000000143936.jpg	a white passenger their a waiting other train a white .
000000144025.jpg	a that with a air cats grass a air cats grass a air cats grass a air cats
000000144062.jpg	a cloudy zebra a photo the counter the grass a desk .
000000144079.jpg	a down riding street with couple of a shore .
000000144147.jpg	a hill clear riding forest , vase beach of a middle .
000000144178.jpg	a dogs , kites with vase trees zebra a lot with vase little .
000000144388.jpg	a wine of pizza forest , a red other train a hill clear .
000000144453.jpg	a hand riding shoe , vase beach of a bicycle .
000000144562.jpg	a that with a owl while grass a elephant while men a food of dirt .
000000144582.jpg	a wall hill clear forest with a bread .
000000144586.jpg	a that some a body , tree of a bowl .
000000144641.jpg	a frisbee ski riding woman a stove , a cutting .
000000144660.jpg	a that holds a off grass soccer street with couple of a stand .
000000144703.jpg	a zebras zebra a school of court single of court single of ham .
000000144754.jpg	a stove zebra a ride of desktop , cake .
000000144772.jpg	a that with a off grass soccer street with a sky .
000000144797.jpg	a stove zebra a ride of desktop , cake .
000000144847.jpg	a standing of sits zebra a it grass a it .
000000144862.jpg	green pizza , kites with vase trees zebra day with vase little .
000000144863.jpg	a that stop a skiers with shirt this .
000000144941.jpg	a cloudy zebra a counter the photo the grass a desk .
000000144983.jpg	a that riding stop a hat , vase bear .
000000145006.jpg	green are two street with a bread zebra day with vase little .
000000145015.jpg	a sky zebra a people grass a photograph
000000145087.jpg	a kid zebra vegetables with cake , a cutting .
000000145290.jpg	a elephant - riding , vase bear giraffe a bat of tie .
000000145311.jpg	a full riding onto with vase tie giraffe a slippers .
000000145335.jpg	a dogs , kites with vase trees zebra day with vase little .
000000145381.jpg	a flowers glass riding forest , a cutting .
000000145409.jpg	a dogs city a colorful with vase playing .
000000145439.jpg	a air glass street with a bread of on .
000000145497.jpg	a that with a owl while grass a phone board
000000145503.jpg	a that forest by a cutting zebra a pole several .
000000145520.jpg	a through tree zebra a school of one grass bunch .
000000145528.jpg	green flying men phone , a phone water .
000000145631.jpg	a that with a owl while grass a phone board
000000145666.jpg	a as of sits zebra a winter grass a winter
000000145727.jpg	a game of pizza street other train a hill clear .
000000145761.jpg	a pots shoes zebra a pots top , vase beach of cake .
000000145823.jpg	a that forest , a red with couple of a shoes .
000000145824.jpg	a that with a wall cats riding him their a snowboard lake .
000000145862.jpg	a white riding shoe , vase be giraffe a white carrying .
000000145912.jpg	a male of drink crossing , a served and bread .
000000146053.jpg	a that forest , a red , a red .
000000146103.jpg	a that riding group their a bicycle other train a shoes .
000000146120.jpg	green pizza forest , a red zebra a to with vase little .
000000146171.jpg	a herd river zebra a herd grass a lit
000000146202.jpg	a wine of drink street , tree of a served and bread .
000000146235.jpg	a that with a off grass soccer riding street with a sky .
000000146249.jpg	a cutting zebra surrounded of sits grass a several of pole .
000000146440.jpg	a frisbee that riding men phone , a phone water .
000000146533.jpg	a field area , a snow other train a bicycle area .
000000146584.jpg	a wine of pizza street side a cutting .
000000146672.jpg	a top , a stand zebra a top , cake .
000000146676.jpg	a dogs with a wall cats grass a wall cats grass a wall cats grass a wall cats grass a wall cats .
000000146685.jpg	green are street other train filled table with a bread .
000000146917.jpg	a four bird sign zebra chairs of features .
000000146929.jpg	a standing zebra a cheese grass a broccoli , cake
000000147012.jpg	a wine of pizza street side a that with a off .
000000147016.jpg	a cloudy zebra a photo the a counter the grass a photo .
000000147052.jpg	a hand shoe with couple of a shoes zebra a hand .
000000147082.jpg	a wine of kitchen group , vase bear .
000000147132.jpg	a that stop a hat , a bear .
000000147134.jpg	a phone being riding towards a board by a boats .
000000147148.jpg	a seat street with a bread other train a shoes .
000000147196.jpg	a wall hill clear forest , tree of a served and bread .
000000147290.jpg	a pots photograph zebra a top , vase stand .
000000147337.jpg	a brown shoe with couple of a shoes .
000000147346.jpg	a that grass a down street other train filled table .
000000147375.jpg	a down forest by a cutting zebra a engine .
000000147386.jpg	a that some a brown their a bicycle .
000000147422.jpg	a wine of pizza street , tree of a bear .
000000147494.jpg	a white riding , vase be giraffe a shoes .
000000147505.jpg	a chair shoe other train a bicycle area .
000000147569.jpg	a that holds a off grass soccer street with a sky .
000000147585.jpg	a white riding forest , vase be giraffe a jacket .
000000147593.jpg	a wine of pizza street side a cutting zebra chicken .
000000147597.jpg	a wine of pizza street , tree of a trees bus tv .
000000147624.jpg	a that with a off grass soccer riding holds a soccer .
000000147635.jpg	a into sky zebra a child the a number the grass a number .
000000147733.jpg	a school of chicken two , four with a helmet .
000000147736.jpg	a stove zebra a player of   grass   .
000000147746.jpg	a game of shoe pieces two shoe with a cup video .
000000147778.jpg	a close zebra a an the counter the grass a zebras .
000000147788.jpg	a building riding street with a bread zebra a to .
000000147798.jpg	a flowers glass forest , tree of a cutting .
000000147866.jpg	a cup seen zebra a that , vase beach of cake .
000000147980.jpg	a wine of frisbee flying men a food of bench .
000000148004.jpg	a pots park plane street with a bread .
000000148044.jpg	a game of camera during forest , tree of a cutting .
000000148047.jpg	a that with a off grass soccer riding stop a chocolate pair .
000000148148.jpg	a that with a bench sunny stop a bench view .
000000148176.jpg	a down forest by a cutting zebra a standing of sits .
000000148205.jpg	a surfboard riding shoe with a bread of on .
000000148272.jpg	a air grass owl to his , a power .
000000148297.jpg	a that with a owl while grass a down stop a phone half .
000000148319.jpg	a wall grass owl hand riding shoe with a bread .
000000148361.jpg	a that some a pot , tree of a hat .
000000148395.jpg	a wine of pizza street , a brown .
000000148427.jpg	a building rides sinks zebra a that , a beside .
000000148452.jpg	a dogs , kites with vase trees zebra day with vase little .
000000148526.jpg	green pizza , rope two some their vase bicycle .
000000148542.jpg	a power zebra a roof , cake grass a roof of for .
000000148546.jpg	green empty crossing with a bread zebra day with vase little .
000000148591.jpg	a photo zebra a air surfer , tree of cake .
000000148655.jpg	a wine of pizza street side a cutting zebra a tracks pans .
000000148668.jpg	a metal shoe other train a cup seen .
000000148747.jpg	a that some a pot , tree of a hat .
000000148761.jpg	a hill clear forest with vase toothbrushes of a bicycle .
000000148825.jpg	a people zebra a pots people with cake .
000000148931.jpg	a that with a off grass soccer street with couple of a stand .
000000148938.jpg	a frisbee tall his , a people zebra a flowers glass .
000000148977.jpg	a air grass owl bathroom of a air grass owl bathroom of a glass .
000000149053.jpg	a rack city with vase under zebra a under little
000000149085.jpg	a wine of pizza city boxes , a bear .
000000149117.jpg	a pots plane street other train a elephants .
000000149143.jpg	a ball riding his , tree of a power .
000000149166.jpg	a running man of a clock with a decorative
000000149179.jpg	a school of chicken doubles with a elephants .
000000149331.jpg	a surfboard shoe , vase beach of a middle .
000000149588.jpg	a white riding passenger their vase be with vase produce .
000000149643.jpg	a dogs stop a baby to with shirt this .
000000149645.jpg	a zebras zebra a school of ham , cake
000000149738.jpg	a pots shoes zebra a top , vase beach of cake .
000000149767.jpg	a wall hill clear forest with vase toothbrushes of a bread .
000000149774.jpg	a down riding tricks , a tracks pans .
000000149842.jpg	a that riding street other train a clock .
000000149961.jpg	a that group their a bicycle zebra a pots hit of pizza .
000000149996.jpg	a wine of pizza street other train filled table .
000000150026.jpg	a owl standing zebra a as of types grass a as of types .
000000150040.jpg	a game of someone two street with a bread .
000000150091.jpg	a white riding door baseball a carrying zebra a white , vase be .
000000150144.jpg	a down riding stop a wearing of gray .
000000150195.jpg	a standing of sits zebra a it grass a it .
000000150258.jpg	a wine of pizza group their a bicycle other train a shoes .
000000150413.jpg	a ball riding forest with a photograph cliff .
000000150427.jpg	a standing of sits zebra a it grass a it .
000000150442.jpg	a as of types zebra a ride of sand .
000000150537.jpg	a down riding boat a line with laying box .
000000150704.jpg	a male of steps crossing , a served and bread .
000000150773.jpg	a down with a drinking off riding guitar , a hat .
000000150942.jpg	a wine of pizza street , a full with vase tie .
000000150996.jpg	a wine of bed street with a bread .
000000151053.jpg	a ball riding forest , a cutting zebra a skier .
000000151054.jpg	a photo zebra a owl photo skiing curtains grass a owl counter .
000000151074.jpg	a wine of pizza , kites with vase trees .
000000151100.jpg	a standing of sits zebra a ride of sand .
000000151161.jpg	a that some a metal their a sit .
000000151245.jpg	a pots following forest , tree of a mountain .
000000151264.jpg	a white riding forest , vase be giraffe a shoes .
000000151289.jpg	a dogs walking box riding his , a engine .
000000151432.jpg	a persons riding street , a country giraffe a bat of tie .
000000151434.jpg	a game of rope shoe with a cup video .
000000151492.jpg	a down forest , a child zebra a tracks pans .
000000151499.jpg	a hand riding shoe , vase beach of vase middle .
000000151523.jpg	a pots stove zebra a ride of sand , cake .
000000151546.jpg	a cutting zebra surrounded of sits grass a several of pole .
000000151577.jpg	a bicycle area zebra a bicycle area , cake .
000000151599.jpg	a bicycle around zebra a bicycle around , cake .
000000151611.jpg	a that with a off grass soccer riding its by a tracks pans .
000000151704.jpg	a that with a off grass soccer riding street with couple of a oranges .
000000151709.jpg	a wine of pizza street , tree of a rack .
000000151777.jpg	a wine of pizza street side a bread .
000000151801.jpg	a cloudy zebra a counter the desk the grass a desk .
000000151807.jpg	a that some a metal their a bicycle other train a shoes .
000000151826.jpg	a down boat a baby to , a skinny .
000000151840.jpg	a that with a owl while grass a elephant while men phone .
000000151848.jpg	a into sky zebra a pots photograph grass a photograph .
000000151908.jpg	a wine of are street with a bread .
000000151915.jpg	a clock street with a bread of on .
000000152020.jpg	a standing of sits zebra a it grass a it .
000000152079.jpg	a sandwich tall forest , a people zebra a flowers glass .
000000152208.jpg	a stands grass air surfboard riding shoe with a cup video .
000000152237.jpg	a down his , a people zebra a plastic .
000000152247.jpg	a white passenger their be other train a white .
000000152277.jpg	a top , a snow zebra a top , cake .
000000152281.jpg	a male of steps street , tree of a served and bread .
000000152333.jpg	a hand horse their a bicycle other train a looking shoes .
000000152340.jpg	a dogs riding stop a standing of sits .
000000152385.jpg	a brown shoe , vase beach of a middle .
000000152397.jpg	a stove zebra a player of stove , cake .
000000152483.jpg	a dogs riding street , a red giraffe a refrigerator .
000000152531.jpg	a cloudy zebra a counter the photo the grass a surfing .
000000152556.jpg	a that grass down forest by a cutting zebra a who .
000000152582.jpg	a bear zebra a hat grass a full , cake .
000000152657.jpg	a into sky zebra a child the a river the a number grass a number .
000000152701.jpg	a wine of flying street other train filled table .
000000152733.jpg	a down riding street with couple of a engine .
000000152819.jpg	a that riding street other train a building .
000000152857.jpg	a male of are group station a served and bread .
000000152914.jpg	a standing of sits zebra a ramp of cell grass a ramp of cell .
000000152946.jpg	a game of pizza street , tree of a trees bus tv .
000000152954.jpg	a flowers glass forest , a airplane red .
000000152963.jpg	a that with a bench sunny stop a view .
000000153013.jpg	a that stop a pots park grass owl to .
000000153031.jpg	a field area , a snow other train a bicycle area .
000000153039.jpg	a wine of flying street side a sold water .
000000153042.jpg	a wine of pizza street , tree of a served and bread .
000000153083.jpg	green rope shoe with a cup video zebra a lot with vase little .
000000153105.jpg	a top , a snow zebra a top , cake .
000000153136.jpg	a game of kitchen forest , tree of a airplane red .
000000153186.jpg	a seat street with a display with there .
000000153397.jpg	a that some a pot , tree of a hat .
000000153481.jpg	a game of pizza street other train a white .
000000153486.jpg	a that riding street with couple of a pots watch of chicken .
000000153506.jpg	a standing zebra a cheese grass a ramp of cell .
000000153618.jpg	a school of chicken purple carrots a elephants
000000153666.jpg	a bicycle area zebra a area , cake .
000000153692.jpg	a that some a metal their a bicycle other train a bicycle .
000000153814.jpg	a stove zebra a ride of desktop , cake .
000000153864.jpg	a that with a drinking off riding some a hat , a pot .
000000153892.jpg	a dogs stop a racket grass a as of sits .
000000153960.jpg	a park grass owl ball his , tree of a owl shaped .
000000154002.jpg	a into sky zebra a child the image the cell cutting grass a number .
000000154096.jpg	a down with a owl while grass a phone board
000000154155.jpg	a school of sized grass sand , a cutting .
000000154168.jpg	a hand riding shoe , vase beach of vase middle .
000000154189.jpg	a air grass owl bathroom of a to with a photograph
000000154193.jpg	a that riding forest by a cutting zebra a stove .
000000154220.jpg	a wine of pizza men dirt with a bread .
000000154263.jpg	a that with a off grass soccer forest , a red .
000000154346.jpg	a white passenger their a waiting other train a next .
000000154419.jpg	a ball riding forest , a image with a sky .
000000154452.jpg	a wall grass owl hand shoe with a bread .
000000154515.jpg	a hand riding shoe , vase beach of vase middle .
000000154518.jpg	a running man of a tracks pans , a coffee
000000154547.jpg	a dogs , kites with vase trees zebra day with vase little .
000000154567.jpg	a that with a owl while grass a elephant while men phone .
000000154584.jpg	a wine of pizza some , tree of a male of steps .
000000154648.jpg	a field area zebra a bicycle area , cake .
000000154708.jpg	a that some a pot , tree of a hat .
000000154752.jpg	a that group their a bicycle other train a shoes .
000000154798.jpg	a wine of pizza street , tree of a bear .
000000154817.jpg	a cloudy zebra a counter the desk the grass a desk .
000000154916.jpg	a running man of a dogs walking box , a tracks pans
000000154972.jpg	a pots following forest , tree of a mountain .
