image	caption
000000426803.jpg	a that grass a down two street with vase blue .
000000426835.jpg	a wine of pizza street side a phone water .
000000426863.jpg	a surfboard shoe , vase beach of a middle .
000000426874.jpg	a ball his , a people with a sky .
000000426997.jpg	a that , a commercial with vase trees .
000000427005.jpg	a game of pizza sitting two forest , a cutting
000000427036.jpg	a running man of a standing of sits zebra a ramp of cell
000000427046.jpg	a wine of pizza group their a bicycle zebra a wall - .
000000427051.jpg	a wall rail carriage hand horse their a bicycle .
000000427068.jpg	a area sitting young foreground shorts , a stand .
000000427069.jpg	a bicycle zebra a bicycle area grass a bicycle area .
000000427100.jpg	a pots following forest , tree of a going .
000000427113.jpg	a that grass down street other train filled table .
000000427193.jpg	green pizza two street , a snowboard lake .
000000427203.jpg	a stove zebra a player of   , cake .
000000427223.jpg	a down riding men phone , a phone water .
000000427232.jpg	a wine of pizza street , tree of a bread .
000000427238.jpg	a that grass a down two street with a sky .
000000427308.jpg	a owl kid zebra a wall grass owl intersection , cake .
000000427319.jpg	a standing of sits zebra a it grass a it .
000000427449.jpg	a that with a off grass soccer , a brown .
000000427467.jpg	a building riding street with vase toothbrushes of a middle .
000000427476.jpg	a frisbee ski riding street with a cloudy zebra a having .
000000427544.jpg	a cutting zebra a standing of sits grass a ramp of cell .
000000427545.jpg	a close zebra a an the a cutting the grass a cutting .
000000427547.jpg	a white passenger their be other train a white .
000000427573.jpg	a that some a brown their a bicycle .
000000427598.jpg	a that with a off grass soccer street with couple of a stand .
000000427666.jpg	a school of chicken two , a cutting .
000000427729.jpg	a male of steps crossing , a served and bread .
000000427796.jpg	a close zebra a an the an the grass a pretty .
000000427802.jpg	a school of rainbow two with a as .
000000427816.jpg	a to forest , a metal with vase bicycle .
000000427868.jpg	a game of kitchen street , tree of a airplane red .
000000427920.jpg	a cup seen zebra a red grass a red .
000000427975.jpg	a buses zebra a pretty grass a pretty
000000427980.jpg	a down forest by a cutting zebra a stove , cake .
000000428015.jpg	a that with a elephant while grass a air while riding stop a phone board .
000000428029.jpg	a white passenger their a knife suit a knife .
000000428079.jpg	a owl zebras with a chocolate sky zebra a airplane signs .
000000428105.jpg	a pots owl an tree night forest , tree of a an .
000000428149.jpg	a that riding street with vase toothbrushes of a full .
000000428208.jpg	a ride of sand , a cutting zebra a racket .
000000428248.jpg	a that some a body their a bicycle .
000000428278.jpg	a stove zebra a player of   , cake .
000000428336.jpg	a that riding street with couple of a pots shoes .
000000428379.jpg	a bicycle area , a snow giraffe a bicycle .
000000428503.jpg	a wine of pizza city boxes , a bear .
000000428595.jpg	a wine of pizza street , tree of a served and bread .
000000428599.jpg	a holding of stove , a an tree .
000000428602.jpg	a standing of sits zebra a it grass a it .
000000428605.jpg	a air grass owl bathroom of a air grass owl bathroom of a hill clear .
000000428612.jpg	a kid zebra vegetables with cake , a cutting .
000000428746.jpg	a building riding street with vase cut giraffe a bat of tie .
000000428769.jpg	a tracks pans riding forest , a cutting .
000000428788.jpg	a wine of pieces shoe with a cup video .
000000428810.jpg	a wine of pizza street side a rack .
000000428830.jpg	a that riding dining a like , a body .
000000428837.jpg	a game of empty two street with a bread .
000000428856.jpg	a full riding onto with vase tie giraffe a sit .
000000428945.jpg	a in street with a bread zebra a pots and caption .
000000429052.jpg	a photo zebra a opening surfer , cake .
000000429160.jpg	a close zebra a zebras the a counter the grass a zebras .
000000429221.jpg	a cloudy zebra a counter the photo the grass desk .
000000429227.jpg	green someone two street with a bread of on .
000000429233.jpg	a that , a body with a bike .
000000429283.jpg	a clock street with a bread other train a elephants .
000000429289.jpg	a game of pizza sitting two street with a bread
000000429290.jpg	a frisbee ski stop a bench view with couple of a hit .
000000429335.jpg	a dogs riding stop a standing of sits .
000000429407.jpg	a wine of bed street side a refrigerator .
000000429509.jpg	a seat riding crossing with a bread of on .
000000429521.jpg	a wall grass owl hand horse their a bicycle .
000000429540.jpg	a wine of empty street with a bread .
000000429644.jpg	green jump two , vase be with vase from .
000000429807.jpg	a that with a close resting sits with a close .
000000429820.jpg	a rack city with vase under zebra a under little
000000430094.jpg	a game of pieces shoe other train filled table .
000000430101.jpg	a into sky zebra a child the a cutting the grass a cutting .
000000430244.jpg	green flying street with a into sky zebra a number .
000000430254.jpg	a male of drink crossing with a bread .
000000430259.jpg	a that with a wall while grass a nearby stop a phone board .
000000430273.jpg	a white passenger their be other train a white .
000000430405.jpg	a that with a close resting sits with a suitcase .
000000430417.jpg	a wine of pizza forest , a red with vase trees .
000000430518.jpg	a that with a owl while grass a phone board
000000430523.jpg	a pots plane street with a bread other train a elephants .
000000430529.jpg	a dogs city a colorful , a bear .
000000430617.jpg	a bench being towards a view by a boats .
000000430624.jpg	a that forest by a cutting zebra a standing of sits .
000000430640.jpg	a ramp of cell grass a ramp of cell .
000000430660.jpg	a wine of pizza some kites their a trees bus tv .
000000430688.jpg	a top umbrella zebra a top , tree of cake .
000000430690.jpg	a that riding group their a bicycle other train a racquet around .
000000430753.jpg	a wearing of gray grass a kid of vegetables .
000000430756.jpg	a building street other train a pots watch of arrangement .
000000430856.jpg	a park grass owl to riding street , a bread .
000000430964.jpg	a that some kites their a trees bus tv .
000000431116.jpg	a that some a pot , tree of a hat .
000000431178.jpg	a that with a close zebra a counter grass a desk
000000431194.jpg	out bed street with a bread zebra day with vase little .
000000431234.jpg	a owl photo zebra a air grass owl top
000000431281.jpg	a school of wrapped sitting two , a snow .
000000431401.jpg	a dogs riding street with couple of a photo .
000000431452.jpg	a game of camera during his , a people .
000000431531.jpg	a into sky zebra a child the a number the grass a number .
000000431573.jpg	a hill clear forest , vase beach of a middle .
000000431627.jpg	a that holds a off grass soccer riding stop a tracks pans .
000000431761.jpg	a white riding forest , vase be with a white carrying .
000000431825.jpg	out bed two street with a display with there .
000000431846.jpg	a rack city with vase under zebra a under little
000000431893.jpg	a that forest , a red zebra a body .
000000431967.jpg	a cloudy zebra a photo the counter the grass a surfing .
000000431972.jpg	a down riding forest by a cutting zebra a standing of sits .
000000431988.jpg	a that some a body their a bowl .
000000431995.jpg	a people zebra a people grass a river with cake
000000432037.jpg	a down with a skateboarder fast laying smiling .
000000432064.jpg	a top umbrella riding her zebra a top , vase beach of cake .
000000432293.jpg	a standing of sits zebra a it grass a it .
000000432373.jpg	a area sitting magazine cars <UNK> cars <UNK> cars .
000000432421.jpg	a persons city suit a bat of tie .
000000432444.jpg	a wine of pizza forest , a red with a bread .
000000432569.jpg	a that with a nearby riding stop a pots plane .
000000432605.jpg	a owl cloudy zebra a counter grass a desk
000000432648.jpg	a air grass owl bathroom of a park glass with a shore .
000000432668.jpg	a that group station vase bear zebra a hat .
000000432723.jpg	a wall hill clear forest , vase beach of a middle .
000000432754.jpg	a that group their a bicycle zebra a metal .
000000432849.jpg	a pots owl grass air white , a waiting .
000000432891.jpg	a bench being towards a view by a boats .
000000433007.jpg	a that stop a baby to with shirt this .
000000433044.jpg	a as of poster grass a as of types .
000000433221.jpg	a cutting zebra a ride of surrounded of sits , cake
000000433277.jpg	a river zebra a engine grass a top , cake
000000433278.jpg	a up shoe with couple of a shoes zebra a bicycle area .
000000433301.jpg	a running man of a standing of sits zebra poster
000000433387.jpg	a dogs , kites oven suit a snowboard lake .
000000433389.jpg	a kid zebra vegetables , cake grass a kid of vegetables .
000000433451.jpg	a that some a body their a bicycle .
000000433561.jpg	a pots following city parked vase playing zebra a under little
000000433607.jpg	a close zebra a an the an the grass a zebras .
000000433618.jpg	a stove zebra a ride of desktop , cake .
000000433683.jpg	a full riding shoe with vase tie giraffe a hole .
000000433714.jpg	a dogs group their a blue middle zebra a to , cake .
000000433716.jpg	a pots shoes zebra a area , cake .
000000433804.jpg	a game of mouth two with a bat of tie
000000433822.jpg	a frisbee that riding forest by a cutting zebra a fork .
000000433904.jpg	a bicycle area , a snow other train a bicycle .
000000433927.jpg	a pots from bicycle zebra a video of pieces .
000000433941.jpg	a bicycle area with couple of a shoes .
000000433968.jpg	a pots playing rack city with vase under .
000000434028.jpg	a wine of pizza street other train a pots plane .
000000434060.jpg	a male of drink crossing , a served and bread .
000000434098.jpg	a cloudy zebra a photo the counter the grass a surfing .
000000434159.jpg	a pots shoes zebra a top , cake .
000000434177.jpg	a that group station vase bear zebra a hat .
000000434190.jpg	a air grass owl to riding street with a image .
000000434211.jpg	a dogs , kites with vase trees zebra a lot with vase little .
000000434279.jpg	a white riding shoe , vase be giraffe a shoes .
000000434338.jpg	a trees bus lot zebra a lot with vase little .
000000434380.jpg	a that some a body their a bowl .
000000434519.jpg	a game of cross street other train filled table .
000000434576.jpg	a ball riding forest , a set with a sky .
000000434583.jpg	a game of flying men a food of light .
000000434634.jpg	a stove zebra a ride of desktop , cake .
000000434693.jpg	a that riding group their a bicycle zebra a hill clear .
000000434735.jpg	a clock group station a blue middle other train a next .
000000434773.jpg	a cutting zebra a school of sits distance , cake
000000434870.jpg	a wine of someone street with a bread .
000000434900.jpg	a river zebra a engine grass a engine , cake
000000434930.jpg	a frisbee ski stop a skiers with shirt this .
000000434951.jpg	a game of empty street other train filled table .
000000434990.jpg	a chair horse their a bicycle other train a bicycle .
000000435012.jpg	a wine of pizza street side a bicycle .
000000435045.jpg	a ball forest , a airplane cutting other train a photograph .
000000435075.jpg	a game of camera during forest , tree of a cutting .
000000435134.jpg	a owl zebras without forest with a close .
000000435141.jpg	a that with a owl while grass a air while riding men dirt .
000000435260.jpg	a wine of pizza street side a pots plane .
000000435334.jpg	a wine of is crossing with a bread .
000000435384.jpg	a school of distance two , a stacks .
000000435399.jpg	a white passenger their be other train a white .
000000435576.jpg	a wine of pizza street side a cutting zebra chicken .
000000435681.jpg	a brown shoe , vase beach of a middle .
000000435718.jpg	a that with a owl while grass a phone board
000000435787.jpg	a reflection zebra a people the a cutting the grass a photograph .
000000435820.jpg	a wine of pizza street side a cutting zebra a engine .
000000435823.jpg	a that with a wall while grass a wall nearby riding stop a colorful .
000000435841.jpg	a standing of sits zebra a several of pole .
000000435869.jpg	a wine of pizza forest side a cutting zebra a cell ramp .
000000435883.jpg	a dogs riding forest , a red zebra a intersection with cake .
000000435886.jpg	a stove zebra a player of   , cake .
000000435909.jpg	a standing of sits zebra a winter grass a winter .
000000435913.jpg	green bed two street with a display with there .
000000435933.jpg	a wall hill clear forest , vase beach of a bicycle .
000000436085.jpg	a pots following forest , tree of a going .
000000436183.jpg	a down with a owl while grass a phone board
000000436203.jpg	a that grass a down two group , vase bear .
000000436284.jpg	a persons riding been , a airplane cruise .
000000436411.jpg	a glass riding forest , a country with vase tie .
000000436440.jpg	a that grass down two forest by a cutting zebra stove .
000000436455.jpg	a that with a close zebra a pole several .
000000436492.jpg	a bicycle area zebra a bicycle area , cake .
000000436544.jpg	a down with a close zebra a pots uniform of sits .
000000436571.jpg	a pots from zebra a pots top umbrella with vase little .
000000436580.jpg	a male of drink crossing , a served and bread .
000000436626.jpg	a full riding onto with a wooded zebra a full with vase little .
000000436651.jpg	a surfboard shoe , vase beach of a middle .
000000436722.jpg	a fork zebra a brightly grass a brightly , cake .
000000436793.jpg	a seat riding street with vase on giraffe a elephants .
000000436795.jpg	a that riding boat a holding of stove .
000000436802.jpg	a to riding bottle with vase on zebra a dirt .
000000436814.jpg	a river zebra a engine grass a lit , cake
000000436835.jpg	a wall hill clear forest with vase toothbrushes of a bicycle .
000000436865.jpg	green bed two street with a bread zebra day with vase little .
000000436963.jpg	a into sky zebra a number grass a number
000000437102.jpg	a into sky zebra a number grass a number
000000437213.jpg	a zebras zebra a signs tower with cake .
000000437264.jpg	a clock street with a bread zebra day with vase little .
000000437284.jpg	a white riding door baseball a carrying zebra pizza sun train floor .
000000437332.jpg	a dogs , a body with a car bike .
000000437416.jpg	a reflection zebra a people the a photograph the grass a photograph .
000000437435.jpg	a cloudy zebra a photo the counter the grass a surfing .
000000437440.jpg	a dogs , a commercial with vase trees .
000000437481.jpg	a that street other train a pots watch of for .
000000437497.jpg	a bench being riding towards a view by a boats .
000000437540.jpg	a that with a blender , a hat with vase jumping .
000000437597.jpg	a bicycle area zebra a bicycle area , cake .
000000437605.jpg	a game of pizza street , tree of a trees bus tv .
000000437613.jpg	a wall grass owl surfboard shoe with couple of a shoes .
000000437685.jpg	a flowers glass forest , tree of a owl standing .
000000437710.jpg	a standing zebra a holding of fork , cake .
000000437714.jpg	a in street other train a refrigerator with a bread .
000000437759.jpg	a that , kites riding street , a snowboard tv .
000000437789.jpg	a school of sits sitting two , a cutting
000000437895.jpg	a people zebra a people grass a people with cake
000000437923.jpg	a standing of sits zebra a cheese grass a ramp of cell .
000000437951.jpg	a glass riding street with vase on zebra hot this tower .
000000438046.jpg	a people zebra a people grass a cutting with cake
000000438060.jpg	a dogs stop a power zebra a ball , cake .
000000438075.jpg	a pots owl persons city parked vase playing .
000000438081.jpg	a that riding street with couple of a shoes zebra a up .
000000438196.jpg	a wine of pizza street other train filled table .
000000438306.jpg	a white passenger their be other train a white .
000000438333.jpg	a that grass a down street with couple of a photograph .
000000438432.jpg	a wine of flying street side a bench plant .
000000438439.jpg	green drink two street with a bread zebra a to with vase little .
000000438481.jpg	a white carrying zebra a white , vase be .
000000438504.jpg	a wall grass owl white , a take waiting .
000000438580.jpg	a wine of mouth two with vase tie .
000000438628.jpg	a ball riding his , a power with a sky .
000000438721.jpg	a that with a sunny riding street , a bread zebra a view .
000000438788.jpg	a holding of fork , a standing zebra a it .
000000438816.jpg	a that , a body with a cup video .
000000438844.jpg	a hand riding shoe , vase beach of vase middle .
000000438899.jpg	a buses riding forest , a through other train a luggage of pole .
000000438905.jpg	a standing of sits zebra a ride of sits .
000000438919.jpg	motorcycle plane street other train a elephants stopped .
000000438978.jpg	a pots following forest , tree of a mountain .
000000438995.jpg	a top , a snow with couple of a shoes .
000000439084.jpg	a bench being towards a view by a boats .
000000439085.jpg	a ball his , a child zebra a cat brush .
000000439107.jpg	a pots owl full have with vase tie .
000000439143.jpg	a into sky zebra a child the a number the grass a number .
000000439186.jpg	a seat street with couple of a shoes .
000000439299.jpg	a that riding street , a bear zebra a hat .
000000439324.jpg	a camera surfboards riding forest , a people .
000000439346.jpg	a that with a off grass soccer street with a sky .
000000439386.jpg	a that with a owl while grass a phone board
000000439410.jpg	a that with a owl while grass a phone board
000000439445.jpg	a school of chicken two , a cutting .
000000439621.jpg	a that with a trees off him their a trees bus tv .
000000439651.jpg	a engine herd forest , tree of a river .
000000439756.jpg	a that with a owl while grass a phone board
000000439774.jpg	green stuffed forest , a child zebra a to .
000000439940.jpg	a ball forest , a airplane red with a bread .
000000439946.jpg	a that riding forest , a photo zebra a to .
000000440057.jpg	a ball his , a people zebra a ball , cake .
000000440097.jpg	green is street with a bread zebra a pots park seat .
000000440161.jpg	a clock street other train a elephants with a next .
000000440212.jpg	a standing of sits zebra a it grass a it .
000000440217.jpg	a knife zebra a knife grass a knife with vase little .
000000440244.jpg	a bench being riding towards by a market .
000000440273.jpg	a that some a building rides sinks , a bicycle .
000000440283.jpg	a pots top umbrella with vase toothbrushes of a bread .
000000440372.jpg	a owl zebras zebra a air grass owl runway of a chocolate owl zebras .
000000440443.jpg	a bicycle area zebra a bicycle monkey , cake .
000000440511.jpg	green empty two street with a bread zebra a pots park glass .
000000440527.jpg	a down stop a walls - with couple of a pots shoes .
000000440534.jpg	a that riding forest , a brown zebra a to .
000000440562.jpg	a that forest by a cutting zebra a pole several .
000000440623.jpg	a standing of sits zebra a cheese grass a who .
000000440656.jpg	a stove zebra a vehicle of sits , cake .
000000440666.jpg	a that riding street , a snowboard lake zebra a commercial .
000000440836.jpg	a air grass owl ball his , a power .
000000440878.jpg	a owl as zebra a as of catch grass a as of tie .
000000440893.jpg	a wine of are street with a bread .
000000440900.jpg	a male of steps crossing , a served and bread .
000000440928.jpg	a rack riding city suit a bat of tie .
000000441008.jpg	a that riding street , a hat with vase cut .
000000441108.jpg	a game of large two street other train a building .
000000441172.jpg	a that group their a bicycle zebra a pots - .
000000441173.jpg	a cutting zebra a ride of sits , cake
000000441229.jpg	a that riding him their a snowboard lake .
000000441253.jpg	a river zebra a engine grass a rockefeller , cake
000000441325.jpg	a that with a owl while grass wet of pole wet .
000000441419.jpg	a fork zebra a racket grass a racket .
000000441430.jpg	a cutting zebra a school of sand with cake
000000441472.jpg	a that street , tree of a trees bus tv .
000000441480.jpg	a that street other train a pots shoes .
000000441496.jpg	a full riding thrown with vase tie zebra pizza , cake .
000000441522.jpg	a wine of pizza street side a close through .
000000441608.jpg	a that forest , a red zebra a plastic , shirt past .
000000441633.jpg	a down riding stop a skier with laying box .
000000441686.jpg	a building grass a building two crossing with a bread .
000000441788.jpg	a air grass owl bathroom of a white , a waiting .
000000441824.jpg	a that with a off grass soccer riding stop a tracks pans .
000000441828.jpg	a that some a pot , tree of a hat .
000000441873.jpg	a that city a colorful with a bread .
000000441992.jpg	a cutting zebra a school of colored , cake
000000442001.jpg	a stove zebra a wire grass a who , cake .
000000442099.jpg	a stove zebra a ride of desktop , cake .
000000442106.jpg	a as of sits zebra a winter grass a winter
000000442210.jpg	a that riding forest , a brown zebra a video of for .
000000442231.jpg	a that forest by a cutting zebra a standing of sits .
000000442232.jpg	a down forest by a cutting zebra a stove .
000000442301.jpg	a racket woman a holding of fork , a standing .
000000442345.jpg	a racquet around , a bicycle across zebra a racquet around .
000000442356.jpg	a that riding street with couple of a engine .
000000442416.jpg	a stove zebra a ride of desktop , cake .
000000442419.jpg	a kid zebra vegetables with cake , a cutting .
000000442468.jpg	a air grass owl ball his , a airplane red .
000000442509.jpg	a engine herd forest , tree of a river .
000000442565.jpg	a that group station a bear zebra a hat .
000000442572.jpg	a that forest , a child zebra a to , shirt boy .
000000442582.jpg	a hand riding horse their vase bicycle zebra a hand , vase bicycle .
000000442585.jpg	a wine of empty two street with a bread .
000000442672.jpg	a park grass owl to group corner a bear .
000000442680.jpg	green someone street other train filled table with a bread .
000000442725.jpg	a down boat a holding of stove , a standing .
000000442761.jpg	a park grass owl to zebra a slicing with hot this .
000000442793.jpg	a in street other train a in with a bread .
000000442808.jpg	a dogs , kites with vase trees zebra a lot with vase little .
000000442879.jpg	a chair riding shoe with a carts other train a shoes .
000000442961.jpg	a bench being towards a view by a boats .
000000442980.jpg	a in street other train a elephants with a bread .
000000443065.jpg	a that some kites their a trees bus tv .
000000443093.jpg	a baby to grass bridge , a standing .
000000443139.jpg	a park grass owl to forest , a chair .
000000443177.jpg	a standing of sits zebra a several of pole grass a several of pole .
000000443180.jpg	a frisbee ski riding forest with a image zebra a luggage of pole .
000000443188.jpg	a that some a body their a bicycle .
000000443278.jpg	a in grass a in two street with a bread .
000000443361.jpg	a reflection zebra a people the a people the grass a photograph .
000000443410.jpg	a wine of pizza forest side a cutting boat sits .
000000443450.jpg	a rack city with vase under zebra a under little
000000443490.jpg	a school of sized grass sand two , four .
000000443522.jpg	a standing of sits zebra a it grass a it .
000000443602.jpg	a that with a close zebra a down grass a baby to .
000000443618.jpg	a that with a wall while grass a nearby riding stop a bench view .
000000443784.jpg	a that riding men phone , a phone water .
000000443818.jpg	a park grass owl to his , a airplane them .
000000443829.jpg	a standing of sits zebra a it grass a it .
000000443857.jpg	a people zebra a people grass a subway , cake .
000000443875.jpg	a cloudy zebra a counter the a desk the grass a counter .
000000443887.jpg	a cutting zebra a kid of vegetables , cake
000000443941.jpg	a bicycle area zebra a bicycle area , cake .
000000443944.jpg	a into sky zebra a child the a child the grass a number .
000000443952.jpg	a cloudy zebra a photo the counter the grass surfing .
000000444015.jpg	a close zebra a an the counter the grass a pretty .
000000444018.jpg	a white passenger their be other train a looking shoes .
000000444025.jpg	a ball his , tree of a engine herd .
000000444086.jpg	a dogs , a commercial with vase trees .
000000444152.jpg	a frisbee ski riding men phone , a phone water .
000000444168.jpg	a frisbee ski riding woman a fork zebra a racket .
000000444210.jpg	a pots following forest , tree of a going .
000000444470.jpg	a that with a wall while riding forest by a cutting zebra a pole several .
000000444533.jpg	a frisbee tall riding stop a phone board .
000000444560.jpg	a all of rope shoe with a cup video .
000000444582.jpg	out bed two street with a display with there .
000000444583.jpg	a that stop a phone half , tree of a phone water .
000000444619.jpg	a wine of pizza some rope their a bicycle .
000000444631.jpg	a dogs , a body with vase toothbrushes of vase middle .
000000444809.jpg	a that some a body their a bowl .
000000444830.jpg	a that street with couple of a shoes zebra a area .
000000444866.jpg	a brown shoe , vase beach of a middle .
000000444893.jpg	a to grass a to two his , vase bear .
000000444913.jpg	a that with a and while grass a wall while riding computers a dirt .
000000444983.jpg	a white riding passenger their vase be with vase from .
000000445019.jpg	a bench being towards a view by a boats .
000000445028.jpg	a cloudy zebra a photo the counter the grass a desk .
000000445038.jpg	a rack city with vase under zebra a under little
000000445073.jpg	a that stop a phone half , a phone water .
000000445099.jpg	a wine of pizza street side a cutting zebra a tracks pans .
000000445113.jpg	a dogs , a bicycle zebra a hill clear .
000000445218.jpg	a that riding stop a power zebra a top , cake .
000000445268.jpg	a full riding onto with vase tie giraffe a bat of tie .
000000445309.jpg	a brown shoe , vase beach of a middle .
000000445323.jpg	a wine of pizza street side a pots photograph .
