image	caption
000000427920.jpg	a top umbrella zebra a top , vase beach of cake .
000000427975.jpg	a zebras zebra a school of closet , cake
000000427980.jpg	a down stop a line with laying box .
000000428015.jpg	a that riding dining a like , a body .
000000428029.jpg	a white riding shoe , vase be giraffe a shoes .
000000428079.jpg	a kid zebra a top , cake grass a photograph with vase little .
000000428105.jpg	a school of chicken two forest , a cutting .
000000428149.jpg	a to riding forest with a chair photograph .
000000428208.jpg	a cutting pulled zebra a ride of sized grass sand .
000000428248.jpg	a that riding dining a like , a body .
000000428278.jpg	a cheese zebra a video of desktop , cake
000000428336.jpg	a that stop a pots - with couple of a hit of pizza .
000000428379.jpg	a bicycle area zebra a area , cake .
000000428503.jpg	a wine of pizza city boxes , a bear .
000000428595.jpg	green flying forest , a red with couple of a elephants .
000000428599.jpg	a stove night zebra a vehicle of sits , cake .
000000428602.jpg	a standing of sits zebra a cheese grass a ramp of cell .
000000428605.jpg	a hill clear with vase toothbrushes of a bread .
000000428612.jpg	a kid sign zebra vegetables forest , a cutting .
000000428746.jpg	a seat riding street with vase cut giraffe vase jumping .
000000428769.jpg	a dogs riding street with couple of a signs .
000000428788.jpg	a brown shoe with couple of a shore .
000000428810.jpg	a full zebra a school of kitchen , cake
000000428830.jpg	a that forest , a child zebra a ball with shirt boy .
000000428837.jpg	a seat street with a bread other train a elephants .
000000428856.jpg	a full riding onto by vase hole with vase tie .
000000428945.jpg	a in riding street with a bread zebra a refrigerator .
000000429052.jpg	a dark of a white zebra a school of ladder , cake .
000000429160.jpg	a close zebra a zebras the pretty grass a pretty .
000000429221.jpg	a close zebra a counter grass a desk
000000429227.jpg	green someone two street with a bread of on .
000000429233.jpg	a that some a body their a bicycle .
000000429283.jpg	a clock street other train a elephants with a bread .
000000429289.jpg	a that riding street other train a seat with a split .
000000429290.jpg	a that stop a bench view , a bread .
000000429335.jpg	a standing zebra a baby to grass a ramp of cell .
000000429407.jpg	green bed street other train filled table with a getting .
000000429509.jpg	a seat riding street with a bread zebra a lot with vase little .
000000429521.jpg	a up shoe , vase beach of a middle .
000000429540.jpg	a male of steps street , tree of a served and bread .
000000429644.jpg	a white riding passenger their vase be giraffe a shoes .
000000429807.jpg	a that street with a close resting sits .
000000429820.jpg	a rack riding city suit a mountain zebra a video of pizza .
000000430094.jpg	a bicycle rain zebra a hill clear grass a hill clear .
000000430101.jpg	a into sky zebra a lone grass a lone
000000430244.jpg	green flying two men a back food with a into sky .
000000430254.jpg	a male of drink crossing with a bread .
000000430259.jpg	a that with a air while grass owl walks grass a air while grass a air while grass a air grass owl bathroom
000000430273.jpg	a white riding passenger their vase be giraffe a white carrying .
000000430405.jpg	a that with a close resting sits , a cutting .
000000430417.jpg	a that riding street other train a drink .
000000430518.jpg	a that street , a phone water stop a half .
000000430523.jpg	motorcycle plane street with a bread zebra a elephants with vase little .
000000430529.jpg	a that riding city a colorful , vase bear .
000000430617.jpg	a bench being stop a view , tree of a bread .
000000430624.jpg	a cutting zebra a video of personal , cake
000000430640.jpg	a engine grass a several of pole , a cutting .
000000430660.jpg	a wine of pizza street , tree of a trees bus tv .
000000430688.jpg	a top umbrella zebra a top , tree of cake .
000000430690.jpg	a bicycle area riding her , a ostrich bicycle .
000000430753.jpg	a wearing of gray forest , tree of a cutting .
000000430756.jpg	a that street other train a building with a snack .
000000430856.jpg	a seat riding street with a bread zebra a seat .
000000430964.jpg	a that , kites riding street with vase trees .
000000431116.jpg	a that some a pot , tree of a hat .
000000431178.jpg	a that riding street with a sky zebra a ball .
000000431194.jpg	green bed street other train filled table with a getting .
000000431234.jpg	a kid zebra a school of vegetables , cake
000000431281.jpg	a school of wrapped sitting two forest , vase sink .
000000431401.jpg	a that forest with a image zebra a power .
000000431452.jpg	a to his , a people zebra a camera surfboards .
000000431531.jpg	a into sky zebra a child grass a number
000000431573.jpg	a hill clear forest , vase beach of a middle .
000000431627.jpg	a that forest with a image zebra a engine .
000000431761.jpg	a white riding shoe by a white carrying .
000000431825.jpg	green bed street other train filled table , a blue sink .
000000431846.jpg	a rack city with vase under zebra a under little
000000431893.jpg	a that forest , a red other train a that with a off .
000000431967.jpg	a sky zebra a people grass a photograph
000000431972.jpg	a that street with couple of a cutting zebra a standing of sits .
000000431988.jpg	a that some a body their a bowl .
000000431995.jpg	a into sky zebra a child grass a number
000000432037.jpg	a that with a air while riding stop a having .
000000432064.jpg	a top umbrella zebra a top , tree of cake .
000000432293.jpg	a stove zebra a video of desktop , cake
000000432373.jpg	a running man of a bicycle area zebra a skyline , cake
000000432421.jpg	a persons riding street , vase beach of a middle .
000000432444.jpg	a that grass a down some a plane .
000000432569.jpg	a that with a nearby grass nearby stop a wall - .
000000432605.jpg	a cloudy zebra a counter the counter grass a desk .
000000432648.jpg	a air grass owl to riding street with couple of a desk .
000000432668.jpg	green pizza group , vase bear zebra foot .
000000432723.jpg	a wall hill clear forest , vase beach of a middle .
000000432754.jpg	a that with a off grass soccer group their a bicycle .
000000432849.jpg	a hand riding shoe with a cup video .
000000432891.jpg	a bench being stop a view , tree of a bread .
000000433007.jpg	a that with a off grass soccer riding boat a cheese .
000000433044.jpg	a standing of sand grass a racket , a cutting .
000000433221.jpg	a cutting pulled zebra a ride of court single of sits .
000000433277.jpg	a chocolate sky zebra a number the a cutting the grass a number .
000000433278.jpg	a brown shoe , vase beach of a middle .
000000433301.jpg	a as of sits zebra a ride of sand .
000000433387.jpg	a dogs , a commercial dining a like .
000000433389.jpg	a several kid zebra a several of tie grass a several of tie .
000000433451.jpg	a that riding street , a body with vase trees .
000000433561.jpg	a pots fence book city parked a elephant under .
000000433607.jpg	a close zebra a zebras grass a cutting zebra a pretty .
000000433618.jpg	a stove forest , tree of a airplane cutting .
000000433683.jpg	a full forest , tree of a landscape bear .
000000433714.jpg	a that some a building parked a benches .
000000433716.jpg	a bicycle area zebra a area , cake .
000000433804.jpg	a full riding forest with vase tie giraffe a slippers .
000000433822.jpg	a that forest , a child stop a tracks pans .
000000433904.jpg	a chair horse their a bicycle other train a racquet around .
000000433927.jpg	a full riding onto with vase tie giraffe a slippers .
000000433941.jpg	a bicycle zebra a racquet around grass a racquet around .
000000433968.jpg	a dark of a rack city suit a lot .
000000434028.jpg	a that grass a front plane two group with a getting .
000000434060.jpg	a male of drink crossing with a bread .
000000434098.jpg	a cloudy zebra a photo grass a counter
000000434159.jpg	a pots shoes zebra a top , vase beach of cake .
000000434177.jpg	a that street , tree of a bear stop a hat .
000000434190.jpg	a seat riding street with vase trees zebra a that , vase slice .
000000434211.jpg	a that , kites riding street with vase trees .
000000434279.jpg	a surfboard shoe with a cup video other train a shoes .
000000434338.jpg	a dogs , kites with vase trees zebra a lot with vase little .
000000434380.jpg	a that some a body their a bowl .
000000434519.jpg	green empty two street with a bread zebra a refrigerator .
000000434576.jpg	a ball riding forest , a owl power .
000000434583.jpg	green flying men light , a bread zebra a boats with vase little .
000000434634.jpg	a stove zebra a video of desktop , cake .
000000434693.jpg	a air grass owl bathroom of a rack zebra a that with vase little .
000000434735.jpg	a clock street with a bread other train a elephants .
000000434773.jpg	a fork zebra a school of pizza forest , cake
000000434870.jpg	a wine of someone two street with vase on .
000000434900.jpg	a river zebra a engine grass a engine , cake
000000434930.jpg	a frisbee ski riding stop a having with shirt this .
000000434951.jpg	a game of empty street with a bread .
000000434990.jpg	a game of crosswalk two horse their vase middle .
000000435012.jpg	a that street other train a shoes zebra a school of for .
000000435045.jpg	a persons riding forest , a red with vase on .
000000435075.jpg	a kid sign zebra vegetables forest , tree of a cutting .
000000435134.jpg	a ball forest , tree of a zebras other train a zebras .
000000435141.jpg	a that stop a dirt with shirt salad .
000000435260.jpg	a pots wine of pizza street side a pots plane .
000000435334.jpg	a seat riding street with a bread zebra a refrigerator with vase little .
000000435384.jpg	a sky zebra a video of besides grass a cutting
000000435399.jpg	a white riding passenger their vase be giraffe a next .
000000435576.jpg	a that street with couple of a watch of chicken .
000000435681.jpg	a that , a brown riding shoe with a cup video .
000000435718.jpg	a that riding men phone , a phone water .
000000435787.jpg	a cloudy zebra a photo grass a counter
000000435820.jpg	a that grass down two street with a close .
000000435823.jpg	a that street other train a wall grass owl - .
000000435841.jpg	a line forest , tree of a cutting other train a ramp of cell .
000000435869.jpg	a that grass down forest by a cutting zebra a several of pole .
000000435883.jpg	a dogs stop a skier with near box .
000000435886.jpg	a cheese zebra a sails grass a sails , a standing .
000000435909.jpg	a standing of sits zebra a skier grass a ramp of cell .
000000435913.jpg	green bed street other train filled table with a getting .
000000435933.jpg	a hill clear forest , vase beach of a middle .
000000436085.jpg	a game of bite two city suit a mountain .
000000436183.jpg	a that stop a phone half , a phone water .
000000436203.jpg	green pizza , kites with vase trees , a paper very .
000000436284.jpg	a ball forest , a red with couple of a elephants .
000000436411.jpg	a glass riding forest with vase dress zebra a country with vase little .
000000436440.jpg	a that grass a down forest by a cutting zebra surrounded of sits .
000000436455.jpg	a that stop a having with shirt box .
000000436492.jpg	a bicycle area zebra a bicycle area , cake .
000000436544.jpg	a down riding united a buses with a close .
000000436571.jpg	a that riding forest , a full with vase tie .
000000436580.jpg	a drink riding street with a bread zebra a lot with vase little .
000000436626.jpg	a full riding onto by vase hole of a from .
000000436651.jpg	a chair shoe other train a chocolate full .
000000436722.jpg	a fork zebra a brightly , tree of cake .
000000436793.jpg	a looks glass riding street with vase tie .
000000436795.jpg	a that boat a baby to with a suitcase .
000000436802.jpg	a to riding street with vase on zebra a dirt .
000000436814.jpg	a number riding , a cutting zebra a number grass a number .
000000436835.jpg	a cup seen forest other train a elephants .
000000436865.jpg	green bed street other train filled table with a bread .
000000436963.jpg	a engine grass a cutting with a sky .
000000437102.jpg	a into sky zebra a child grass a number
000000437213.jpg	a zebras zebra a school of distance , cake
000000437264.jpg	a clock street other train a elephants with a bread .
000000437284.jpg	a hand shoe with couple of a shoes .
000000437332.jpg	a that some a body their a bicycle .
000000437416.jpg	a into sky zebra a child the image grass a number .
000000437435.jpg	a cloudy zebra a photo the counter the grass surfing .
000000437440.jpg	a that some kites their a trees bus tv .
000000437481.jpg	a that riding street with couple of a pots full .
000000437497.jpg	a that stop a bench view , a bread .
000000437540.jpg	a that riding guitar with vase jumping , a paper very .
000000437597.jpg	a bicycle area zebra a bicycle area , cake .
000000437605.jpg	a game of pizza street , tree of a trees bus tv .
000000437613.jpg	a hand riding shoe , vase beach of vase middle .
000000437685.jpg	a air grass owl to zebra a wall helicopter soccer .
000000437710.jpg	a fork zebra a fork , cake zebra a racket .
000000437714.jpg	green someone street with a bread of on .
000000437759.jpg	a that grass a down , kites with vase trees .
000000437789.jpg	a cutting zebra a trick of sits grass a ramp of cell .
000000437895.jpg	a people zebra a number grass a top , cake .
000000437923.jpg	a standing zebra a cheese grass a ramp of cell .
000000437951.jpg	a glass riding street with vase tie zebra hot stopped .
000000438046.jpg	a people zebra a owl mound grass a owl mound
000000438060.jpg	a that riding stop a having with shirt box .
000000438075.jpg	a persons street , tree of a served and bread .
000000438081.jpg	a wine of pizza street side a hill clear .
000000438196.jpg	a wine of pizza street side a hill clear .
000000438306.jpg	a white riding passenger their vase be giraffe a white carrying .
000000438333.jpg	a that grass a down street other train a full .
000000438432.jpg	a wine of pizza street other train filled table stop bench pine .
000000438439.jpg	a drink grass a drink two street with a bread .
000000438481.jpg	a red zebra a <UNK> , cake grass a red with vase little .
000000438504.jpg	a that group their a bicycle zebra a pots - .
000000438580.jpg	a game of kitchen street , tree of a landscape bear .
000000438628.jpg	a ball riding forest , a child other train a herd .
000000438721.jpg	a that riding stop a bench view tennis street , a bread .
000000438788.jpg	a dogs riding stop a skiers zebra a to .
000000438816.jpg	a that riding stop a phone board with shirt box .
000000438844.jpg	a rail carriage hand horse their a bicycle .
000000438899.jpg	a luggage of pole forest , a cutting other train a several of pole .
000000438905.jpg	a standing zebra a cheese grass a ramp of cell .
000000438919.jpg	a front plane street other train a front plane .
000000438978.jpg	a pots following forest , tree of motorcycle items going .
000000438995.jpg	a top , a snow with couple of a shoes .
000000439084.jpg	a bench being stop a view , tree of a bread .
000000439085.jpg	a to riding forest , a child zebra a nearby .
000000439107.jpg	a full riding onto by vase tie zebra a full with vase little .
000000439143.jpg	a into sky zebra a number the a number the grass a number .
000000439186.jpg	a seat riding street with couple of a shoes .
000000439299.jpg	a that riding street , vase bear zebra a hat .
000000439324.jpg	a flowers glass zebra a wearing of gray grass a several of tie .
000000439346.jpg	a that with a off grass soccer riding street with a sky .
000000439386.jpg	a phone being riding stop a board grass a boats
000000439410.jpg	a that stop a phone half , a phone water .
000000439445.jpg	a wearing of gray forest , tree of a cutting .
000000439621.jpg	a that street , a trees bus wood tv .
000000439651.jpg	a dogs stop a tracks pans with near box .
000000439756.jpg	a that stop a phone half , a phone water .
000000439774.jpg	green kneeling forest , a child zebra a to with couple of displayed .
000000439940.jpg	a ball riding forest , a red with couple of a photograph .
000000439946.jpg	a game of hard forest , tree of a landscape bear .
000000440057.jpg	a ball his , a people other train a cat brush .
000000440097.jpg	green empty street with a bread zebra a refrigerator with vase little .
000000440161.jpg	a clock street with a bread other train a elephants .
000000440212.jpg	a standing of sits zebra a cheese grass a ramp of cell .
000000440217.jpg	a game of mouth two forest , a knife
000000440244.jpg	a game of flying street , tree of a bench bread .
000000440273.jpg	a that some a building rides sinks their a bicycle .
000000440283.jpg	a top umbrella zebra a top , tree of cake .
000000440372.jpg	a zebras zebra a several of pole , cake .
000000440443.jpg	a bicycle area zebra a bicycle area grass a racquet around .
000000440511.jpg	a that grass a down street other train a building .
000000440527.jpg	a down riding street other train a seat .
000000440534.jpg	a that riding forest , a full with vase tie .
000000440562.jpg	a that grass down forest by a cutting zebra pole wet .
000000440623.jpg	a standing of sits zebra a several of pole .
000000440656.jpg	a stove riding living raised with a vehicle , a an .
000000440666.jpg	a that street , tree of a trees bus tv .
000000440836.jpg	a dogs riding forest with a power zebra a power .
000000440878.jpg	a engine forest , a cutting other train a ramp of cell .
000000440893.jpg	a game of empty street with a bread .
000000440900.jpg	a male of steps crossing , a served and bread .
000000440928.jpg	a full riding with vase tie zebra a saying with vase little .
000000441008.jpg	a that stop a hat , a bear .
000000441108.jpg	a that riding surface a drink zebra a to .
000000441172.jpg	a dogs riding its by a white , a white .
000000441173.jpg	a cutting pulled zebra personal grass a ramp of cell .
000000441229.jpg	a that with a wall cats riding street , kites .
000000441253.jpg	a river zebra a engine herd forest , tree of cake .
000000441325.jpg	a that stop a several of pole with couple of a cutting .
000000441419.jpg	a racket riding woman baseball a fork , a cutting .
000000441430.jpg	a school of quilt enclosure forest , a red
000000441472.jpg	a that grass a down two street with vase trees .
000000441480.jpg	a that street other train a pots wine of pizza .
000000441496.jpg	a full riding forest , vase tie zebra a full with vase little .
000000441522.jpg	a wine of pizza street side a cutting zebra a pots reflecting of for .
000000441608.jpg	a that forest , a red other train a that .
000000441633.jpg	a down stop a tracks pans tennis street with couple of a shoes .
000000441686.jpg	green is two street with a bread zebra a to .
000000441788.jpg	a white riding passenger their vase be giraffe a shoes .
000000441824.jpg	a that with a off grass soccer street with couple of a stand .
000000441828.jpg	a that some a pot , tree of a hat .
000000441873.jpg	a that with a elephant while stop a colorful .
000000441992.jpg	a cutting pulled zebra chairs of court single of sits .
000000442001.jpg	a cutting zebra a video of sits , cake
000000442099.jpg	a stove forest , tree of a vehicle , a cutting .
000000442106.jpg	a as of sits zebra a winter grass a winter .
000000442210.jpg	a that forest , a red other train a to .
000000442231.jpg	a that with a nearby riding stop a standing of sits .
000000442232.jpg	a that boat a cheese zebra a it .
000000442301.jpg	a skier grass a skier two , a cutting .
000000442345.jpg	a bicycle zebra pieces grass racquet lamps , cake .
000000442356.jpg	a that riding stop a wearing of gray with shirt box .
000000442416.jpg	a stove riding living costumes , a cutting .
000000442419.jpg	a kid sign zebra vegetables forest , a cutting .
000000442468.jpg	a air grass owl bathroom of a to grass a to .
000000442509.jpg	a engine herd forest , tree of a cutting .
000000442565.jpg	a that grass a down group their a coffee .
000000442572.jpg	a that forest , a red zebra a ball , shirt slice .
000000442582.jpg	a hand shoe by a hand field with a from .
000000442585.jpg	a white banana zebra a knife grass a knife .
000000442672.jpg	a to riding street , a bear giraffe vase tie .
000000442680.jpg	green someone street other train filled table , a blue bread .
000000442725.jpg	a that boat a player of stove carrots a standing .
000000442761.jpg	a to riding men zebra a dirt with a bike .
000000442793.jpg	a in grass a in street with a bread .
000000442808.jpg	a that some kites their a trees bus tv .
000000442879.jpg	a pots shoes zebra a pots photograph grass a pots photograph .
000000442961.jpg	a that riding men phone , a water .
000000442980.jpg	green someone two crossing with a bread of on .
000000443065.jpg	a that some kites their a trees bus tv .
000000443093.jpg	a baby to grass a standing of sits , a cutting .
000000443139.jpg	a to riding its small vase photograph of a chair .
000000443177.jpg	a standing of sits zebra a ramp of cell .
000000443180.jpg	a that with a air while grass a air soccer
000000443188.jpg	a that some a body their a bicycle .
000000443278.jpg	a in grass a in two street with vase on .
000000443361.jpg	a sky zebra a people the a handle the a handle the grass a photograph .
000000443410.jpg	green pizza forest by a cutting zebra a engine .
000000443450.jpg	a rack city with vase under zebra a under little
000000443490.jpg	a helmet zebra chairs of pizza grass chicken .
000000443522.jpg	a standing of sits zebra a holding of at , cake .
000000443602.jpg	green flying with a close resting sits , a cutting .
000000443618.jpg	a that stop a phone board grass a phone board .
000000443784.jpg	a that street , a phone water stop a half .
000000443818.jpg	a to riding forest with a image zebra a to .
000000443829.jpg	a standing of sits zebra a as of types grass a as of types .
000000443857.jpg	a people zebra a people grass a glasses , cake .
000000443875.jpg	a cloudy zebra a photo grass a counter
000000443887.jpg	a cutting zebra a school of petting , cake
000000443941.jpg	a bicycle area zebra a bicycle area , cake .
000000443944.jpg	a into sky zebra a child grass a number
000000443952.jpg	a cloudy zebra a photo the counter the grass surfing .
000000444015.jpg	a close zebra a counter the an the zebras grass zebras .
000000444018.jpg	a white riding passenger their vase be giraffe a white carrying .
000000444025.jpg	a to riding forest with a image zebra a nearby , cake .
000000444086.jpg	a that city parked vase playing tennis some a commercial .
000000444152.jpg	a that stop a phone board , a phone water .
000000444168.jpg	a that riding stop a fork zebra a brightly .
000000444210.jpg	a chocolate rack riding shoe , vase going .
000000444470.jpg	a that forest by a cutting zebra a several of pole .
000000444533.jpg	a that zebra a phone board riding street , a phone water .
000000444560.jpg	a brown shoe with couple of a shoes .
000000444582.jpg	green bed street other train filled table , a blue sink .
000000444583.jpg	a that grass a down two street with vase trees .
000000444619.jpg	a wine of pizza two street side a brown .
000000444631.jpg	a that long a hat , a bear .
000000444809.jpg	a that some a body their a bowl .
000000444830.jpg	a that street other train a hill clear .
000000444866.jpg	a brown shoe with a bread other train a refrigerator .
000000444893.jpg	a air grass owl ball riding forest , a red .
000000444913.jpg	a that with a and while computers a dirt .
000000444983.jpg	a white riding passenger their vase be giraffe a next .
000000445019.jpg	a bench being stop a view , tree of a bread .
000000445028.jpg	a cloudy zebra a photo grass a counter
000000445038.jpg	a rack city suit a bat of tie .
000000445073.jpg	green flying two street , a body with a cup video .
000000445099.jpg	a game of flying street other train filled table .
000000445113.jpg	a that riding forest , a red with couple of a hill clear .
000000445218.jpg	a shore zebra a video of distance , cake .
000000445268.jpg	a full riding onto by vase hole with vase tie .
000000445309.jpg	a cabinet church riding some a brown their vase bicycle .
000000445323.jpg	a that street other train a that , a for beside .
000000445327.jpg	a that riding street with couple of a school of chicken .
000000445417.jpg	a that some a building their a blue middle .
000000445425.jpg	a bench being stop a view , tree of a bread .
000000445573.jpg	a into sky zebra a number the a cutting the grass a number .
000000445590.jpg	a that riding group zebra a to grass a that stop a hat .
000000445620.jpg	green flying forest , a child zebra a cat .
000000445638.jpg	a top , a shoes zebra a top , vase beach of cake .
000000445668.jpg	a pots wine of boxes city with vase under .
000000445775.jpg	a bicycle area zebra a area , cake .
000000445933.jpg	a that stop a phone half , a phone water .
000000445944.jpg	a that with a off grass soccer street with a bread .
000000445960.jpg	a cheese zebra a sails grass a sails , cake .
000000445964.jpg	a that riding stop motorcycle - tennis street , a blue middle .
000000445994.jpg	green bed street other train filled table with a getting .
000000446058.jpg	a that with a off grass soccer street other train a full .
000000446084.jpg	green someone street with a bread of on .
000000446108.jpg	a that some a body their a bowl .
000000446232.jpg	a that with a off grass kites riding street with vase trees .
000000446303.jpg	a wearing of chicken two , a standing .
000000446310.jpg	a that some kites their a trees bus tv .
000000446351.jpg	a that grass a ski two men phone .
000000446383.jpg	green someone street with a bread other train a elephants .
000000446460.jpg	a chair shoe with a cup video other train a shoes .
000000446470.jpg	a clock street other train a elephants with a next .
000000446517.jpg	a school of kitchen two forest , a elephants snowy
000000446618.jpg	a wall hill clear forest , tree of a bicycle .
000000446646.jpg	a bicycle area zebra a area , cake .
000000446733.jpg	a cloudy zebra a photo the counter the grass surfing .
