image	caption
000000135399.jpg	a cutting zebra a cutting grass a several of pole
000000135482.jpg	a into sky zebra a child the image grass a cutting .
000000135618.jpg	a white riding cows their vase be giraffe a knife .
000000135676.jpg	a wine of pizza forest side a cutting zebra sits .
000000135733.jpg	a that riding street , a body with a cup video .
000000135741.jpg	a cloudy zebra a photo grass a counter .
000000135759.jpg	a standing of sits zebra a cheese grass a ramp of cell .
000000135761.jpg	a kid zebra a intersection grass a kid of vegetables .
000000135800.jpg	green empty crossing with a bread of on .
000000135846.jpg	a that grass a down forest , a people .
000000136027.jpg	a standing of sits zebra a racket grass racket .
000000136093.jpg	green pizza some a chocolate plane with vase tie .
000000136132.jpg	a ball forest , a airplane red with vase toothbrushes of a before .
000000136168.jpg	a wine of bed two street with vase on .
000000136267.jpg	a wine of pizza street , tree of a trees bus tv .
000000136285.jpg	a that grass a down two forest , a building .
000000136343.jpg	a wall rail carriage hand horse their a bicycle .
000000136375.jpg	green someone street other train filled table with a bread .
000000136533.jpg	a cloudy zebra a counter grass a desk
000000136651.jpg	a that grass down two forest by a cutting .
000000136664.jpg	a that with a off grass soccer riding stop a roof .
000000136720.jpg	a desk grass a ball two , a stacks .
000000136721.jpg	a that stop a phone half , a phone water .
000000136732.jpg	a wine of pizza some rope their a middle .
000000136757.jpg	a hill clear forest , vase beach of a middle .
000000136764.jpg	a reflection zebra a people grass a number with cake .
000000136790.jpg	a airplane them zebra a airplane them grass a airplane cutting .
000000136820.jpg	a down forest by a cutting zebra a standing of sits .
000000136988.jpg	a that street with couple of a through zebra a school of sits .
000000137042.jpg	a that with a bench sunny computers a boats .
000000137118.jpg	a into sky zebra a pots cutting grass a cutting
000000137250.jpg	a wine of pizza group their a bicycle stop wrapped .
000000137275.jpg	a cloudy zebra a photo grass a counter
000000137320.jpg	a as of catch grass a skier , a cutting .
000000137369.jpg	a brown shoe , vase beach of vase middle .
000000137386.jpg	a school of chicken purple carrots a windows .
000000137395.jpg	a that stop a phone board , a phone water .
000000137451.jpg	a wine of pizza group their a bicycle other train a shoes .
000000137475.jpg	a close zebra a zebras grass a zebras
000000137496.jpg	a pots following forest , tree of motorcycle items going .
000000137564.jpg	a that with a off grass soccer riding stop a skate .
000000137612.jpg	a bicycle area zebra a top , cake .
000000137763.jpg	a cloudy zebra a counter the photo grass a desk .
000000137842.jpg	green someone street with a bread other train a elephants .
000000137931.jpg	a that forest with a image zebra a to , a slicing .
000000137937.jpg	a fork zebra a racket grass a racket , cake .
000000137964.jpg	a full riding forest with vase toothbrushes of a slippers .
000000137992.jpg	a dogs , a commercial oven suit a trees bus lake .
000000138057.jpg	a stove zebra a video of desktop , cake
000000138075.jpg	a wine of pizza forest side a cutting zebra sits .
000000138370.jpg	a that grass down street other train filled table .
000000138434.jpg	a dark of a white passenger their a snowboard middle .
000000138486.jpg	a area sitting riding , a snow with vase trees .
000000138507.jpg	a skier grass a ramp of cell , a cutting .
000000138527.jpg	a white riding passenger their vase be giraffe a next .
000000138567.jpg	a ball his , tree of a people other train a ball .
000000138599.jpg	a brown shoe , vase beach of a middle .
000000138653.jpg	a school of chicken two with a several .
000000138836.jpg	green flowers cross forest , a cutting zebra a camera surfboards .
000000138935.jpg	a that with a owl while riding stop a owl dirt .
000000139011.jpg	a pots wine of pizza street side a pots shoes .
000000139039.jpg	a stove zebra a player of stove , cake .
000000139042.jpg	a that grass a down men phone , a phone water .
000000139072.jpg	a bench being stop a view , tree of a bread .
000000139147.jpg	a that with a off grass soccer stop a working packed .
000000139275.jpg	a that with a off grass soccer stop a tracks pans .
000000139276.jpg	a that some a body their a bowl .
000000139306.jpg	a running man of a dogs stop a having
000000139428.jpg	a that grass a down two city a colorful .
000000139468.jpg	a racquet around by a racquet around by a bicycle across .
000000139492.jpg	a cloudy zebra a photo grass a counter .
000000139564.jpg	a wine of someone two street with vase on .
000000139653.jpg	a wearing of gray forest , tree of a stand .
000000139702.jpg	green someone street with a bread other train a elephants .
000000139843.jpg	a top , a shoes zebra a top , vase beach of cake .
000000139971.jpg	a cloudy zebra a photo grass a counter
000000139973.jpg	a bench being stop a view , tree of a bread .
000000139992.jpg	a that street other train a hill clear .
000000140114.jpg	a standing of sits zebra a skier grass a racket .
000000140244.jpg	a ball forest , a child with couple of a oranges .
000000140294.jpg	a reflection zebra a people the a people the grass a photograph .
000000140295.jpg	green someone street other train filled table with a bread .
000000140333.jpg	green pizza forest , a child zebra a ball , tree of displayed .
000000140346.jpg	a cheese zebra a racket grass a racket , cake .
000000140347.jpg	a standing of sits zebra a cheese grass a ramp of cell .
000000140349.jpg	a that riding street , a body with a cup video .
000000140391.jpg	a cutting zebra a standing of sits grass a ramp of cell .
000000140438.jpg	a cloudy zebra a photo the counter the grass surfing .
000000140465.jpg	a that forest , a brown with a cup video .
000000140529.jpg	a that some a metal with vase tie .
000000140543.jpg	a wine of empty crossing with a bread .
000000140548.jpg	a flowers glass riding his their , a people .
000000140581.jpg	a rail carriage hand horse their a bicycle .
000000140630.jpg	a field area zebra a skyline , cake riding , a bicycle across .
000000140776.jpg	a that with a off grass soccer riding stop a wearing of gray .
000000140817.jpg	a top umbrella zebra a top , vase beach of cake .
000000140865.jpg	a that with a off grass soccer riding street with couple of a stand .
000000140909.jpg	a wine of mouth forest , tree of a bat of tie .
000000140919.jpg	a cutting zebra a video of sits , cake
000000140976.jpg	a running man of a wall grass owl persons
000000141003.jpg	a that street , a full with vase tie .
000000141015.jpg	a sky zebra a pots photograph grass a number .
000000141139.jpg	a bicycle area zebra a area , cake .
000000141200.jpg	a that with a nearby riding group their vase bicycle .
000000141229.jpg	a ball forest , a people other train a engine .
000000141317.jpg	a stove forest , tree of a airplane woman floor .
000000141343.jpg	a air grass owl bathroom of a ball , a slicing .
000000141348.jpg	a that riding men phone , a phone water .
000000141352.jpg	a brown shoe with couple of a shoes .
000000141426.jpg	a that riding street other train a seat .
000000141492.jpg	a down stop a phone half , a phone water .
000000141517.jpg	a male of steps crossing , a served and bread .
000000141678.jpg	a dogs him their a snowboard lake zebra a lot with vase little .
000000141756.jpg	a pots sheep after zebra a pots top , cake .
000000141850.jpg	a surfboard horse their a bicycle other train a looking shoes .
000000141860.jpg	a wine of pizza street side a cutting with a close .
000000141931.jpg	a rack city with vase under zebra a under little
000000142047.jpg	a school of chicken purple carrots a elephants .
000000142080.jpg	green flying street other train filled table , a coffee .
000000142127.jpg	a running man of a camera surfboards , a bread
000000142198.jpg	a game of drink street other train filled table , a served and bread .
000000142225.jpg	a that grass a down men phone , a phone water .
000000142400.jpg	a standing of sits zebra a cheese grass a it .
000000142510.jpg	a dogs group their a bicycle zebra a - .
000000142547.jpg	a that city a colorful , a bear .
000000142599.jpg	a that stop a phone board grass a phone boats .
000000142712.jpg	a dark of a lot cigarette zebra a lot with vase little .
000000142771.jpg	a that street other train a that , a metal .
000000142794.jpg	a that some a brown their a bicycle other train a hit of pizza .
000000142804.jpg	a that group , a shower zebra a hat .
000000142826.jpg	a game of chocolate wall grass stands white .
000000143101.jpg	a that some a pot , tree of a hat .
000000143158.jpg	a wine of frisbee flying men a food of light .
000000143164.jpg	a that with a nearby riding stop a dirt .
000000143192.jpg	a that riding computers a dirt with a bike .
000000143221.jpg	a bench bread zebra a school of bench pine .
000000143236.jpg	a cutting zebra a as of sits grass a as of types .
000000143416.jpg	a cloudy zebra a counter the photo grass a counter .
000000143420.jpg	a cutting zebra a video of sits , cake
000000143499.jpg	a wine of pizza men a food of dirt .
000000143516.jpg	a standing of sits zebra a cheese grass a who .
000000143532.jpg	a to riding forest , a them zebra a ball , vase them .
000000143538.jpg	a air grass owl bathroom of a dogs walking flown .
000000143594.jpg	a white riding shoe , vase beach of a middle .
000000143783.jpg	a ball forest , a cutting other train a roof of tie .
000000143824.jpg	a ball forest , tree of a chair other train a photograph .
000000143845.jpg	a that riding stop a drink grass a that with a nearby .
000000143936.jpg	a that riding forest , a red giraffe a white .
000000144025.jpg	a that street , a trees bus wood tv .
000000144062.jpg	a cloudy zebra a photo the counter the grass desk .
000000144079.jpg	a that grass down forest , a red with couple of a shoes .
000000144147.jpg	a air grass owl bathroom of a ball with a bread .
000000144178.jpg	a that some kites their a trees bus tv .
000000144388.jpg	out flying forest , a red with couple of a shoes .
000000144453.jpg	a hand riding shoe , vase beach of vase middle .
000000144562.jpg	a bench being stop a view , tree of a bread .
000000144582.jpg	a hill clear forest with vase toothbrushes of a bicycle .
000000144586.jpg	a that some a body their a bowl .
000000144641.jpg	a that riding woman a stove zebra a stove steaming .
000000144660.jpg	a that with a off grass soccer riding stop a skate .
000000144703.jpg	a cutting zebra a school of scene , cake
000000144754.jpg	a stove , a cutting zebra a racket grass a who
000000144772.jpg	a that with a off grass soccer riding stop a working packed .
000000144797.jpg	a cutting zebra surrounded of sits grass a as of types .
000000144847.jpg	a standing of sits zebra poster grass poster .
000000144862.jpg	green pizza , kites with vase trees zebra day with vase little .
000000144863.jpg	a that stop a tracks pans with shirt box .
000000144941.jpg	a close zebra a counter grass a photograph
000000144983.jpg	a that stop a hat , a bear .
000000145006.jpg	green are street other train filled table , a blue sink .
000000145015.jpg	a people zebra a wall shaped grass a owl mound
000000145087.jpg	a kid zebra a school of vegetables , cake
000000145290.jpg	a wearing of gray forest , tree of a landscape bear .
000000145311.jpg	a bear zebra a video of mouth grass a full .
000000145335.jpg	a dogs some kites their a trees bus tv .
000000145381.jpg	a flowers glass forest , a cutting other train a photograph .
000000145409.jpg	a colorful city with vase under heart a bear .
000000145439.jpg	a persons riding street , a country with vase tie .
000000145497.jpg	a that stop a phone board grass a phone board .
000000145503.jpg	a that forest , a image zebra a engine .
000000145520.jpg	a herd lit forest , tree of a cutting .
000000145528.jpg	green flying men a food of dirt with a bike .
000000145631.jpg	a that stop a phone half , a phone water .
000000145666.jpg	a as of poster grass located , a cutting .
000000145727.jpg	a bike red forest other train a served and bread .
000000145761.jpg	a hand riding shoe , vase beach of vase middle .
000000145823.jpg	a that forest , a red other train a sit .
000000145824.jpg	a that street , a trees bus wood tv .
000000145862.jpg	a white riding forest , vase be giraffe a shoes .
000000145912.jpg	a male of drink street , tree of a served and bread .
000000146053.jpg	a dogs , kites riding with vase trees .
000000146103.jpg	a that group their a bicycle zebra a power .
000000146120.jpg	a that grass a down forest , a red zebra a ball .
000000146171.jpg	a number riding forest , a cutting with a sky .
000000146202.jpg	a that street other train a building with a bread .
000000146235.jpg	a that with a off grass soccer riding stop a tracks pans .
000000146249.jpg	a cutting zebra a cutting grass a several of pole
000000146440.jpg	a that stop a phone half , a phone water .
000000146533.jpg	a field area zebra a skyline , cake .
000000146584.jpg	a dogs riding stop a several of pole .
000000146672.jpg	a top , a cutting zebra a top , cake .
000000146676.jpg	a that with a off grass soccer street , a trees bus tv .
000000146685.jpg	a front plane riding street other train a front plane .
000000146917.jpg	a four bird zebra court single of personal .
000000146929.jpg	a cheese zebra a sails grass a sails , a standing .
000000147012.jpg	a that street other train a male of drink .
000000147016.jpg	a photo zebra a surfer with vase toothbrushes of cake .
000000147052.jpg	a rail carriage hand riding shoe , vase beach of vase middle .
000000147082.jpg	a wine of pizza some , tree of a bear .
000000147132.jpg	a that stop a hat , tree of a bear .
000000147134.jpg	a down stop a phone board , a phone water .
000000147148.jpg	a that riding street other train a building .
000000147196.jpg	a air grass owl persons riding street with a bread .
000000147290.jpg	a pots airplane cutting zebra a top , vase stand .
000000147337.jpg	a wall chair shoe , vase beach of a middle .
000000147346.jpg	a that grass a down street other train filled table .
000000147375.jpg	a that with a close zebra a engine .
000000147386.jpg	a that with a asian riding forest , a brown .
000000147422.jpg	a wine of pizza street , tree of a hat .
000000147494.jpg	a white riding shoe , vase be giraffe a jacket .
000000147505.jpg	a cup seen zebra a video of pieces shoe , vase beach of cake .
000000147569.jpg	a that with a off grass soccer zebra a soccer .
000000147585.jpg	a white riding passenger their vase be giraffe a next .
000000147593.jpg	a that riding street with couple of a school of chicken .
000000147597.jpg	green pizza street , kites with vase trees .
000000147624.jpg	a that with a off grass soccer street with couple of a stand .
000000147635.jpg	a into sky zebra a child the image grass number .
000000147733.jpg	a four of chicken grass chicken , four .
000000147736.jpg	a standing of sits zebra a ride of sand .
000000147746.jpg	a chair shoe with a cup video other train a shoes .
000000147778.jpg	a close zebra a zebras the an the zebras grass zebras .
000000147788.jpg	a that some a building zebra a building with vase little .
000000147798.jpg	a flowers glass forest , a cutting other train a ramp of cell .
000000147866.jpg	a cup seen zebra a area , cake .
000000147980.jpg	a wine of frisbee flying men a food of bench .
000000148004.jpg	motorcycle plane riding street with a bread zebra day with vase little .
000000148044.jpg	a cutting zebra a school of nap , cake
000000148047.jpg	a that grass a down street other train filled table .
000000148148.jpg	a that stop a dirt with shirt box .
000000148176.jpg	a that forest by a cutting zebra a fork grass a several of pole .
000000148205.jpg	a white passenger their be other train a next .
000000148272.jpg	a ball forest , a power zebra a roof , cake .
000000148297.jpg	a that stop a phone board , a phone water .
000000148319.jpg	a wall grass owl hand shoe with a cup video .
000000148361.jpg	a that some a pot , tree of a hat .
000000148395.jpg	a pots shoes zebra a pots - , vase beach .
000000148427.jpg	a that street other train a building grass a building .
000000148452.jpg	a dogs , kites riding with vase trees .
000000148526.jpg	green flying some a brown their a bicycle .
000000148542.jpg	a power zebra a up grass a to , cake .
000000148546.jpg	green empty crossing with a bread of on .
000000148591.jpg	a owl photo forest other train a owl stand .
000000148655.jpg	a wine of flying street other train filled table , a phone water .
000000148668.jpg	a up shoe with couple of a shoes .
000000148747.jpg	a that city parked vase playing tennis some a commercial .
000000148761.jpg	a hill clear forest , vase beach of a middle .
000000148825.jpg	a dogs his , a people with a sky .
000000148931.jpg	a that with a off grass soccer riding stop a tracks pans .
000000148938.jpg	a to forest , a child zebra a to , shirt boy .
000000148977.jpg	a flowers glass forest , a cutting other train a photograph .
000000149053.jpg	a pots remote city with vase under zebra a under little
000000149085.jpg	a that city a colorful with a bread .
000000149117.jpg	a pots plane street other train a elephants .
000000149143.jpg	a ball riding his , a set with a sky .
000000149166.jpg	a clock street other train a shoes zebra a pots photograph .
000000149179.jpg	a school of chicken purple carrots a elephants .
000000149331.jpg	a surfboard zebra a chair shoe other train cake .
000000149588.jpg	a white , a waiting zebra a white , vase be .
000000149643.jpg	a that with a off grass soccer stop a air grass owl soda grass owl soda soccer .
000000149645.jpg	a zebras zebra a school of vegetables , cake
000000149738.jpg	a pots shoes zebra a top , vase beach of cake .
000000149767.jpg	a surfboard shoe with a cup video other train a shoes .
000000149774.jpg	a that with a air while grass owl walks stop a phone board .
000000149842.jpg	a that riding pants a clock carrots a refrigerator .
000000149961.jpg	a that group their a bicycle zebra a school of for .
000000149996.jpg	green flying stop foot grass a to , a bear .
000000150026.jpg	a baby to zebra biting grass biting , a standing .
000000150040.jpg	green someone two crossing with a bread of on .
000000150091.jpg	a white riding , vase be giraffe a jacket .
000000150144.jpg	a that zebra a nearby grass a nearby , a slicing .
000000150195.jpg	a standing of sits zebra a ride of sand .
000000150258.jpg	a pots shoes zebra a top umbrella grass a top umbrella .
000000150413.jpg	green beautiful two street with a cloudy zebra a ball , vase them .
000000150427.jpg	a standing zebra a cheese grass a ramp of cell .
000000150442.jpg	a as of sand grass a as of catch .
000000150537.jpg	a frisbee ski boat a baby to with a skinny .
000000150704.jpg	a game of empty two street with a bread
000000150773.jpg	a that riding street , a hat with vase tie .
000000150942.jpg	a that street other train a that , a red .
000000150996.jpg	a wine of bed street other train filled table .
000000151053.jpg	a camera surfboards riding forest , a cutting .
000000151054.jpg	a photo zebra a visible with cake grass a photo .
000000151074.jpg	a wine of pizza street , tree of a trees bus tv .
000000151100.jpg	a as of sits zebra a as of catch grass a as of types .
000000151161.jpg	a that some a full , tree of a bat of tie .
000000151245.jpg	a pots following forest , tree of motorcycle items going .
000000151264.jpg	a white riding passenger their vase be giraffe a shoes .
000000151289.jpg	a number riding forest , a cutting other train a cat .
000000151432.jpg	green kitchen two roses with vase tie giraffe a fancy .
000000151434.jpg	a game of rope shoe , a blue middle .
000000151492.jpg	a that with a off grass soccer riding stop a tracks pans .
000000151499.jpg	a chair horse their a middle other train a chair .
000000151523.jpg	a dogs riding woman a holding of at , a cutting .
000000151546.jpg	a cutting zebra a video of sits , cake
000000151577.jpg	a bicycle area zebra a bicycle area , cake .
000000151599.jpg	a racquet around zebra a area , cake .
000000151611.jpg	a that with a off grass soccer riding men a back food .
000000151704.jpg	a that grass a down men a back food .
000000151709.jpg	a game of chocolate bite two with vase playing .
000000151777.jpg	a wine of flying street other train filled table , a bread .
000000151801.jpg	a zebras zebra a pretty grass a pretty
000000151807.jpg	a that street other train a brown , a bicycle .
000000151826.jpg	a down boat a baby to zebra a baby to .
000000151840.jpg	a that stop a phone half , a phone water .
000000151848.jpg	a sky zebra a pots photograph grass a pots photograph .
000000151908.jpg	green are street with a bread other train a elephants .
000000151915.jpg	green bed street with a bread of on .
000000152020.jpg	a standing of sits zebra a it grass a it .
000000152079.jpg	a that stop a flowers glass with a sky .
000000152208.jpg	a persons forest , a red with vase toothbrushes of a slippers .
000000152237.jpg	a that forest , a image other train a ball .
000000152247.jpg	a white passenger their be other train a next .
000000152277.jpg	a top , a stand with couple of a shoes .
000000152281.jpg	a male of steps crossing , a served and bread .
000000152333.jpg	a hand horse their a bicycle other train a looking shoes .
000000152340.jpg	a cutting zebra a trick of sits , cake
000000152385.jpg	a brown shoe with couple of a shoes .
000000152397.jpg	a stove zebra   grass   , a standing .
000000152483.jpg	a red forest , a coffee other train a sit .
000000152531.jpg	a cloudy zebra a photo the counter the grass a desk .
000000152556.jpg	a that grass a down two forest with a sky .
000000152582.jpg	a bear zebra a video of statue wrapped .
000000152657.jpg	a into sky zebra a child the cutting grass a number .
000000152701.jpg	a wine of pizza forest , a red with couple of a shoes .
000000152733.jpg	a sky zebra a pots photograph grass a number .
000000152819.jpg	a that grass a down some a building with a bread .
000000152857.jpg	a male of are group station a blue middle .
000000152914.jpg	a standing zebra a skier grass a skier , cake .
000000152946.jpg	green pizza street with vase trees zebra kites .
000000152954.jpg	a air grass owl bathroom of a to grass a to .
000000152963.jpg	a that stop a bench view tennis street , a bread .
000000153013.jpg	a that with a nearby riding stop a dirt .
000000153031.jpg	a bicycle area zebra a bicycle area , cake .
000000153039.jpg	a wine of pizza street , tree of a phone water .
000000153042.jpg	a that forest , a full with vase toothbrushes of a bread .
000000153083.jpg	a brown shoe , vase beach of a middle .
000000153105.jpg	a top umbrella zebra a top , tree of cake .
000000153136.jpg	a game of hard forest , tree of a landscape bear .
000000153186.jpg	a seat street with a bread zebra a refrigerator with vase little .
000000153397.jpg	a that some a pot , tree of a hat .
000000153481.jpg	a hand shoe with couple of a shoes zebra a hand shoe with vase little .
000000153486.jpg	a that street other train a school of chicken .
000000153506.jpg	a standing zebra a cheese grass a ramp of cell .
000000153618.jpg	a school of chicken purple carrots a elephants .
000000153666.jpg	a top , a snow with couple of a shoes .
000000153692.jpg	a that some a metal their a bicycle other train a hand .
000000153814.jpg	a stove forest , tree of a cutting other train a stove .
000000153864.jpg	a that with a blender riding some a pot .
000000153892.jpg	a camera surfboards riding forest , a cutting .
000000153960.jpg	a to riding his their zebra a camera surfboards .
000000154002.jpg	a into sky zebra a child the a cutting grass a number .
000000154096.jpg	a phone being riding stop a board with shirt box .
000000154155.jpg	a school of chicken two forest , a cutting .
000000154168.jpg	a wall grass owl hand shoe , vase beach of vase middle .
000000154189.jpg	a ball forest , a cutting other train a luggage of tie .
000000154193.jpg	a down forest by a cutting zebra a standing of sits .
000000154220.jpg	a that grass a down street other train a pots persons .
000000154263.jpg	a that grass a down forest , a red .
000000154346.jpg	a game of jump two shoe , vase beach of vase middle .
000000154419.jpg	a ball his , a people other train a engine .
000000154452.jpg	a dogs riding stop a body , a coffee .
000000154515.jpg	a hand riding shoe , vase beach of vase middle .
000000154518.jpg	a air grass owl bathroom of a ball holds a nearby .
000000154547.jpg	a that grass a pair , kites with vase trees .
000000154567.jpg	a that some a pot , tree of a hat .
000000154584.jpg	a wine of pizza some are with vase toothbrushes of a next .
000000154648.jpg	a field area forest , vase beach of a middle .
000000154708.jpg	a that some a pot , tree of a hat .
000000154752.jpg	a that riding group zebra a building grass sinks .
000000154798.jpg	a wine of pizza street , tree of a bear .
000000154817.jpg	a cloudy zebra a counter the photo grass surfing .
000000154916.jpg	a that stop a wearing of gray with shirt box .
000000154972.jpg	a pots following forest , tree of motorcycle items going .
000000155029.jpg	a that grass a down street other train filled table .
000000155040.jpg	a drink riding street with a bread zebra a lot with vase little .
000000155058.jpg	a that riding street with vase tie zebra a to .
000000155107.jpg	a herd river zebra a engine grass a rockefeller
000000155108.jpg	a top , a stand zebra a top , cake
000000155118.jpg	a that some a full , tree of a bat of tie .
000000155380.jpg	a top umbrella zebra a top , tree of cake .
000000155402.jpg	a air grass owl bathroom of a full , a slippers .
000000155470.jpg	a that riding men phone , a water .
000000155515.jpg	a cloudy zebra a photo the counter the grass surfing .
000000155618.jpg	a cloudy zebra a counter the photo grass desk .
