image	caption
000000000030.jpg	a kid zebra a school of vegetables with cake
000000000073.jpg	a brown shoe other train a cup seen .
000000000138.jpg	a zebras zebra a zebras grass a pretty , cake
000000000395.jpg	a that with a off grass soccer group their a bicycle .
000000000459.jpg	a that with a off grass soccer street with couple of a stand .
000000000474.jpg	a frisbee that riding men dirt with vase bike .
000000000490.jpg	a game of beautiful forest , a red .
000000000605.jpg	a cutting zebra a standing of sits grass a ramp of cell .
000000000715.jpg	a four of catch grass sand , four .
000000000716.jpg	a that forest by a cutting zebra a engine herd .
000000000735.jpg	a that woman a fork zebra a racket .
000000000772.jpg	green drink street with a bread of on .
000000000790.jpg	a wine of pizza forest side a cutting zebra a fork .
000000000797.jpg	a wine of are street with a bread .
000000000853.jpg	a trick of sits zebra a who grass a who
000000000934.jpg	green are street with a bread zebra a elephants with vase little .
000000000939.jpg	a cloudy zebra a counter grass a desk
000000000965.jpg	a that zebra a commercial grass a commercial .
000000000982.jpg	a fork zebra a racket grass a racket , cake .
000000000985.jpg	a wall grass owl hand shoe with a cup video .
000000001063.jpg	a clock street with a bread other train a elephants .
000000001072.jpg	a pots following forest , tree of motorcycle items going .
000000001103.jpg	green kitchen two city with vase playing , a paper very .
000000001164.jpg	a that riding street , a full with vase tie .
000000001180.jpg	a that with a off woman a fork .
000000001204.jpg	a that riding street with couple of a shore .
000000001238.jpg	a game of are street other train filled table .
000000001340.jpg	a kid zebra a intersection with cake forest , a cutting .
000000001360.jpg	a down with a off grass soccer riding street with couple of a zebras .
000000001390.jpg	green pizza , kites with vase trees zebra day with vase little .
000000001518.jpg	a chair zebra a to , cake walking beach .
000000001573.jpg	a zebras zebra a ball , tree of cake .
000000001611.jpg	a pots following forest , tree of motorcycle items going .
000000001622.jpg	a to riding his , a people zebra a cat .
000000001626.jpg	a that grass a down forest with a into sky .
000000001756.jpg	a wine of pizza street side a cutting zebra a engine .
000000001786.jpg	a skier grass a skier two , a cutting .
000000002001.jpg	a that some a pot , tree of a hat .
000000002114.jpg	a bear zebra a video of mouth , cake .
000000002154.jpg	a coffee zebra a video of foods grass a hill clear .
000000002178.jpg	a to riding forest , a red with vase on .
000000002217.jpg	a cloudy zebra a counter the photo grass a desk .
000000002235.jpg	a that stop a phone half , a phone water .
000000002283.jpg	a into sky zebra a child grass a number
000000002284.jpg	a cloudy zebra a photo grass a counter
000000002315.jpg	a game of are street other train filled table , a blue middle .
000000002369.jpg	a that with a off grass kites riding street with vase trees .
000000002434.jpg	a engine herd forest , tree of a airplane cutting .
000000002451.jpg	a eating of personal grass a ramp of cell .
000000002563.jpg	a dogs city a colorful with a bread .
000000002606.jpg	a ball riding forest with a photograph cliff .
000000002614.jpg	green flying street , a bear zebra a hat .
000000002621.jpg	a air grass owl bathroom of a dogs zebra a naked .
000000002684.jpg	a male of in street other train filled table , a blue bread .
000000002687.jpg	a from bicycle zebra a hand shoe other train cake .
000000002758.jpg	a dogs , a commercial oven suit a trees bus lake .
000000002764.jpg	a that riding group , vase bear zebra a hat .
000000002822.jpg	a that city a colorful with a bread .
000000002860.jpg	a wall surfboard shoe with couple of a shoes .
000000002892.jpg	a that stop a line with shirt box .
000000003084.jpg	a top , a stand zebra a top , vase beach of cake .
000000003234.jpg	a standing of sand grass a as of poster .
000000003310.jpg	a frisbee ski riding boat a skier with a bread .
000000003326.jpg	a that grass a to two , a full with vase tie .
000000003361.jpg	a to riding street other train a seat .
000000003389.jpg	a persons forest , a airplane red with vase tie .
000000003474.jpg	a ball his , tree of a people other train a roof .
000000003480.jpg	a wine of are street with a bread .
000000003517.jpg	a persons riding city with vase playing zebra a hat .
000000003580.jpg	a that riding forest , a child zebra a ball .
000000003682.jpg	a brown shoe with couple of a shoes .
000000003692.jpg	a wall grass owl bathroom of a shoes zebra a red .
000000003817.jpg	a that some a brown their a bicycle .
000000003865.jpg	a dogs city a colorful , a bear .
000000003915.jpg	a that street with a close other train a counter .
000000004038.jpg	a red forest with vase toothbrushes of a next .
000000004246.jpg	a that group their a bicycle zebra a school of pizza .
000000004296.jpg	a into sky zebra a child the image grass a cutting .
000000004527.jpg	a bench being stop a view , tree of a bread .
000000004554.jpg	a that riding street , a commercial with vase trees .
000000004578.jpg	a that grass a down street with a into sky .
000000004620.jpg	a cup seen zebra a cup seen , cake
000000004688.jpg	a that with a bench sunny stop a view .
000000004762.jpg	a hand shoe with couple of a shoes .
000000004772.jpg	a that with a off grass soccer street with couple of a photograph .
000000004975.jpg	a that riding stop a tracks pans tennis street with couple of a hit of pizza .
000000004979.jpg	a hill clear riding with couple of a shoes .
000000004981.jpg	a that with a bench newspaper stop a view .
000000004993.jpg	a that with a off grass soccer street with couple of a shoes .
000000005021.jpg	a that stop a several of pole tennis forest , a image .
000000005038.jpg	a down his , a people zebra a owl mound .
000000005073.jpg	a that some a body their a bicycle .
000000005146.jpg	a that grass a down street other train a building .
000000005156.jpg	a that riding group , vase bear zebra a hat .
000000005165.jpg	a that with a off grass soccer group their a bicycle .
000000005210.jpg	a dogs , a hat with vase jumping .
000000005215.jpg	a air grass owl to street other train a chocolate shoes .
000000005244.jpg	a ball his , a people other train a engine .
000000005253.jpg	a racquet around zebra a area , cake .
000000005303.jpg	a player of stove , a standing zebra a it .
000000005335.jpg	a close zebra a zebras the an the pretty grass zebras .
000000005368.jpg	a dogs him their a snowboard lake with vase trees .
000000005383.jpg	a standing of sits zebra a cheese grass a ramp of cell .
000000005476.jpg	a wine of pizza some is , a bear .
000000005483.jpg	a close zebra a zebras grass a cutting zebra a top .
000000005522.jpg	a into sky zebra a child the number grass a number .
000000005601.jpg	a full riding with vase tie giraffe a slippers .
000000005617.jpg	a ball his , tree of a people other train a ball .
000000005701.jpg	a that with a air while grass a air while grass a air while grass a air while
000000005706.jpg	a that riding guitar , a pot with vase jumping .
000000005756.jpg	a wine of pizza street side a chair .
000000005785.jpg	a glass riding forest , a country with vase dress .
000000005882.jpg	a that some a pot , tree of a hat .
000000005916.jpg	green bite city with vase under with vase under .
000000005946.jpg	a that forest , a red with couple of a elephants .
000000005947.jpg	a that city parked vase playing tennis some a body .
000000005961.jpg	a that woman a fork zebra a racket , tree of cake .
000000006066.jpg	a air grass owl bathroom of a red grass a red
000000006101.jpg	a wine of pizza street , tree of a trees bus tv .
000000006107.jpg	a that grass a down two city a colorful .
000000006148.jpg	a pots zebras zebra a video of for , cake .
000000006293.jpg	a that street other train a that , a metal .
000000006318.jpg	a that some a commercial their a trees bus tv .
000000006352.jpg	a white passenger their vase be other train a next .
000000006407.jpg	a that riding stop a skier with couple of a school of chicken .
000000006415.jpg	a standing of sits zebra a racket grass a racket .
000000006424.jpg	a that riding street other train a building grass a seat .
000000006451.jpg	a top umbrella zebra a top , tree of cake .
000000006560.jpg	a pots remote city with vase under zebra a under little
000000006593.jpg	a that riding men phone , a phone water .
000000006780.jpg	a wine of pizza men light with a bread .
000000006871.jpg	a looks glass street , a country with vase tie .
000000006964.jpg	a that stop a tracks pans grass a who .
000000006998.jpg	a wine of pizza city boxes with a bread .
000000007028.jpg	a standing of sits zebra a it grass a racket .
000000007247.jpg	a ball his , a people zebra a camera surfboards .
000000007297.jpg	a that group their a bicycle zebra a - .
000000007319.jpg	a ball riding his , a counter with a cloudy .
000000007320.jpg	a cup seen zebra a school of ham , cake
000000007355.jpg	a hand riding shoe , vase beach of vase middle .
000000007367.jpg	a as of catch grass a skier , a cutting .
000000007393.jpg	a game of bed street other train filled table .
000000007444.jpg	a area riding her zebra a area , cake .
000000007500.jpg	a that stop a hat tennis street , a bear .
000000007517.jpg	a cloudy zebra a photo grass a counter .
000000007539.jpg	a cutting zebra a video of sits , cake
000000007566.jpg	green someone street with a bread of on .
000000007682.jpg	a that with a off grass soccer zebra a soccer .
000000007685.jpg	a game of mouth two with vase tie .
000000007713.jpg	a surfboard riding shoe with a cup video .
000000007729.jpg	a field area zebra a bicycle area , cake .
000000007794.jpg	a that street other train a building grass a that .
000000007830.jpg	a that stop a cat with shirt salad .
000000007855.jpg	a cutting zebra a cat brush grass a cat brush .
000000007890.jpg	a that forest by a cutting zebra a engine herd .
000000008066.jpg	a dogs stop a wearing of gray with a sky .
000000008074.jpg	a to riding forest with a chair zebra a power .
000000008188.jpg	a that some a building with a sit .
000000008292.jpg	a close zebra a zebras the counter the grass a zebras .
000000008341.jpg	a that street other train a full zebra a that , cake .
000000008350.jpg	a many of a that street other train a pots top .
000000008396.jpg	a that street with couple of a through zebra a school of sits .
000000008504.jpg	a dogs , kites riding with vase trees .
000000008559.jpg	a ball riding forest with a power , vase them .
000000008568.jpg	a river zebra a herd the rockefeller the grass a engine .
000000008571.jpg	green flying street , a phone water stop phone ship .
000000008592.jpg	a that with a off grass soccer riding stop a several of pole .
000000008594.jpg	a that street with couple of a oranges men a back food .
000000008686.jpg	a top umbrella zebra a top , tree of cake .
000000008747.jpg	a that with a off grass soccer stop a phone board .
000000008797.jpg	a game of empty street with a bread .
000000008834.jpg	a wine of pizza group their a bicycle .
000000008933.jpg	a that city a colorful , a bear .
000000009007.jpg	a that stop a several of pole tennis forest with a close .
000000009062.jpg	a standing zebra a skier grass a skier , cake .
000000009069.jpg	a herd rockefeller forest , tree of a river .
000000009112.jpg	a that riding group their vase bicycle zebra motorcycle - .
000000009172.jpg	a top , a snow with couple of a shoes .
000000009381.jpg	a running man of a stove , a cutting
000000009450.jpg	a bench being stop a view , tree of a bread .
000000009497.jpg	a white riding shoe , vase be giraffe a shoes .
000000009648.jpg	a brown shoe with couple of a shoes .
000000009656.jpg	a that stop a tracks pans with shirt box .
000000009679.jpg	a game of mustard two forest , vase sink .
000000009699.jpg	green bite shoe , vase going by motorcycle items .
000000009712.jpg	a engine herd forest , tree of a cutting .
000000009744.jpg	a that pants a clock carrots a refrigerator .
000000009801.jpg	a to forest with a image other train a photograph .
000000009807.jpg	a ball riding its by vase skate tennis street with vase trees .
000000009859.jpg	a white riding shoe by a white carrying .
000000009865.jpg	a to riding bottle with vase on zebra a dirt .
000000009951.jpg	a that riding forest with a image zebra a ball .
000000009960.jpg	a bench being stop a view , tree of a bread .
000000009993.jpg	a stove zebra a video of desktop , cake
000000010008.jpg	a sky zebra a people grass a ball , vase them
000000010037.jpg	a standing of sits zebra a ramp of cell grass a ramp of cell .
000000010041.jpg	a dogs , kites riding with vase trees .
000000010073.jpg	a stove forest , tree of a airplane cutting .
000000010077.jpg	a game of are group station a blue middle .
000000010083.jpg	a river zebra a engine the rockefeller the underneath grass a underneath .
000000010136.jpg	a sky zebra a cutting grass a image
000000010149.jpg	a that with a close resting sits , a through .
000000010229.jpg	a surfboard zebra a chair shoe , vase beach of cake .
000000010248.jpg	a to riding street with vase on zebra a dirt .
000000010393.jpg	a that forest , a red zebra a roof of for .
000000010463.jpg	a that forest , a red zebra a tracks pans .
000000010471.jpg	a wine of are street other train filled table .
000000010484.jpg	a full riding shoe with a wooded other train a shoes .
000000010545.jpg	a hand riding shoe , vase beach of vase middle .
000000010566.jpg	a bicycle area zebra a bicycle area , cake .
000000010727.jpg	a that riding boat a baby to zebra a who .
000000010867.jpg	a hill clear riding , vase beach of a middle .
000000010900.jpg	a standing of sits zebra poster grass table sand .
000000010936.jpg	a male of drink crossing , a served and bread .
000000011107.jpg	a bench being stop a view , tree of a bread .
000000011115.jpg	a that riding forest by a cutting zebra a engine .
000000011262.jpg	a close through zebra a cutting grass a zebras .
000000011297.jpg	a clock street other train a elephants with a bread .
000000011299.jpg	a pots following forest , tree of motorcycle items going .
000000011305.jpg	a into sky zebra a child grass a number
000000011422.jpg	a field area zebra a area , cake .
000000011497.jpg	a frisbee ski stop a dirt with shirt this .
000000011567.jpg	a that stop a phone half , a phone water .
000000011591.jpg	a that forest , a image zebra a engine .
000000011630.jpg	a cutting zebra a engine grass a engine , cake
000000011702.jpg	a that some a full , tree of a sit .
000000011726.jpg	a standing of sits zebra poster grass table sand .
000000011802.jpg	a that riding surface a seat with a split .
000000011825.jpg	a seat street other train a refrigerator with a bread .
000000011849.jpg	a that street with couple of a through zebra a pretty grass a pretty .
000000011856.jpg	green flying street other train filled table , a coffee .
000000011926.jpg	a male of in street other train filled table , a served and bread .
000000011987.jpg	a that riding forest with a power zebra a power .
000000011996.jpg	a that some a hat , tree of a pot .
000000012098.jpg	a kid zebra a school of vegetables with cake
000000012268.jpg	a brown riding shoe with a cup video .
000000012284.jpg	a dogs riding stop a body with vase bicycle .
000000012343.jpg	a that some a brown their a bicycle .
000000012349.jpg	a several of pole grass a several of pole .
000000012370.jpg	a that , a brown riding shoe with a cup video .
000000012424.jpg	a bench being stop a view , tree of a bread .
000000012434.jpg	a that some kites their a trees bus tv .
000000012484.jpg	a top umbrella zebra a top , vase tree of cake .
000000012522.jpg	a frisbee ski stop a bench view , a bread .
000000012529.jpg	a that with a off grass soccer riding street with couple of a pretty .
000000012711.jpg	a that riding street with a sky zebra a ball , vase them .
000000012728.jpg	a pots following forest , tree of motorcycle items going .
000000012757.jpg	a that riding men phone , a phone water .
000000012764.jpg	a to riding his their zebra a camera surfboards .
000000012786.jpg	a ball his , a people zebra a glasses .
000000012824.jpg	a game of during two street with vase tie .
000000012827.jpg	a that with a off grass soccer stop a several of tie .
000000012876.jpg	a metal shoe other train a cup seen .
000000012892.jpg	a hand shoe with a cup video other train a shoes .
000000012897.jpg	a wine of pizza street side a white .
000000012966.jpg	a to riding street , a slicing with vase trees .
000000012996.jpg	a ball forest , a power with a sky .
000000013081.jpg	a that grass down forest by a cutting zebra a engine .
000000013132.jpg	green flying forest , a red with vase on .
000000013145.jpg	a skier grass a skier , a standing .
000000013160.jpg	a sky zebra a child the image the grass a number .
000000013175.jpg	a that riding dining a like , a body .
000000013195.jpg	a bench being towards a view by a boats .
000000013300.jpg	a kid zebra a intersection sports , tree of cake .
000000013320.jpg	a several bird zebra a school of vegetables , cake
000000013336.jpg	a cloudy zebra a photo the counter the grass a desk .
000000013432.jpg	a cloudy zebra a photo grass a photo
000000013471.jpg	green empty two crossing with a bread zebra a lot with vase little .
000000013482.jpg	a ball forest , a image other train a chair .
000000013497.jpg	a full riding forest with vase trees other train a full .
000000013576.jpg	a that grass a down forest , a red with couple of a shoes .
000000013578.jpg	a several kid zebra a wall grass owl ball forest , tree of cake .
000000013616.jpg	a that forest , a brown with couple of a shore .
000000013636.jpg	a ball his , a people other train a watch of women .
000000013832.jpg	a cheese zebra a sails grass a sails , a standing .
000000013843.jpg	green park grass owl large his , a country .
000000013868.jpg	a that some a body their a bicycle .
000000013876.jpg	a white carrying zebra a video of for , cake .
000000013909.jpg	a that street , a snowboard tied zebra kites .
000000013912.jpg	a four bird sign zebra chairs of court single of personal .
000000013916.jpg	a reflection zebra a people the a handle the grass a number .
000000013934.jpg	a white riding passenger their vase be giraffe a next .
000000013995.jpg	a rack city with vase under heart a lot .
000000014004.jpg	a that street with couple of a cutting zebra a standing of sits .
000000014083.jpg	a wine of frisbee flying men a food of light .
000000014103.jpg	a that riding street , a commercial with vase trees .
000000014151.jpg	a dogs , a commercial oven suit a trees bus lake .
000000014159.jpg	green pizza some , vase slice of a building rides sinks .
000000014168.jpg	a to his , a people zebra a glasses .
000000014209.jpg	a that riding street with vase tie zebra a to .
000000014230.jpg	a wine of pizza , kites with vase trees .
000000014276.jpg	a in street other train a elephants with a bread .
000000014278.jpg	a that group their a bicycle zebra a pots - .
000000014285.jpg	a engine riding forest , a cutting with a sky .
000000014297.jpg	a full shoe with a cup video other train a full .
000000014335.jpg	a river zebra a engine the rockefeller the underneath grass a engine .
000000014428.jpg	a that stop a skier with couple of a area .
000000014453.jpg	green beautiful his , a people zebra a ball , tree of displayed .
000000014472.jpg	green pizza group their a bicycle stop wrapped .
000000014484.jpg	a wall surfboard shoe other train a cup seen .
000000014547.jpg	a that with a off grass soccer riding street with vase trees .
000000014567.jpg	a rack city with vase under zebra a under little
000000014600.jpg	a that with a off grass nearby riding stop a colorful .
000000014691.jpg	a air grass owl to street , a bear .
000000014709.jpg	a bench being stop a view , tree of a bread .
000000014740.jpg	a that riding street , a full with vase tie .
000000014757.jpg	a to its small vase photograph of a chair photograph .
000000014769.jpg	a that stop a phone half , a phone water .
000000014819.jpg	a wall - riding forest , a coffee .
000000014855.jpg	a top umbrella zebra a top , tree of cake .
000000014880.jpg	a white riding shoe , vase be giraffe a shoes .
000000014967.jpg	a seat riding street with vase tie zebra a pots bat of tie .
000000014975.jpg	a wine of pizza forest with a sky .
000000014990.jpg	a plane street other train a elephants with a getting .
000000015049.jpg	a standing of sits zebra a ride of sand .
000000015055.jpg	a dogs stop a tracks pans with near box .
000000015113.jpg	a persons riding street , a snowy with vase on .
000000015249.jpg	a building riding street with a bread zebra a refrigerator with vase little .
000000015268.jpg	a that forest by a cutting zebra a fork grass a several of pole .
000000015474.jpg	a to forest , a image with a sky .
000000015518.jpg	green kitchen two street , vase miniature of a slippers .
000000015595.jpg	green someone street with a bread of on .
000000015619.jpg	a that with a off grass soccer stop a flowers glass .
000000015644.jpg	a that riding stop a several of pole with couple of birthday .
000000015690.jpg	green are two street with vase tie giraffe a bat of tie .
000000015709.jpg	a pots following forest , tree of motorcycle items going .
000000015744.jpg	a dogs stop a flowers glass with a sky .
000000015823.jpg	a seat street with a bread zebra a seat with vase little .
000000015826.jpg	a that some a body their a bowl .
000000015883.jpg	a that riding stop a school of chicken .
000000016063.jpg	a that some a brown their a blue middle .
000000016089.jpg	a standing zebra a cheese grass a cheese , cake .
000000016161.jpg	a skier grass a skier two , a cutting .
000000016188.jpg	a stove forest , tree of a cutting other train a several of pole .
000000016254.jpg	a bicycle area zebra a top , cake .
000000016292.jpg	a cheese zebra a sails grass a sails , cake .
000000016295.jpg	a top umbrella zebra a top , tree of cake .
000000016327.jpg	a that street other train a area , a coffee .
000000016383.jpg	a close zebra a zebras the an the pretty grass a pretty .
000000016518.jpg	green are street with a bread zebra a front plane .
000000016683.jpg	a pots remote city with vase under zebra a under little
000000016817.jpg	a that , kites riding street with vase trees .
000000016831.jpg	a that street , a trees bus wood tv .
000000016890.jpg	a kid zebra a school of vegetables with cake
000000016897.jpg	a that stop a tracks pans tennis forest , a them .
000000016995.jpg	a clock street with a bread other train a elephants .
000000017018.jpg	a that grass a down , kites with vase trees .
000000017152.jpg	a cheese zebra a sails grass a sails , cake .
000000017226.jpg	green bite city with vase under with vase under .
000000017425.jpg	green flying street with a into sky men a back food .
000000017683.jpg	a game of swing shoe with a cup video .
000000017810.jpg	a area sitting riding , a bicycle across .
000000017877.jpg	a that forest by a cutting zebra a engine .
000000017883.jpg	a to riding forest , a for surfer .
000000017935.jpg	a that some a hat , tree of a pot .
000000017936.jpg	a ball forest , tree of a cutting other train a engine .
000000018089.jpg	a standing of personal zebra a each line , cake .
000000018090.jpg	a wine of pizza some sub , a bowl .
000000018127.jpg	a bench being stop a view , tree of a bread .
000000018148.jpg	a game of drink two street with a bread .
000000018155.jpg	a to riding his , a child zebra a camera surfboards .
000000018201.jpg	a wine of pizza street , a body .
000000018233.jpg	a reflection zebra a people the a number the grass a number .
000000018333.jpg	a stove forest , tree of a airplane cutting .
000000018367.jpg	a that some a building with a bread .
000000018439.jpg	a hand riding shoe , vase beach of vase middle .
000000018460.jpg	a sky zebra a people the image the grass a number .
000000018476.jpg	a running man of a dogs walking flown zebra a commercial
000000018485.jpg	a red forest with vase toothbrushes of a bread .
000000018490.jpg	a brown shoe other train a shoe brown .
000000018507.jpg	a white riding door baseball a carrying zebra pizza group side .
000000018535.jpg	a bear zebra a bear grass a bear zebra wrapped .
000000018614.jpg	a that street other train a chair zebra a up .
000000018728.jpg	a that with a off grass soccer riding , a commercial .
000000018766.jpg	a metal grass a roof , a coffee .
000000018773.jpg	a baby to zebra a sails grass a sails .
000000018785.jpg	a cheese zebra palm grass palm , a standing .
000000018792.jpg	a wine of are group station a served and bread .
000000018802.jpg	a close zebra a zebras the an the zebras grass zebras .
000000018874.jpg	a wine of bed street other train filled table .
000000018882.jpg	a that some a body their a bowl .
000000018886.jpg	a clock street other train a elephants with a bread .
000000018918.jpg	a close zebra a an grass a an grass a an
000000018938.jpg	a close zebra a zebras grass a zebras .
000000018994.jpg	a flowers glass riding forest , a stacks .
000000019037.jpg	a to his , a people zebra a glasses .
000000019087.jpg	a field area zebra a bicycle area , cake .
000000019093.jpg	a standing of sits zebra a cheese grass a ramp of cell .
000000019145.jpg	a cloudy zebra a counter grass a desk
000000019151.jpg	a running man of a dogs stop a skier
000000019194.jpg	a running man of a roof of sits , a cutting
000000019202.jpg	a area sitting riding , a snow with vase bicycle .
000000019308.jpg	a to riding street other train a to .
000000019391.jpg	a close zebra a zebras the an the pretty grass a pretty .
000000019435.jpg	a white riding passenger their vase be giraffe a shoes .
000000019444.jpg	a that riding men dirt with a bike .
000000019455.jpg	a into sky zebra a child the a child the grass a number .
000000019501.jpg	a that zebra a short riding his their , a people .
000000019544.jpg	a herd river zebra a engine grass a engine .
