image	caption
000000275441.jpg	a that some a metal their a bicycle other train a wall chair .
000000275448.jpg	a that riding some a chocolate full with vase tie .
000000275488.jpg	a wine of pizza forest with a sky zebra a cutting .
000000275496.jpg	a that some a metal their a bicycle other train a outside wall grass owl - .
000000275556.jpg	a that grass a down street with couple of a stand .
000000275625.jpg	a that riding stop a school of chicken .
000000275717.jpg	a that with a off grass soccer zebra a soccer .
000000275722.jpg	a many of a that street with couple of a top umbrella .
000000275758.jpg	a hand horse their a bicycle other train a looking shoes .
000000275781.jpg	a that street with couple of a zebras with a close .
000000275863.jpg	a seat riding street with vase on giraffe a refrigerator .
000000275895.jpg	a colorful city with vase under zebra a under little
000000275929.jpg	a photo zebra a airplane surfer grass a quilt enclosure .
000000275932.jpg	a persons riding street , a country with vase tie .
000000276124.jpg	a that stop a tracks pans with shirt box .
000000276151.jpg	a that street , a bread zebra a dirt .
000000276218.jpg	a running man of a standing of sits , a cutting
000000276254.jpg	a game of mouth two forest , a sit
000000276265.jpg	a that riding street with couple of a pots wine of chicken .
000000276283.jpg	a that street other train a coffee zebra a school of pizza .
000000276386.jpg	a herd lit forest , tree of a cutting .
000000276514.jpg	a ball riding street other train a stand zebra a ball .
000000276554.jpg	a flowers glass forest , a cutting other train a plastic .
000000276559.jpg	a that stop a phone half , a phone water .
000000276750.jpg	a that grass down two street person motorcycle - .
000000276797.jpg	a pots remote city with vase under zebra a under little
000000276798.jpg	a that riding street other train a building .
000000276835.jpg	a that grass a down street with a into sky .
000000276893.jpg	a that riding forest , a people zebra a ball .
000000276895.jpg	a several of pole grass a several of pole .
000000277026.jpg	a pots wine of pizza city boxes with a bread .
000000277032.jpg	a dogs , kites riding with vase trees .
000000277050.jpg	a that stop a dirt with shirt box .
000000277073.jpg	a that street other train a brown zebra a that , vase slice of cake .
000000277080.jpg	a that boat a baby to zebra a skinny .
000000277127.jpg	a seat street with a bread zebra a refrigerator with vase little .
000000277203.jpg	a rack city with vase under zebra a under little
000000277235.jpg	a ball riding its by a skate with a desk .
000000277292.jpg	a white passenger their be other train a next .
000000277331.jpg	a surfboard riding shoe , vase beach of vase middle .
000000277386.jpg	a that with a bench sunny riding stop a view .
000000277418.jpg	a frisbee ski riding boat a cheese , a cutting .
000000277440.jpg	a river zebra a engine grass a engine , cake
000000277496.jpg	a cloudy zebra a photo the counter the grass desk .
000000277563.jpg	a close zebra a an the an the pretty grass zebras .
000000277587.jpg	a reflection zebra a people the a people the a handle the grass a photograph .
000000277821.jpg	a that with a off grass soccer street with couple of a shoes .
000000277852.jpg	a that some a body their a bowl .
000000277999.jpg	a pots remote city with vase under zebra a under little
000000278066.jpg	a that with a owl while riding stop a dirt .
000000278100.jpg	a that grass a down some a brown their a bicycle .
000000278172.jpg	a that with a off grass soccer riding stop a several of pole .
000000278177.jpg	a white riding , vase be giraffe a jacket .
000000278237.jpg	a chair horse their a bicycle other train a racquet around .
000000278238.jpg	a that group their a bicycle zebra a naked .
000000278256.jpg	a that grass down two street other train filled table .
000000278290.jpg	a that riding street , a body other train a to .
000000278359.jpg	a frisbee that forest , a child zebra a engine .
000000278401.jpg	a hand riding shoe by a hand field .
000000278461.jpg	a wine of pizza street side a cutting .
000000278494.jpg	a that with a off grass soccer stop a bench view .
000000278506.jpg	a that street other train a male of drink .
000000278582.jpg	a dogs stop a tracks pans with near box .
000000278601.jpg	a surfboard shoe with a bread other train a bread .
000000278673.jpg	a that grass a down forest , a red .
000000278823.jpg	a bicycle rain zebra a top umbrella grass a top umbrella .
000000278867.jpg	a that with a bread city a colorful .
000000278870.jpg	a seat riding street with vase blue zebra a stopped .
000000278890.jpg	a dogs stop a wearing of gray with near box .
000000278899.jpg	a power zebra a school of for , cake
000000278913.jpg	a dogs city parked vase playing tennis some a commercial .
000000279022.jpg	a bicycle area , a bicycle across zebra a up with vase little .
000000279025.jpg	a male of steps crossing , a served and bread .
000000279071.jpg	a running man of a elephants with a bread
000000279078.jpg	a that street with couple of a cutting zebra a zebras .
000000279104.jpg	a as of catch grass a ramp of cell .
000000279208.jpg	a male of in street other train filled table , a blue middle .
000000279443.jpg	a cheese zebra a sails grass a sails , a standing .
000000279477.jpg	a close zebra a video of one grass a zebras .
000000279632.jpg	a wine of pizza street , tree of a trees bus tv .
000000279649.jpg	a pots following forest , tree of motorcycle items going .
000000279775.jpg	a pots photograph zebra a kid of vegetables grass a top .
000000279844.jpg	a sky zebra a number the a cutting the grass a number .
000000279846.jpg	a dogs riding stop a standing of sits , a cutting .
000000279874.jpg	a white riding door baseball a carrying zebra pizza group side .
000000279879.jpg	a that with a air while grass a phone board
000000279919.jpg	a ball riding his , a child zebra a cat brush .
000000280059.jpg	a building rides sinks riding door a sinks .
000000280069.jpg	a male of drink street , tree of a served and bread .
000000280123.jpg	a several of pole forest , a cutting .
000000280132.jpg	a seat riding street with a bread zebra a lot with vase little .
000000280157.jpg	a red forest with vase toothbrushes of a next .
000000280158.jpg	a that , kites riding street , a snowboard tv .
000000280215.jpg	a that some a pot , tree of a hat .
000000280254.jpg	a that forest by a cutting zebra a engine .
000000280257.jpg	green drink street with a bread of on .
000000280270.jpg	a cutting zebra a school of pole wrapper , cake
000000280338.jpg	a that riding males chicken by a helmet .
000000280340.jpg	a that riding stop a cheese with shirt box .
000000280413.jpg	a top umbrella zebra a top , vase tree of cake .
000000280642.jpg	a full riding with vase tie zebra a full with vase little .
000000280674.jpg	a wine of pizza street side a cutting with a sky .
000000280702.jpg	a cloudy zebra a counter the photo grass a counter .
000000280736.jpg	a persons riding street with vase on giraffe a elephants .
000000280788.jpg	a that with a off grass soccer street with a sky .
000000280865.jpg	a standing zebra a skier grass a skier , cake .
000000280951.jpg	a that with a off grass soccer street with couple of a zebras .
000000280959.jpg	a park to street , tree of a landscape bear .
000000281019.jpg	a cloudy zebra a photo the counter the grass surfing .
000000281066.jpg	a down forest by a cutting zebra a standing of sits .
000000281158.jpg	a that forest , a surfboard zebra a to with vase slice .
000000281163.jpg	a skier riding forest , a cutting other train a ramp of cell .
000000281168.jpg	a cheese zebra a sails grass a sails , cake .
000000281215.jpg	a that zebra a short stop a wearing of gray .
000000281259.jpg	a that group their a coffee zebra a body .
000000281323.jpg	a drink grass a drink two crossing with a bread .
000000281365.jpg	a cloudy zebra a photo grass a counter
000000281377.jpg	a white riding forest , vase be giraffe a next .
000000281583.jpg	a dogs riding forest , a red with vase bicycle .
000000281586.jpg	a that stop a phone half , a phone water .
000000281713.jpg	a cloudy zebra a photo the counter the grass surfing .
000000281790.jpg	green flying forest by a cutting zebra crowd .
000000281809.jpg	a down zebra a walls nearby riding stop a cheese .
000000281829.jpg	a that street other train a that , a bread .
000000281837.jpg	a that with a off grass soccer stop a - .
000000281846.jpg	a that his , a people zebra a to grass a to .
000000281878.jpg	a people zebra a people grass a number , cake .
000000281888.jpg	a bicycle rain zebra a bicycle around grass a bicycle area .
000000281922.jpg	a that riding city a colorful with a bread .
000000282015.jpg	a that , a brown riding shoe , vase beach of vase middle .
000000282048.jpg	a that forest , a red other train a pots top .
000000282070.jpg	a as of sand grass a as of sand .
000000282134.jpg	a that grass a to two forest with a chair .
000000282143.jpg	a holding of fork , a standing zebra a it .
000000282155.jpg	a ball forest , tree of a airplane image .
000000282220.jpg	a bicycle rain zebra a video of pieces shoe with couple of a shoes .
000000282225.jpg	a ski with a bench sunny stop a view .
000000282264.jpg	a dogs group their a bicycle zebra motorcycle - .
000000282283.jpg	a cloudy zebra a counter the photo grass a counter .
000000282287.jpg	a seat riding street with vase blue other train a refrigerator .
000000282293.jpg	a that grass down group their a coffee .
000000282349.jpg	a clock street with a bread of on grass day .
000000282427.jpg	a pots owl full with vase toothbrushes of a lot .
000000282479.jpg	a that street other train a pots plane .
000000282675.jpg	a school of chicken doubles with a elephants .
000000282691.jpg	a pots into sky zebra a pots photograph .
000000282772.jpg	a ball forest , a child with a into sky .
000000282804.jpg	a seat street with a bread zebra a seat with vase little .
000000282855.jpg	a zebras zebra a pretty grass a pretty , cake
000000282878.jpg	a ramp of cell grass a ramp of cell .
000000282934.jpg	a that street other train a white zebra a video of for .
000000282940.jpg	a hand riding shoe , vase beach of vase middle .
000000282957.jpg	green someone street with a bread of on .
000000283180.jpg	a white riding shoe by a carrying zebra pizza street side .
000000283290.jpg	a that riding guitar with vase tie zebra a colorful .
000000283438.jpg	a that riding street with a sky zebra a ball , vase them .
000000283451.jpg	a that stop a camera surfboards with shirt box .
000000283475.jpg	a that with a bench sunny towards a view .
000000283557.jpg	a cheese zebra a deck of a baby to grass a ramp of cell .
000000283586.jpg	motorcycle plane riding street other train a elephants .
000000283624.jpg	a that forest by a cutting zebra a fork grass a brightly .
000000283715.jpg	a running man of a standing of sits zebra poster
000000283757.jpg	a white riding shoe , vase be other train a shoes .
000000283891.jpg	a colorful riding street with vase trees zebra a under little
000000284021.jpg	a dogs stop a line zebra a ramp of cell .
000000284310.jpg	a racquet around by a racquet around by a ostrich bedroom .
000000284406.jpg	a that some kites their a trees bus tv .
000000284418.jpg	a pots - riding with a bread zebra a video of pizza .
000000284494.jpg	a cloudy zebra a counter the photo grass a desk .
000000284507.jpg	a that grass a down two street with vase on .
000000284540.jpg	a fork riding living pizzas with a barrier .
000000284552.jpg	a pots shoes zebra a school of pizza , cake
000000284594.jpg	a persons city suit a elephants zebra a persons , cake .
000000284605.jpg	a ball his , a people zebra a cat brush .
000000284648.jpg	a that some a pot , tree of a hat .
000000284652.jpg	a standing of sits zebra poster grass table sand .
000000284670.jpg	a white riding passenger their vase be giraffe a lot .
000000284835.jpg	green flying with a close zebra a zebras .
000000284930.jpg	a cup seen zebra a skyline , cake .
000000284950.jpg	a that , a brown riding shoe , vase bicycle .
000000285007.jpg	a close zebra a zebras the a cutting the grass a photograph .
000000285024.jpg	a that riding men phone , a phone water .
000000285064.jpg	green pizza men a back food with a into sky .
000000285068.jpg	a pots remote city with vase under zebra a under little
000000285194.jpg	a that stop a flowers glass with a sky .
000000285195.jpg	a hand shoe with a cup video other train a shoes .
000000285212.jpg	a that riding street with a close zebra a to .
000000285220.jpg	a bench being stop a view , tree of a bread .
000000285360.jpg	a that riding forest , a red zebra a metal .
000000285529.jpg	a wearing of chicken , a woman floor other train a racket .
000000285588.jpg	a that with a bench sunny stop a view .
000000285614.jpg	a that riding stop a wearing of gray .
000000285661.jpg	green flying men phone , a phone water .
000000285733.jpg	a ball his , tree of a people other train a ball .
000000285800.jpg	a zebras zebra a pretty grass a pretty
000000285817.jpg	a school of chicken two , a cutting .
000000285820.jpg	a into sky zebra a child grass a number
000000285910.jpg	a into sky zebra a child the a lone grass a number .
000000285929.jpg	a glass riding street with a bread of on .
000000285958.jpg	a ball forest , tree of a zebras with a close .
000000285965.jpg	a to riding street with vase on zebra a dirt .
000000285990.jpg	a dogs , kites riding with vase trees .
000000286042.jpg	a that street other train a white , a white waiting .
000000286044.jpg	a cutting pulled zebra surrounded of sits grass a who .
000000286129.jpg	a that riding tub a light boats , a bread .
000000286153.jpg	a racquet around zebra a area , cake .
000000286159.jpg	a people zebra a school of distance , cake
000000286166.jpg	a that some a building their a bicycle other train a down .
000000286176.jpg	a stove forest , tree of a cutting other train a cutting .
000000286186.jpg	green drink street with a bread of on .
000000286190.jpg	a hand horse their a bicycle other train a looking shoes .
000000286212.jpg	green someone two street with a bread of on .
000000286328.jpg	a dogs stop a cat brush with near box .
000000286386.jpg	green drink two street with a mirror bread .
000000286425.jpg	a that forest , a people zebra a ball , shirt boy .
000000286469.jpg	a flowers glass zebra a nearby , a slicing .
000000286471.jpg	a ball riding its by vase skate with a desk .
000000286583.jpg	a wine of pizza group their a bicycle stop wrapped .
000000286700.jpg	a close zebra a an grass a zebras
000000286774.jpg	a river zebra a engine herd grass a lit
000000286870.jpg	green flying men dirt with a bread zebra day with vase little .
000000286897.jpg	green jump two forest , vase be by vase carrying .
000000286925.jpg	a wine of pizza street , tree of a hat .
000000286939.jpg	a that riding group their vase bear zebra a hat .
000000287187.jpg	a that oven with vase playing tennis some a hat .
000000287221.jpg	a ball riding its by a desk with a desk .
000000287318.jpg	a white riding passenger their vase be giraffe a shoes .
000000287366.jpg	a that forest , a red other train a that .
000000287388.jpg	a game of pizza group their a bicycle stop wrapped .
000000287469.jpg	a that grass a down street other train filled table .
000000287484.jpg	a people zebra a owl mound grass a owl mound
000000287503.jpg	a ball forest , a power with a sky .
000000287535.jpg	a racquet around forest , vase beach of a middle .
000000287550.jpg	a that with a nearby riding tricks , a tracks pans .
000000287559.jpg	a full riding have with vase tie zebra a full with vase little .
000000287560.jpg	a cloudy zebra a photo grass a photo .
000000287682.jpg	a seat riding street with vase on other train a refrigerator .
000000287792.jpg	a that forest , a red other train a white .
000000287849.jpg	a number riding , a cutting with a sky .
000000287872.jpg	a standing of sits zebra a cheese grass a who .
000000287914.jpg	a that riding street with couple of a pots watch of chicken .
000000287967.jpg	a racquet around forest , vase beach of a middle .
000000288000.jpg	a up zebra a elephant - , tree of cake .
000000288021.jpg	a hand horse their a bicycle other train a looking shoes .
000000288032.jpg	a that forest , a red with couple of a shoes .
000000288150.jpg	a that some a body man vase beach of a bowl .
000000288157.jpg	a game of is street other train filled table .
000000288170.jpg	a bicycle rain zebra a racquet around grass a racquet around .
000000288180.jpg	a that stop a phone board , a phone water .
000000288267.jpg	a cutting zebra a school of sits , cake
000000288372.jpg	green someone two crossing with a bread zebra day with vase little .
000000288399.jpg	a air glass group parked a bread of on .
000000288478.jpg	a that stop a racket grass a racket .
000000288486.jpg	a that , kites riding street with vase trees .
000000288507.jpg	a dogs stop a engine grass a engine .
000000288607.jpg	a hand riding shoe with a cup video .
000000288724.jpg	a engine grass a cutting with a sky .
000000288753.jpg	a that forest by a cutting zebra a standing of sits .
000000288765.jpg	a dogs stop a cheese zebra a racket .
000000288841.jpg	green flying with a sky zebra a cutting grass shelf .
000000288874.jpg	a top , a stand with a toaster .
000000288884.jpg	green pizza two street with a sky zebra a ball .
000000288890.jpg	a that riding stop a school of chicken
000000288905.jpg	a close zebra a an grass a an grass a an
000000288964.jpg	a that riding street , a snowboard lake zebra a commercial .
000000288985.jpg	a white riding passenger their vase be giraffe a next .
000000289075.jpg	a that with a off grass soccer riding forest with a close .
000000289097.jpg	a air grass owl ball his , tree of a power .
000000289120.jpg	a that grass a down two stop a line .
000000289170.jpg	a as of catch grass features , a cutting .
000000289201.jpg	a zebras zebra a dogs street other train cake .
000000289238.jpg	a that with a off grass soccer street with couple of a stand .
000000289333.jpg	a school of sand two , a cutting
000000289382.jpg	a that riding forest by a cutting zebra a engine .
000000289400.jpg	a hand shoe with couple of a shoes .
000000289444.jpg	green flying with a bread men light .
000000289535.jpg	a that some a building , a bear .
000000289545.jpg	a number forest , tree of a airplane stacks .
000000289644.jpg	a as of poster grass located , a cutting .
000000289654.jpg	a cloudy zebra a photo the counter the grass surfing .
000000289751.jpg	a up riding shoe other train a red .
000000289754.jpg	a clock riding street with a bread other train a elephants .
000000289790.jpg	a that stop a tracks pans with shirt box .
000000289797.jpg	a that with a off grass soccer forest , a child .
000000289871.jpg	a wine of pizza forest by a cutting zebra sits .
000000289900.jpg	a wine of pizza street side a brown .
000000289966.jpg	a stove forest , tree of a airplane cutting .
000000290024.jpg	a cutting zebra a engine grass a tracks pans
000000290080.jpg	a that some kites their a trees bus tv .
000000290093.jpg	a that street with couple of a oranges with a into sky .
000000290115.jpg	a that some a body their a bowl .
000000290201.jpg	a that riding stop a skier with shirt box .
000000290215.jpg	a wine of frisbee flying street other train filled table , a phone water .
000000290260.jpg	a that grass a down street other train a brown .
000000290282.jpg	a that stop a phone board , a phone water .
000000290314.jpg	a standing of sits zebra a it grass a it .
000000290332.jpg	a wine of pizza street , tree of a trees bus tv .
000000290398.jpg	a that riding boat a cheese by a cutting .
000000290400.jpg	a top umbrella zebra a top , tree of cake .
000000290420.jpg	a river zebra a engine herd grass a engine
000000290423.jpg	a that street , a bread zebra a dirt .
000000290485.jpg	a cloudy zebra a counter grass a desk
000000290489.jpg	a bicycle area zebra a bicycle area grass a area .
000000290521.jpg	a game of empty two street with vase on .
000000290544.jpg	green bite shoe , vase mountain by motorcycle items .
000000290676.jpg	a that grass a down forest by a cutting zebra a engine .
000000290693.jpg	a people zebra a people grass a image with cake .
000000290708.jpg	a pots remote city with vase under zebra a under little
000000290782.jpg	a ball forest , tree of a number .
000000290804.jpg	a that riding street , a snowboarding zebra a power .
000000290866.jpg	a brown shoe with couple of a shoes .
000000291114.jpg	a air grass owl to riding street with vase trees .
000000291182.jpg	a that street other train a school of sits .
000000291280.jpg	a brown shoe other train a cup seen .
000000291321.jpg	a running man of a ramp of at zebra a racket
000000291380.jpg	a ball riding street with vase toothbrushes of a sky .
000000291410.jpg	a ski stop a dirt with shirt box .
000000291541.jpg	a to his , a people zebra a shaped , cake .
000000291582.jpg	a in riding street with a bread zebra a refrigerator with vase little .
000000291599.jpg	a seat street with a bread other train a seat .
000000291683.jpg	a hill clear riding , vase beach of a middle .
000000291752.jpg	a down boat a baby to zebra a sails .
000000292033.jpg	a as of sits zebra a winter grass a winter .
000000292034.jpg	a that with a off grass kites riding street with vase trees .
000000292042.jpg	a that with a air while grass a air while riding men dirt .
000000292055.jpg	a that street other train a rack , a mountain .
000000292133.jpg	a dogs forest by a cutting zebra a standing of sits .
000000292136.jpg	a surfboard horse their a bicycle other train a chair .
000000292156.jpg	a that zebra a short grass a soccer .
000000292157.jpg	a river zebra a engine herd grass a lit
000000292209.jpg	a wall surfboard shoe with a cup video .
000000292226.jpg	a wine of pizza , rope with a cup video .
000000292283.jpg	a brown shoe with couple of a shoes .
000000292312.jpg	green pizza some is , a bear zebra a to with vase little .
000000292315.jpg	a bench being stop a view , tree of a bread .
000000292363.jpg	a holding of at zebra a deck of a holding of at .
000000292387.jpg	a clock street other train a elephants with a bread .
000000292410.jpg	a air grass owl seat street , tree of a served and bread .
000000292464.jpg	green flying two forest by a cutting zebra pole wet .
000000292480.jpg	a standing of sits zebra a cheese grass a ramp of cell .
000000292519.jpg	a that forest , a brown with a cup video .
000000292533.jpg	a school of sand two , a cutting .
000000292587.jpg	a that riding street with couple of a ball .
000000292727.jpg	a bench being towards a view by a boats .
000000292767.jpg	a that riding street with couple of a zebras .
000000292782.jpg	a wine of pizza city boxes , a bear .
000000292923.jpg	a wine of pizza forest side a cutting zebra sits .
000000292973.jpg	a pots remote city with vase under zebra a under little
000000293244.jpg	a owl grass owl remote forest , tree of a airplane them .
000000293271.jpg	a field area riding , a snow with couple of a shoes .
000000293368.jpg	a ball forest , a red with couple of a photograph .
000000293385.jpg	a chocolate airplane cutting zebra a school of together , cake
000000293492.jpg	a bench being stop a view , tree of a bread .
000000293493.jpg	a chocolate owl remote shoe , a bread .
000000293586.jpg	a dogs riding street , a bear zebra a hat .
000000293591.jpg	green someone street with a bread other train a elephants .
000000293668.jpg	a white riding forest , vase be giraffe a next .
000000293720.jpg	a that street other train a surfboard zebra a surfboard , vase slice .
000000293751.jpg	a wine of are street with a bread .
000000293785.jpg	a hand horse their a bicycle other train a looking shoes .
000000293907.jpg	a white riding shoe , vase be giraffe a jacket .
000000293944.jpg	a sky zebra a people grass a number , cake
000000293979.jpg	green flying men phone , a phone water .
000000294051.jpg	green flying forest , a red tricks , a tracks pans .
000000294267.jpg	a pots wii of kitchen with a bread .
000000294349.jpg	a that zebra a nearby , a up .
000000294430.jpg	a down riding stop a phone board , a phone water .
000000294451.jpg	a school of sand two purple carrots a elephants .
000000294541.jpg	a that city a colorful , a bear .
000000294621.jpg	green flying street , a bread men phone .
000000294659.jpg	a that street , tree of a trees bus tv .
000000294663.jpg	a dogs , a commercial with vase trees .
000000294667.jpg	a that riding street , a hat with vase trees .
000000294734.jpg	a as of sits zebra a ride of sits .
000000294758.jpg	a bench being stop a view , tree of a bread .
000000294832.jpg	a cloudy zebra a photo the counter the grass surfing .
000000294853.jpg	a that grass a down street other train filled table .
000000294934.jpg	a having grass a having two , a cutting .
000000294943.jpg	a that street other train a down with a close .
000000294970.jpg	a that grass a down two street with vase trees .
000000294974.jpg	a pots remote shoe , vase going by motorcycle items .
000000295057.jpg	a cutting zebra a school of chicken , cake
000000295106.jpg	a cutting zebra a as of sits , cake
000000295114.jpg	a that some a pot , tree of a hat .
000000295185.jpg	a surfboard zebra a sea shoe with couple of a shoes .
000000295199.jpg	a cloudy zebra a photo grass a counter .
000000295201.jpg	a power zebra a roof of for , cake
000000295286.jpg	a kid zebra a school of vegetables , cake
000000295410.jpg	a bicycle zebra pieces shoe by a racquet around .
000000295578.jpg	a bench being stop a view , tree of a bread .
000000295620.jpg	a that some kites their a trees bus tv .
000000295626.jpg	a runway of a white carrying zebra a white , vase them .
000000295630.jpg	a into sky zebra a child grass a number
000000295728.jpg	a top riding purple carrots a windows with a toaster .
000000295740.jpg	a that some a pot , tree of a hat .
000000295745.jpg	a down stop a having with laying box .
000000295776.jpg	a running man of a camera surfboards , a cutting
